URLS,Headline,Article
/world/europe/news/hurricane-ian-veers-toward-carolinas-3132161,Hurricane Ian veers toward Carolinas,"A resurgent Hurricane Ian yesterday barrelled north toward a second landfall in South Carolina, a day after carving a path of destruction across central Florida that left rescue crews racing to reach trapped residents along the state's Gulf Coast.Ian, which had weakened to a tropical storm during its march across Florida, was upgraded to a Category 1 hurricane as it churned toward South Carolina above the Atlantic Ocean, with maximum sustained wind speeds of 85 mph, the US National Hurricane Center (NHC) said.The hurricane was forecast to hit near low-lying Charleston, South Carolina, about 2:00 pm ET yesterday, bringing potentially life-threatening flooding, storm surges and winds. Hundreds of miles of coastline, stretching from Georgia to North Carolina, were under a hurricane warning.Police in the Isle of Palms yesterday posted a video showing dark skies above rough white-cap waves near the shoreline as gusty winds blew across the beach-front community on a barrier island in South Carolina.The extent of damage in Florida, where Ian first came ashore on Wednesday as one of the most powerful storms ever to hit the US mainland, became more apparent on Thursday as emergency crews began reaching stranded residents. The death toll remains uncertain."
/news/asia/south-asia/news/suspended-pm-can-resume-office-3132151,Suspended PM can resume office,"Thailand's Constitutional Court yesterday ruled Prime Minister Prayuth Chan-ocha had not exceeded the maximum eight years allowed in office, clearing the way for the former coup leader's return from a five-week suspension.""The accused ... has been in the prime minister position not exceeding the limit stipulated by the constitution,"" a judge said in a 25-minute televised reading. ""Therefore he is not disqualified.""The case was brought by the opposition Pheu Thai party, whose government was toppled eight years ago by then-army chief Prayuth.Despite portraying himself as a reluctant leader wanting to hold power only briefly, Prayuth served as prime minister of a junta until an election in 2019, after which parliament chose him to remain premier."
/entertainment/tv-film/news/film-festival-celebrate-amitabh-bachchans-legacy-ahead-his-birthday-3132241,Film festival to celebrate Amitabh Bachchan’s legacy ahead of his birthday,"To mark the momentous occasion of the 80th birthday of the legendary actor Amitabh Bachchan, the Film Heritage Foundation announced a unique film festival titled 'Bachchan Back to the Beginning'.In collaboration with PVR Cinemas, the festival is sated to be one of the grandest film festivals to celebrate the icon through his films. The four-day celebrations will be conducted from 8 to 11 October 2022 in 17 cities, covering 172 showcases and 30 screens across 22 cinema halls all over India. The not-for-profit organization founded by filmmaker and archivist Shivendra Singh Dungarpur has meticulously curated a bespoke collection of eleven blockbuster films that gave birth to one of the biggest superstars of the nation who continues to shine as brightly over 50 years since his debut on the silver screen.Audiences across cities such as Mumbai, Delhi, Kolkata, Bengaluru and Hyderabad to Ahmedabad, Surat, Baroda, Raipur, Kanpur, Kolhapur, Prayagraj and Indore will get the exceptional opportunity to witness the sheer magnetism of the superstar on the big screen through his landmark films such as 'Don', 'Kaala Patthar', 'Kaalia', 'Kabhie Kabhie', 'Amar Akbar Anthony', 'Namak Halaal', 'Abhimaan', 'Deewar', 'Mili', 'Satte Pe Satta' and 'Chupke Chupke'.Amitabh Bachchan shared his thoughts about this celebration. He said, ""I didn't think that I would see a day that all these films from my early career would be back on the big screen across the country. It is a remarkable initiative of Film Heritage Foundation and PVR to showcase not just my work, but the work of my directors, fellow actors and technicians of the time who made these films possible. It brings back an era that is gone, but not forgotten. This is why saving India's film heritage is so important. I hope that this is just the beginning of many festivals that will celebrate landmark films of Indian cinema back on the big screen."""
/weekend-read/news/discovery-may-save-bara-katra-3132221,A discovery that may save Bara Katra,"An exciting new discovery by researchers has raised the hope of saving one of the most important heritage sites of Dhaka – the Bara Katra, a Mughal-era palace built for a prince and later turned into an inn for travellers.The historic stone inscription discovered by Committee for Commissioning Books on Architecture (Dhakar Sthapotto Bishoyok Grontho Pronoyon Committee) is the only testament of ownership of Bara Katra, an ancient site that has been left in neglect and at the mercy of those occupying it.The organisation stumbled upon this precious artefact while researching ancient stone and copper inscriptions found in Dhaka. The stone inscription was found in Bangladesh National Museum and, after examining it, the researchers realised that it was the original stone inscription on the north gate of the palace.During the Mughal era, Bara Katra was used as the caravanserai for travellers and merchants. However, its occupants changed over time. Some of the subadars of the late Mughal era also resided in this palace. 


During the Mughal era, Bara Katra was used as the caravanserai for travellers and merchants. However, its occupants changed over time. Some of the subadars of the late Mughal era also resided in this palace. The inscription clearly declares Bara Katra and the 22 shops adjacent to the palace as 'waqf' property.Waqf property is an inalienable charitable endowment under Islamic law. Eminent architectural historian and president of Arch Asia, a representative body of Asian architects, Professor Dr Abu Sayeed M Ahmed said, ""According to the law, waqf property can never be owned by any individual. The stone inscription of the northern gate of Bara Katra testifies that Bara Katra is in no way a private property.""However, the current occupants of Bara Katra are claiming that they are owners of this historic place.According to the Committee's research, renowned author, researcher and chronicler Hakim Habibur Rahman obtained the historic stone inscription at the end of the British Raj era. However, Rahman and his son never revealed anything about this precious collection before handing it over to the national museum.""The committee has identified the historic stone inscription as a part of its research work. The committee has further discovered four stone inscriptions about Dhaka currently stored in different museums which were also considered lost,"" Professor Dr AAMS Arefin Siddique, chairman of the committee and former vice chancellor of Dhaka University, told The Daily Star.A team of researchers led by Mawlana Muhammad Nuruddin Fatehpuri identified these lost artefacts and deciphered the Arabic, Persian and Urdu inscriptions.According to sources, two stone inscriptions were attached to Bara Katra's two main gates. The inscription on the southern gate stated the year of its construction and the northern gate's inscription was about the endowment of the property.While the northern gate has become dilapidated, the southern gate of Bara Katra remains comparatively intact.There is a 18-line poetry written in Nastaliq script in the stone inscription that mentions the construction year of the palace. The inscription was engraved in 18 different black stone tablets which were attached around the dome of the southern gate of the palace.The stone inscription of the northern gate of the palace was written in prose, in Tughra script. In this script, Abul Qashim Al Hussaini Attabatayi Assemani is named as the architect of the palace.The transliteration and translation of the stone inscription of the northern gate were first published in Charles D'Oyly's book 'Antiquities of Dhaka' in 1822.While the stone inscription was in the national museum, it was assumed that it was lost. The fragmented pieces of it were preserved in two wooden frames separately, preventing researchers from deciphering them. Renowned historian Syed Muhammed Taifoor published a book titled 'Glimpses of Old Dhaka' in 1956 where he stated that the stone inscription of the northern gate of Bara Katra was lost. Other historians, referring to Taifoor have also confirmed that the inscription was lost.As part of discovering Dhaka's history, the committee studied many stone inscriptions preserved in the museums of Bangladesh and West Bengal. During their study, they reviewed the documents about stone inscriptions preserved in the Bangladesh National Museum and contacted the family members who had donated the inscriptions.In this process, they came to know that the stone inscription preserved in the museum was the actual stone inscription of the northern gate of Bara Katra.According to Bangladesh National Museum records, Hakim Irtizar Rahman Khan, the eldest son of Hakim Habibur Rahman Khan donated the stone tablet with the inscription, to the museum on April 14, 1967. It was fragmented into 12 small pieces. Hakim Irtizar Rahman Khan died on July 30, 1980.""If the fragments of the stone tablet preserved in the museum can be arranged sequentially, then the inscription can be deciphered easily,"" Mawlana Muhammad Nuruddin Fatehpuri said while explaining why it took so long to find it.Renowned photographer Mahfuzur Rahman Khan, in a 2015 interview, told the committee that his grandfather Hakim Habibur Rahman Khan collected that stone inscription and his father, Hakim Irtizar got the inscription from his father. However, they could not give any information about how Hakim Habibur Rahman Khan obtained the stone inscription.The inscription, written in Persian, read, ""Sultan Shah Shuja dedicated himself to different types of charitable activities. Abul Qashim Al Hussaini Attabatayi Assimani endowed this holy place and 22 of its adjacent shops as Waqf. And, according to Islamic laws, he stated a specific condition-that the trustee of the property will spend all the earnings from the property and the adjacent shops for the maintenance of the building and for the welfare of the poor. If an impoverished person arrives here, the person shall be offered free accommodation and shall not be charged for any services so that the trustee will get the rewards on the Day of Judgement. If anyone violates this condition, the person will be held accountable on the Day of Judgement. The engraver of the inscription is Sa'duddin and the inscription was engraved in 1055 Mohammedan Year."" (Translated from Persian to Bengali by Muhammad Nuruddin Fatehpuri)
Hakim Habibur Rahman authored a number of books on Dhaka. However, none of them carries any reference to the stone inscription of the northern gate of Bara Katra.
According to researcher Hashem Sufi, Hakim Habibur Rahman collected stone inscriptions from various places in Dhaka and donated them to museums.
During the Mughal era, Bara Katra was used as the caravanserai for travellers and merchants. However, its occupants changed over time. Some of the subadars of the late Mughal era also resided in this palace. Nawabs of Dhaka also used it as their residence before the construction of Nimtali palace. At one point, the palace became a shelter for homeless people.
At present, the southwest part of the palace is being used as a madrasa and the southeast part of the palace is occupied by local goons. They have built numerous shops, factories and warehouses and destroyed much of the original structure of the palace.
Recently, one of the current occupants started to demolish one of the remaining parts of the palace. Fortunately, on September 11, Rakhi Roy, regional director of the department of archaeology, and his team stopped them. Later, Barrister Sheikh Fazle Noor Taposh, mayor of Dhaka South City Corporation paid a visit to Bara Katra and Chhoto Katra. Director General of the directorate of archaeology Ratan Chandra Pandit and architectural historian Professor Dr Abu Sayeed M Ahmed also accompanied him.
 







A staircase in the northern wing of Boro Katra. Photo: Prabir Das 
""Bara Katra must be preserved under government custody. It can be given to the custody of the city corporation or the district administration or even to the directorate of archaeology. But it cannot be handed over to any individual,"" the DSCC mayor said during the visit.
He acknowledged that negligence of government agencies has allowed the palace to be damaged and promised to preserve it.
Professor Dr AAMS Arefin Siddique welcomed the mayor's visit and commitment.
""Bara Katra and Chhoto Katra are two of our greatest heritages and archaeological assets of Dhaka. We should not change their original structure in the name of renovation and modernisation. Renovation works should be done under the supervision of an expert committee so that the original structure of the building can be maintained,"" he said.
Ratan Chandra Pandit, director general of the directorate of archaeology explained the challenges of preserving the structure to The Daily Star.
""The directorate of archaeology is responsible for the maintenance of Bara Katra. However, it is not the current owner of the land of Bara Katra. Whenever our officials go to renovate the structure, they face strong resistance from the current occupants. The archaeology department took an initiative to acquire the land of Bara Katra in 2009, but it failed. We will take another initiative to acquire the land. We have the expertise and resources to preserve and maintain Bara Katra but we need cooperation from the City Corporation, district administration, waqf administration and local people,"" he added.
Tarun Sarkar is a freelance journalist and researcher.
The inscription, written in Persian, read, ""Sultan Shah Shuja dedicated himself to different types of charitable activities. Abul Qashim Al Hussaini Attabatayi Assimani endowed this holy place and 22 of its adjacent shops as Waqf. And, according to Islamic laws, he stated a specific condition-that the trustee of the property will spend all the earnings from the property and the adjacent shops for the maintenance of the building and for the welfare of the poor. If an impoverished person arrives here, the person shall be offered free accommodation and shall not be charged for any services so that the trustee will get the rewards on the Day of Judgement. If anyone violates this condition, the person will be held accountable on the Day of Judgement. The engraver of the inscription is Sa'duddin and the inscription was engraved in 1055 Mohammedan Year."" (Translated from Persian to Bengali by Muhammad Nuruddin Fatehpuri)Hakim Habibur Rahman authored a number of books on Dhaka. However, none of them carries any reference to the stone inscription of the northern gate of Bara Katra.According to researcher Hashem Sufi, Hakim Habibur Rahman collected stone inscriptions from various places in Dhaka and donated them to museums.During the Mughal era, Bara Katra was used as the caravanserai for travellers and merchants. However, its occupants changed over time. Some of the subadars of the late Mughal era also resided in this palace. Nawabs of Dhaka also used it as their residence before the construction of Nimtali palace. At one point, the palace became a shelter for homeless people.At present, the southwest part of the palace is being used as a madrasa and the southeast part of the palace is occupied by local goons. They have built numerous shops, factories and warehouses and destroyed much of the original structure of the palace.Recently, one of the current occupants started to demolish one of the remaining parts of the palace. Fortunately, on September 11, Rakhi Roy, regional director of the department of archaeology, and his team stopped them. Later, Barrister Sheikh Fazle Noor Taposh, mayor of Dhaka South City Corporation paid a visit to Bara Katra and Chhoto Katra. Director General of the directorate of archaeology Ratan Chandra Pandit and architectural historian Professor Dr Abu Sayeed M Ahmed also accompanied him.""Bara Katra must be preserved under government custody. It can be given to the custody of the city corporation or the district administration or even to the directorate of archaeology. But it cannot be handed over to any individual,"" the DSCC mayor said during the visit.He acknowledged that negligence of government agencies has allowed the palace to be damaged and promised to preserve it.Professor Dr AAMS Arefin Siddique welcomed the mayor's visit and commitment.""Bara Katra and Chhoto Katra are two of our greatest heritages and archaeological assets of Dhaka. We should not change their original structure in the name of renovation and modernisation. Renovation works should be done under the supervision of an expert committee so that the original structure of the building can be maintained,"" he said.Ratan Chandra Pandit, director general of the directorate of archaeology explained the challenges of preserving the structure to The Daily Star.""The directorate of archaeology is responsible for the maintenance of Bara Katra. However, it is not the current owner of the land of Bara Katra. Whenever our officials go to renovate the structure, they face strong resistance from the current occupants. The archaeology department took an initiative to acquire the land of Bara Katra in 2009, but it failed. We will take another initiative to acquire the land. We have the expertise and resources to preserve and maintain Bara Katra but we need cooperation from the City Corporation, district administration, waqf administration and local people,"" he added.Tarun Sarkar is a freelance journalist and researcher.
"
/satireday/news/bcb-chief-angry-team-failed-prepare-fail-3132201,"B,CB chief angry as team failed to prepare to fail","The chief of Board, Cricket Board (B,CB) was reportedly livid after the national team went to the Middle East and won both matches against lower-ranked opposition.  The Team beat United Dictatorships of Sandyland (UDS) in two T20Is that were supposed to be preparation for this month's T20 World Cup in Australia.""Listen, I believe in preparing properly. I said earlier that they [the Team] would go to Australia as part of a study tour, to get learnings for the next T20 World Cup,"" B,CB President Kamrul Kaman Phappa told reporters during a press conference in his bedroom.""You have heard of the old adage, 'You learn more from defeats than you do from victories'. I have a long-term vision. Our team will lose so much, day in day out, home and abroad, in Tests, ODIs and T20Is, that one day they will become the most wisdomous cricket team in the world.""Then, you will see, this team will be world champions. That is also what Jamshed Mahmud Hahaha meant when he said we can be world champions,"" Phapa said.The Team went to UDS and almost succeeded in losing their first match against a team that rarely plays top-class opposition. UDS's lack of exposure to non-top-class opposition continued with the series against the Team.But in the second match, the Team beat UDS by a handy margin, and this is what infuriated Phappa.""We sent them there for a confidence boost, so that they learn that no matter how inexperienced the opposition, they can still lose. But okhantay, they ended up winning 2-0. What is the use in sending them business class to a country if they are only going to win. I admit that they tried hard to fail in the first match. But it was a shameful display in the second game.""I have worked so hard to not work hard, so that the Team can gain valuable knowledge from losing. I have instructed groundsmen to prepare poor pitches, I have ensured that there is absolutely no development in domestic cricket, and this mostly works. The Team loses most of the time.""If there is one thing I can't stand, it is winning. It gives me sleepless nights,"" Phappa said, switched off the bedside lamp and went to sleep to the white noise of the hum of cameras and murmurs of reporters."
