URLS,Headline,Article/rohingya-influx/news/myanmar-conflicts-hurting-bangladesh-3132071,Myanmar conflicts hurting Bangladesh,"Conflicts in Myanmar intensified after the military coup on February 1 last year, as pro-democracy activists, the armed wing of National Unity Government and three dozen ethnic armed groups began fighting the junta.The Arakan Army, which was maintaining a ceasefire since November 2020, engaged in conflicts with the military from the middle of this year.The conflict has escalated to the point that there have been instances of mortar shells landing on Bangladesh's side of the border.Given that Bangladesh has been negotiating for repatriation of around one million Rohingya refugees, the conflict has serious implications on Bangladesh and beyond, analysts say.They observed that the Myanmar military is losing the public trust it enjoyed for decades. The junta has also become weaker while fighting the combines of the NUG's armed wing Peoples' Defence Force and ethnic armed groups that have been fighting for autonomy.Now, armed groups have become stronger and are stepping up their battle for full autonomy.The Arakan Army has been able to control administration in much of Rakhine State and is now desperate to take full control of the state, which is strategically important due to its proximity to the Bay of Bengal, they observed.Shahab Enam Khan, professor of international relations at Jahangirnagar University, said the junta also could not deliver on the five-point ASEAN consensus, including ending violence and restoring democracy. Also, the economy is suffering, and that is affecting Rakhine, already a cash-starved region.Harvard University Fellow Anu Anwar, an expert on Myanmar and China, said the Myanmar military had for decades been able to maintain territorial integrity despite being in a civil war with various armed groups.""What is new is the addition of new rebel groups, intensification of fighting in Arakan, and the emergence of NUG's armed wing. Most importantly, [there is] a tacit consensus among major armed groups on a common enemy -- military junta. Therefore, certainly this time the challenge is much greater.""Free Rohingya Coalition Co-founder Nay San Lwin, who is based in Germany, said the Burmese youths are much more united now against the Myanmar junta -- a reality that reflects the unity among the wider public of Myanmar. He thinks in the long run, the military will not last.Prof Shahab Anam said Myanmar is moving towards massive chaos as the military is failing to properly handle the situation. Eventually, chaos may lead to disintegration of Myanmar, he said.The intensified fighting will severely affect Myanmar's economy, which is already in a bad shape after the Covid-19 pandemic and supply chain disruptions amid the Russia-Ukraine war. Hundreds of thousands of people have been displaced by the conflicts across Myanmar, while several thousands were killed.Prof Shahab said so far, mostly the Rohingyas have been the victims of conflicts in Rakhine State, but now Rakhine Buddhists are also becoming victims. Therefore, there is a real possibility of displacement of hundreds of thousands in Rakhine State.In that case, Bangladesh and Myanmar's other neighbours have reasons to worry.Anu Anwar said the intensified fighting certainly accelerated the possibility of disintegration.He said geo-strategically, Myanmar connects South and Southeast Asia with the Bay of Bengal. For economic, connectivity, and geopolitical reasons, regional powers such as Japan or India and superpowers like the US, China and Russia take a greater interest in Myanmar affairs.""A conflict in Myanmar will have multidimensional effects on the regional geopolitics…""Bangladesh, in particular, will be the primary victim of any conflict in and around Myanmar. A turmoil in Myanmar will not only increase the chances of a fresh influx of Rohingyas but also create the real possibility of an active conflict between two armed forces along the Naf River.""Anwar said there has never been any real hope of repatriation regardless of the regime in Naypyitaw. Not a single leader in Myanmar has ever taken meaningful initiative towards reparation.The only time Myanmar has taken the Rohingya issue seriously was in 1978, when the government of Bangladesh made a credible threat that unless Myanmar took back their people, Bangladesh would arm Rohingyas, and if necessary, Bangladesh's military would launch a pre-emptive strike against Burma. Since then, Bangladesh has pursued only diplomatic means, but that has produced no substantial results as the number of Rohingya refugees only increased, he said.""A fresh crackdown in Rakhine will not only tarnish the dying hope of repatriation but will generate a real possibility of a further influx of millions of Rohingyas into Bangladesh.""Shahab Enam Khan and Naw San Lwin said Rohingyas will not be willing to return to Myanmar when conflicts are escalating there.The experts said Myanmar's violation of territorial sovereignty and Rohingya repatriation are separate issues and should be dealt with separately.Anu Anwar said defending the land, air, and maritime boundary of a country is the duty of the armed forces.Shahab said Bangladesh should have deployed troops for deterrence and strongly raised Myanmar's violation of sovereignty with the UN.""Bangladesh needs to build a coalition of countries that support Bangladesh to mount pressure on Myanmar and work for Rohingya repatriation,"" he said, adding that bilateral negotiation is not working anymore.Nay San Lwin thought the same.Shahab Enam said Myanmar faced various sanctions because of the genocide against Rohingyas and military coup, mainly from western countries. Now, despite good relations, world powers like China and Russia, and even Japan, India and ASEAN are feeling uneasy about Myanmar.But it is likely that Myanmar's resources will still continue to attract them more than those of Bangladesh, he said.Anu Anwar said Beijing and Moscow provided cushion for the junta, which is nothing new. However, the new aspect is that world support for Bangladesh has increased in a dramatic fashion over the last few years.""Myanmar's isolation is a win for Bangladesh if Dhaka is able to seize the opportunity,"" he said."
/weekend-read/news/the-colourful-history-bara-katra-3132216,The colourful history of Bara Katra ,"""Katra"" is a Persian word that means caravanserai or roadside inn. Multiple katras were constructed during Mughal and Nawabi eras in Dhaka. Of them, Bara Katra and Chhoto Katra are mentionable.According to historians, Bara Katra was constructed in 1643-1644 CE/ 1053 AH by Abul Qashim who was ordered by the then subadar (Mughal provincial governor) prince Shah Shuja. Shuja constructed it for his official residence. However, the Mughal prince did not like the palace and donated it to Abul Qashim who converted it into a caravanserai. The palace was endowed for charitable purposes in 1645-46 CE/ 1055 AH.Bara Katra was located in between the Buriganga River and Chawk Bazaar. The river used to flow along the southern side of the palace even three centuries after its construction. The flow of the river was diverted due to the construction of an embankment to protect Dhaka from annual flooding. Later, human settlements mushroomed along the embankment and all around the palace. At present, the Bara Katra is located at Bara Katra Lane in Ward number 30 of Dhaka South City Corporation.Bara Katra is an ideal depiction of the Mughal architectural style. The two-stoey building was erected around an open rectangular courtyard. The palace overlooks the Buriganga River. There were two gates on the southern and northern corners of the palace and two small gateways on the western and eastern sides. "
/star-literature/news/the-hangings-victoria-park-3132191,The Hangings at Victoria Park,"Dhaka, 1857          If they'd been in Delhi or Meerut or Lucknow, maybe they'd see and hear a different story. If they'd fought at Kanpur they'd at least have had a chance to prove themselves. Here in Dhaka, inside this unfinished dream of a grieving father, another of the Mughal breed, all they could do was wait – wait to be disarmed, as word had had all hackles raised that British marines were on their way to take away their guns.Of course that bastard Nawab Abdul Ghani sided with the British, of course he did. What else to expect from a line of thieves that let the British in to begin with. Royal charter. Trading firm. One clot of bandits making blood deals with another. The age-old order of things.Sharif had been listening to a huddle of his comrades for the last endless hour, spinning the same few thoughts around and around like a thrashing, dying chicken. They'd called his name a few times to get him in on the nonsense, but he ignored them and closed his eyes. Their plans of doing this and doing that when they finally shed the Company's uniform would be laughable if he didn't actually pity them for it.He'd drifted off. In a gauzy dream Usha came to him, beckoning. That was all he wanted, to answer her summons. Life would be complete. He'd left home to get away from the vipers of his squabbling clan. His brothers tearing at each other over square inches of land, their wives in a battle of their own hurling curses, spitting spells. Thank God, his parents were gone. Dead no doubt from anguish, but out of the fray, God-willing better off. Usha, the one, the only, his sole reason to make it out alive.""Rise and shine, Subhedar Qureshi, rise and shine."" The gently mocking tone split the night to blinding day. Sharif smelled them before he saw them, not needing to open his eyes even fully to know what he would see. The house, the paltry yard, the remnants of the fire, Sharif's money, still on the ground where he'd laid it at the old man's feet, were surrounded by white faces, one of whom, the one with the morning's greetings, held the rifle Sharif had dropped somewhere along the way. ""Rise and shine, Subhedar Qureshi, rise and shine."" The gently mocking tone split the night to blinding day. Sharif smelled them before he saw them, not needing to open his eyes even fully to know what he would see. The house, the paltry yard, the remnants of the fire, Sharif's money, still on the ground where he'd laid it at the old man's feet, were surrounded by white faces, one of whom, the one with the morning's greetings, held the rifle Sharif had dropped somewhere along the way. A roar, a train out of control, thunder barreling across the heavens, and he was pulled to his feet, barely getting purchase before he tumbled, and smacked against a snarling white face. The horde of them were here and up ahead a dust storm kicked up by scuffling boots and dragging bodies had the world obscured. Sharif was sure his dream of Usha had slipped into a nightmare choked with British marines, that he wasn't actually awake and stumbling around for balance while the marine barked and tussled with him. But he was wide awake, had gotten to his feet, had shouted back that he was not laying down arms. The huddle of fellow sepoys had done the same, defied orders to surrender and Sharif blind with sleep and fury had charged into the fray.Looking him up and down the old farmer frowned.""You ran here from Dhaka?""""I've been running for days.""""Why?""""To get away from people.""The old man may have rasped a laugh, it was impossible to tell, the sickness in his chest a sucking void. He'd not believed Sharif was who he said he was.""Qureshi? The Qureshis? You? Looking like that?""""I'm a sepoy.""""I can see that. Which then? Qureshi or sepoy?""""Both.""""Go from here."" The farmer started closing the door.From inside a boot Sharif produced a wad of cash.""Are you trouble?""""Only for myself. Please,"" Sharif counted out enough to pay the farmer's taxes for the year and the ones in arrears.""You look thirsty,"" the old man said.Sharif watched him and a young boy that had appeared out of the miserable hut build a fire, sipping water from an earthen cup. The night was cool. Neither the farmer nor the boy had more than rags to keep them warm. The boy had eyed Sharif's uniform several times with pupils brightly alert in a face that was dead before its time.The farmer was the boy's grandfather. The boy's father, mother, and older brother had been killed by their landlord's overseers. The old man and the boy were spared to keep on working, paying the taxes. Gnarled from shoulders to ankles, the old man often shook with pain, and the boy could barely stand for lack of food.Sharif held out the rest of the money, which the farmer noted but didn't reach for. Sharif placed it at his feet.The boy tugged at Sharif's elbow. He led him to the darkness of the surrounding fields and pointed at the night.""Okay, I'll leave,"" Sharif said.""No,"" the old man said. ""That's not it. He wants you to look.""There was nothing but a starless, moonless sky and land unknown to him. The boy kept pointing, like a command to run.""I see nothing.""""They're out there, under the soil. He wants you to know. His family.""Appeased enough, the boy left Sharif and returned to the old man's side and warmed his hands by the fire mirroring how the man held his.""What is a rich man's son doing in the Company's army? Can't think of a better way to die?""""I didn't want to be a rich man's son.""The old man stared at the fire, the fire glinting double in his tired but alert eyes. The same eyes as the boy's.""You're landlords, you Qureshis.""""Yes.""""Big ones.""Sharif said nothing.""How do you treat your people like me?""""We should do better.""Later, after the man and boy were asleep, Sharif went the way the boy had pointed with a lantern. A breeze stroked the back of his neck, teased and threatened the lantern flame. Fifty or so feet later, Sharif stopped and made a circle with the light held above his head. He would think there would be some disturbance on the ground, earth interrupted, to indicate the graves. The lantern was pointless. The night was too fiercely dark to let it shine on all it hid.When he walked back to the house he saw that he hadn't gone that far, maybe a hundred yards. He killed the lantern and sat with his back against the house, looking out in the direction he had come from hours before.He went in and out of sleep, the state of being in neither one nor the other bringing Usha and taking her away over and over, making him start awake each time and finding that she wasn't there after all, that the veil had fallen again and again between the place of dreaming and the real.""Rise and shine, Subhedar Qureshi, rise and shine."" The gently mocking tone split the night to blinding day. Sharif smelled them before he saw them, not needing to open his eyes even fully to know what he would see.  The house, the paltry yard, the remnants of the fire, Sharif's money, still on the ground where he'd laid it at the old man's feet, were surrounded by white faces, one of whom, the one with the morning's greetings, held the rifle Sharif had dropped somewhere along the way.They called it a trial. There was a woman, the sole woman. None of the men could figure out her crime – anymore, for that matter, than they could their own. But one more time today, the judgement was in their hands. Their laws, allowing them to call the sepoys' Rebellion Mutiny. One more time, as the hood darkened Sharif's eyes, there was Usha, in a flash, among the throngs watching the gallows at the park.  Nadeem Zaman is the author of the novel In the Time of the Others (long listed for the 2019 DSC Prize in South Asian Literature) and the story collection Up in the Main House & Other Stories. His fiction has appeared in journals in the US, Hong Kong, India, and Bangladesh."
/youth/education/news/teachers-public-univs-worktime-set-40-hours-week-3132066,Teachers at public univs: Worktime set at  40 hours a week,"A public university teacher will have to work 40 hours a week. Of this period, 13 hours must be spent on providing direct lessons to students on average.This has been stipulated by a policy, drawn up by the University Grants Commission in order to fix the teaching workload of all faculty members of the public universities.The policy titled ""Teaching load calculation policy for public university teachers"" has been prepared to keep teachers on the campus for a longer period and determine how many teachers are needed for a particular university for proper education and research.Under the policy, a professor's direct teaching hour will be 10 hours, an associate professor's 12 hours, an assistant professor's 14 hours and a lecturer's 16 hours, said UGC officials.Besides lecturing at classes, each teacher will have to conduct student counseling for one hour per week.UGC officials said once the policy comes into force next week, teachers' stay on the campus and their engagement with students will increase significantly.The policy will be sent to all public universities by next week.According to officials, there are allegations that many public university teachers do not spend enough time on the campus, and teach at private universities instead. Many even take classes at five-six private universities. Some of them spend time on consultancy jobs.""We hope that public university teachers will stay at the campus for a longer time following the implementation of the policy,"" said Ferdous Zaman, secretary of UGC.He said that a UGC meeting on Tuesday finalised the policy.Commission officials also said that sufficientnumber of teachers is essential for ensuing proper educational and research activities at public universities. The policy has been devised to ensure this. It will also be helpful in determining the number of teachers needed for any particular university.""Following the implementation of the policy, it will be easier to determine how many teachers will be required for the higher education institutions. In addition, this policy will play an important role in preparing organograms of different departments of universities. Renowned academicians have cooperated with the UGC in formulating this policy,"" said Prof Dil Afroza Begum, acting chairman of UGC.There are 15,500 teachers at 53 public universities. About 3.50 lakh students study at 50 of those universities.In the policy, a teacher's weekly 40 work hours has been divided into two parts -- Contact Hours and Non-Contact Hours. The 40 hours included five hours for prayers and lunch break.Under the Contact Hours, a teacher will have to deliver lectures at the classroom, give lessons at practical classes, hold tutorial classes, and supervise projects, internships or thesesof students for 13 hours per week.A teacher's Non-contact Hourswould cover preparation of course materials, conducting research, writing articles and books, preparing questions, evaluating exam answer scripts and attending academic and administrative meetings.The policy says that the Contact Hoursfor the head of a department and institution will be six hours.Universities will be able to apply to the UGC for having 20 percent additional teachers for a particular department or institute, if there is a possibility of disruption in educational activities due to study leave of a large number of teachers, it adds.Universities will file such applications based on teaching load calculation of a particular department or institution.According to the policy, if the number of teachers working in a particular department is found bigger after calculation of teaching load, the additional number of teachers will continue in their jobs till retirement.UGC Secretary Ferdous said there were serious problems regarding determining how many teachers were needed due to absence of a policy.""We have seen that 10 teachers were recruited against the requirement of five. In other cases, five teachers were appointed against the required 10,"" he said.UGC officials said a policy of workload of teachers at Indian universityis in place. A full-time teacher's working hours should not be less than 40 hours a week for 30 working weeks in an academic year, and the teacher must be available for at least five hours daily in the university/college.Under the policy, professors and associate professors need to give 14 hours of direct teaching per week, whereas for assistant professors the requirement is 16 hours.Prof Nizamul Hoque Bhuiyan, general secretary of the Federation of Bangladesh University Teachers Association, said they would be able to comment on whether the policy was bad or good only after it came into force.""We have to improve the quality of education and the international rankings of the universities. To achieve these goals, we will need to conduct innovative researches and introduce research-oriented education…if we can use the working hours positively, it will be good for us,"" said Nizamul, also the general secretary of Dhaka University Teachers Association."
/news/bangladesh/news/funeral-ranesh-maitra-held-state-honour-3132106,Funeral of Ranesh Maitra held with state honour,"The funeral of Ekushey Padak-winning journalist and columnist Ranesh Maitra was held with state honour in Pabna yesterday afternoon. A veteran of the Language Movement and Liberation War, Ranesh breathed his last on September 26. He was 89.Around noon yesterday, his body reached his Beltola road house from Dhaka where family members, relatives and well-wishers gathered to pay their respects.His body was then taken to Pabna Rafikul Islam Bokul Independence Square around 2:00pm where people from all strata of life placed flowers at his coffin.Deputy Speaker advocate Shamsul Haque Tuku, lawmaker of Pabna-5 constituency, and Golam Faruk Khandaker Prince, deputy commissioner in Pabna, were present. Later, the body was taken to Pabna Press Club where his fellow colleagues paid tributes to him and commemorated his role in establishing the press club.Afterwards, his body was taken to Pabna Mohashashan for his last rites.Born on October 4 in 1933, Ranesh entered political arena during the Language Movement. A key organiser of Bangladesh Chhatra Union, he later joined the National Awami Party (NAP) and the Gonoforum. Ranesh organised valiant freedom fighters during the Liberation War. He went to India for arranging training for freedom fighters.He spent years behind bars during the East Pakistan period and independent Bangladesh for fighting injustice. Ranesh started his career in journalism in 1951 with ""Nawbelal"", a weekly paper of Sylhet.After serving Indian newspaper the Sottojug, he joined the Daily Sangbad in 1955. He worked for the Daily Morning News since 1961 before joining the Daily Observer in 1967, where he served until 1992.The veteran journalist then joined the Daily New Nation as the country editor. He worked for The Daily Star from 1993 to 2000.The journalist was awarded Ekushey Padak in journalism in 2018. He received many other awards. "
/news/bangladesh/accidents-fires/news/ssc-student-drowns-khulna-3132306,SSC student drowns  in Khulna,"An SSC student who had epilepsy drowned while bathing in a pond in Koyra upazila of Khulna yesterday.Priya Majhi might have had a seizure while she was in the pond and this was probably what caused her to drown, said local union parishad member Moni Roy, quoting the family members.She was the daughter of Nitish Majhi of Khoralkati village."
/satireday/news/police-now-100-against-crime-3132206,Police now 100% against crime,"After months of deliberation, the police force of Beka City has finally come to the decision that they are now 100 percent against crime. The capital's chief of police had this to say regarding the new revelation: ""It's always been really hard, you know? It will still be very hard, going forward. And I can 100 percent confirm it is not because of drugs. But, how do you tell what's a crime? Like where's the rulebook? Plus, even if there was one, who's to say if a crime equals injustice? Also, does something need to be a crime before I can start tapping someone's phone or going through their Snapchat? Regardless, we will do our best to rid this city and country of crime very soon,"" said Bokul Ahmed. When informed by the field reporter that the legal definition and rules for what constitutes a crime are written in law, and then further questioned regarding the aforementioned ""suspicious investigations"", our field reporter was immediately arrested on the spot by the chief. The chief also looked straight into all the cameras while forcefully handcuffing our colleague -- at the time of writing this article, he is now a former colleague, as he has already been sentenced to prison without bail. ""You're under arrest for obstruction of justice,"" screamed Bokul, ensuring that all other media personnel were aware of what was going on. He once again gave a deathly stare into the camera before adding, ""And with this, crime just got a little lower in this town."" Former super court judge and current minister of home affairs jointly released a statement following the events.  ""This transition has not been easy. We've always put the people first, and now we are going to put them a little further ahead. Also, going through all of these laws is crazy! Did you know it's a crime to exchange favours if you're in public service? That's insane!! But, going forward, we will ensure that we at least strictly uphold most of these laws, with a few amendments here and there. The country is moving forward. Soon, we shall touch the upper echelons of civilised society, as Beka City moves closer to being free of all crime."" Shortly after the joint press release, the Bureau of Numbers reported a database showcasing that crime had plummeted to zero. "
