URLS,Headline,Article/news/world/2022-russian-invasion-ukraine/news/russia-annexes-four-regions-ukraine-3132076,Russia annexes four regions  of Ukraine,"""People living in Luhansk, Donetsk, Kherson region and Zaporizhzhia region are becoming our compatriots forever. We will defend our land with all our strength and all our means."" Russian President Vladimir Putin 
A defiant Vladimir Putin proclaimed Russia's annexation of a swathe of Ukraine in a pomp-filled Kremlin ceremony yesterday, promising Moscow would triumph in its ""special military operation"" against Kyiv even as some of his troops faced potential defeat. For all latest news, follow The Daily Star's Google News channel. 
Putin's proclamation of Russian rule over about 15 percent of Ukraine -- the biggest annexation in Europe since the second world war -- has been firmly rejected by Western countries and even many of Russia's close allies.
 








The declaration has been condemned by the West and prompted Ukrainian President Volodymyr Zelensky to request fast-track Nato membership.



In one of the toughest anti-American speeches the Russian president has delivered in more than two decades in power, he signalled he was ready to continue a battle for a ""greater historical Russia"" using whatever tools he had at his disposal and slammed the West as neo-colonial and Satanist.
 







(L-R) The Moscow-appointed heads of the Kherson region Vladimir Saldo and Zaporizhzhia region Yevgeny Balitsky, Russian President Vladimir Putin, Donetsk separatist leader Denis Pushilin and Lugansk separatist leader Leonid Pasechnik join hands after signing treaties formally annexing four regions of Ukraine, at the Kremlin in Moscow, yesterday. Photo: AFP
Putin said the US had set a precedent when it had dropped two atomic bombs on Japan in 1945, but stopped short of issuing new nuclear warnings against Ukraine himself, something he has done more than once in recent weeks.
US Secretary of State Antony Blinken said the US had not yet seen Russia take any action that suggested it is contemplating the use of nuclear weapons, despite what he called Putin's ""loose talk.""



""Truth is on our side. Russia is with us!"" Putin told his country's political elite, who had gathered in one of the Kremlin's grandest halls to watch him sign documents annexing four Ukrainian regions.
The ceremony culminated in the 69-year-old leader chanting ""Russia Russia!"" as he clasped the hands of the four Russian-backed officials he wants to run the annexed regions, which Ukraine is fighting to win back.
""People living in Luhansk, Donetsk, Kherson region and Zaporizhzhia region are becoming our compatriots forever,"" said Putin, referring to the four Ukrainian regions which he said Russia was annexing.
""We will defend our land with all our strength and all our means,"" he said, calling on ""the Kyiv regime to immediately cease hostilities and return to the negotiation table"".
Zelensky, speaking in Kyiv, said he was ready for peace talks if and when Russia got a new president and announced that Ukraine was formally applying for fast-track membership of the Nato military alliance, something Moscow fiercely opposes.
Kyiv's move to join Nato was the pretext that Putin used for the offensive he launched on February 24.
""We have already proven our compatibility with (Nato) alliance standards,"" Zelensky said in a video posted by the Ukrainian presidency on social media.
""We are taking a decisive step by signing Ukraine's application for accelerated accession to Nato,"" he added.
Zelensky and the West have condemned referendums that Moscow held in the four Ukrainian regions as illegal shams, while several dozen Ukrainians interviewed by Reuters in the last week said that only people they described as ""Russian collaborators"" had voted, with most people boycotting them.
US President Joe Biden condemned Russia's ""fraudulent"" declaration, vowing to keep backing Kyiv army.
""We will continue to support Ukraine's efforts to regain control of its territory by strengthening its hand militarily and diplomatically,"" he said.
Washington yesterday announced new ""severe"" sanctions against Russian officials and the country's defence industry.
The latest sanctions come on top of sweeping measures already imposed by the US and allies this year that have already crippled Russia's international trading and local economy. But they stop short of Russia's energy industry, the country's largest source of hard currency.
Guidance from the US Treasury and Commerce departments warned that anyone outside Russia, including companies, that provide political, economic or material support to Moscow faced a heightened risk of sanctions.
The Treasury sanctions generally freeze any US assets of those designated and bar Americans from dealing with them.
Commerce added 57 entities in Russia and Crimea to bar exports.
Treasury said it imposed sanctions on 14 people in Russia's military-industrial complex, two leaders of the central bank, family members of top officials and 278 members of the legislature ""for enabling Russia's sham referenda and attempt to annex sovereign Ukrainian territory.""
Canada yesterday announced measures against dozens of oligarchs, financial elites and their family members, and 35 Russian-backed senior officials in the regions where the referendums took place.
Britain also put sanctions on the governor of the Russian central bank and imposed bans on new services and goods export.
Nato Secretary-General Jens Stoltenberg said recent actions by Russia constitute the most serious escalation of the conflict since Moscow invaded Ukraine in February.
""This land grab is illegal and illegitimate. Nato allies do not and will not recognize any of this territory as part of Russia,"" Stoltenberg said.
""Putin has mobilised hundreds of thousands of more troops, engaged in irresponsible nuclear sabre-rattling and now illegally annexed more Ukrainian territory. Together, this represents the most serious escalation since the start of the war,"" Stoltenberg told a news conference.
However, he said the decision on Ukraine's Nato membership requires ""consensus"" of allies.
G7 and EU also said they would ""never recognise"" Russia's annexation of four more regions in Ukraine and pledged further sanctions against Moscow.
Despite warnings from Putin prior to the annexation that he could use nuclear weapons to defend the captured territories, Ukraine's Foreign Minister Dmytro Kuleba said Kyiv would ""continue liberating our land and our people"".
In central Moscow, at least 10,000 people convened for state-organised annexation celebrations, with huge banners emblazoned: ""Donetsk. Lugansk. Zaporizhzhia. Kherson. Russia!""
A concert in Red Square was replete with military and pomp and patriotic songs and throngs of Russians waving the national flag.
The four territories create a crucial land corridor between Russia and the Crimean peninsula, annexed by Moscow in 2014.
The Kremlin said it ""needed to clarify"" the exact borders of Kherson and Zaporizhzhia -- neither fully controlled by Moscow's forces -- that it intends to annex.
Together, all five regions including Crimea, make up around 20 percent of Ukraine, whose forces in recent weeks have been clawing back wins as part of a counter-offensive.
The UN Security Council was scheduled to vote later yesterday on a resolution condemning the referendums, according to France, the council's current president, but it has no chance of passing due to Moscow's veto power.
""People living in Luhansk, Donetsk, Kherson region and Zaporizhzhia region are becoming our compatriots forever. We will defend our land with all our strength and all our means."" A defiant Vladimir Putin proclaimed Russia's annexation of a swathe of Ukraine in a pomp-filled Kremlin ceremony yesterday, promising Moscow would triumph in its ""special military operation"" against Kyiv even as some of his troops faced potential defeat.Putin's proclamation of Russian rule over about 15 percent of Ukraine -- the biggest annexation in Europe since the second world war -- has been firmly rejected by Western countries and even many of Russia's close allies.The declaration has been condemned by the West and prompted Ukrainian President Volodymyr Zelensky to request fast-track Nato membership.In one of the toughest anti-American speeches the Russian president has delivered in more than two decades in power, he signalled he was ready to continue a battle for a ""greater historical Russia"" using whatever tools he had at his disposal and slammed the West as neo-colonial and Satanist.Putin said the US had set a precedent when it had dropped two atomic bombs on Japan in 1945, but stopped short of issuing new nuclear warnings against Ukraine himself, something he has done more than once in recent weeks.US Secretary of State Antony Blinken said the US had not yet seen Russia take any action that suggested it is contemplating the use of nuclear weapons, despite what he called Putin's ""loose talk.""""Truth is on our side. Russia is with us!"" Putin told his country's political elite, who had gathered in one of the Kremlin's grandest halls to watch him sign documents annexing four Ukrainian regions.The ceremony culminated in the 69-year-old leader chanting ""Russia Russia!"" as he clasped the hands of the four Russian-backed officials he wants to run the annexed regions, which Ukraine is fighting to win back.""People living in Luhansk, Donetsk, Kherson region and Zaporizhzhia region are becoming our compatriots forever,"" said Putin, referring to the four Ukrainian regions which he said Russia was annexing.""We will defend our land with all our strength and all our means,"" he said, calling on ""the Kyiv regime to immediately cease hostilities and return to the negotiation table"".Zelensky, speaking in Kyiv, said he was ready for peace talks if and when Russia got a new president and announced that Ukraine was formally applying for fast-track membership of the Nato military alliance, something Moscow fiercely opposes.Kyiv's move to join Nato was the pretext that Putin used for the offensive he launched on February 24.""We have already proven our compatibility with (Nato) alliance standards,"" Zelensky said in a video posted by the Ukrainian presidency on social media.""We are taking a decisive step by signing Ukraine's application for accelerated accession to Nato,"" he added.Zelensky and the West have condemned referendums that Moscow held in the four Ukrainian regions as illegal shams, while several dozen Ukrainians interviewed by Reuters in the last week said that only people they described as ""Russian collaborators"" had voted, with most people boycotting them.US President Joe Biden condemned Russia's ""fraudulent"" declaration, vowing to keep backing Kyiv army.""We will continue to support Ukraine's efforts to regain control of its territory by strengthening its hand militarily and diplomatically,"" he said.Washington yesterday announced new ""severe"" sanctions against Russian officials and the country's defence industry.The latest sanctions come on top of sweeping measures already imposed by the US and allies this year that have already crippled Russia's international trading and local economy. But they stop short of Russia's energy industry, the country's largest source of hard currency.Guidance from the US Treasury and Commerce departments warned that anyone outside Russia, including companies, that provide political, economic or material support to Moscow faced a heightened risk of sanctions.The Treasury sanctions generally freeze any US assets of those designated and bar Americans from dealing with them.Commerce added 57 entities in Russia and Crimea to bar exports.Treasury said it imposed sanctions on 14 people in Russia's military-industrial complex, two leaders of the central bank, family members of top officials and 278 members of the legislature ""for enabling Russia's sham referenda and attempt to annex sovereign Ukrainian territory.""Canada yesterday announced measures against dozens of oligarchs, financial elites and their family members, and 35 Russian-backed senior officials in the regions where the referendums took place.Britain also put sanctions on the governor of the Russian central bank and imposed bans on new services and goods export.Nato Secretary-General Jens Stoltenberg said recent actions by Russia constitute the most serious escalation of the conflict since Moscow invaded Ukraine in February.""This land grab is illegal and illegitimate. Nato allies do not and will not recognize any of this territory as part of Russia,"" Stoltenberg said.""Putin has mobilised hundreds of thousands of more troops, engaged in irresponsible nuclear sabre-rattling and now illegally annexed more Ukrainian territory. Together, this represents the most serious escalation since the start of the war,"" Stoltenberg told a news conference.However, he said the decision on Ukraine's Nato membership requires ""consensus"" of allies.G7 and EU also said they would ""never recognise"" Russia's annexation of four more regions in Ukraine and pledged further sanctions against Moscow.Despite warnings from Putin prior to the annexation that he could use nuclear weapons to defend the captured territories, Ukraine's Foreign Minister Dmytro Kuleba said Kyiv would ""continue liberating our land and our people"".In central Moscow, at least 10,000 people convened for state-organised annexation celebrations, with huge banners emblazoned: ""Donetsk. Lugansk. Zaporizhzhia. Kherson. Russia!""A concert in Red Square was replete with military and pomp and patriotic songs and throngs of Russians waving the national flag.The four territories create a crucial land corridor between Russia and the Crimean peninsula, annexed by Moscow in 2014.The Kremlin said it ""needed to clarify"" the exact borders of Kherson and Zaporizhzhia -- neither fully controlled by Moscow's forces -- that it intends to annex.Together, all five regions including Crimea, make up around 20 percent of Ukraine, whose forces in recent weeks have been clawing back wins as part of a counter-offensive.The UN Security Council was scheduled to vote later yesterday on a resolution condemning the referendums, according to France, the council's current president, but it has no chance of passing due to Moscow's veto power."
/sports/football/news/guardiola-reveals-secret-haalands-success-3132261,Guardiola reveals secret to Haaland's success,"Pep Guardiola says Manchester City's medical staff are the secret behind Erling Haaland's blistering start with the Premier League champions.Haaland has hit the ground running with 14 goals in nine appearances in all competitions since joining City from Borussia Dortmund in the close-season.Although the 22-year-old was equally prolific at Dortmund, he often found his hot streaks derailed by niggling injury problems.Aware of those fitness issues, City boss Guardiola has made it a priority to ensure his medical staff keep Haaland fit and firing on all cylinders.So far the Norway striker has started every game for City and Guardiola said: ""Everyone is important but I've always said to the club that the most important department in the backroom staff is the physios. They take care of the legs.""Erling struggled a lot in Dortmund last season with injuries and arrived here with little problems after a small surgery in the summer.""He started to work here with (physiotherapist) Mario (Pafundi) and the other guys and thanks to them -- and of course his work ethic -- he can play regularly now. Last season it was not possible.""When the players can play most of the time, it's thanks to the physios.""Pafundi's role is so important to Guardiola, the physio travelled with Haaland during his recent two-week spell on international duty with Norway.""It's not weird. At events like World Cups and European Championships, many physios go with the players, and Mario is an exceptional physio,"" Guardiola said.While Haaland has benefitted from his time with City's medical gurus, fellow pre-season signing Kalvin Phillips remains on the sidelines.The England midfielder had an operation to correct a recurring shoulder problem during the international break after playing just 14 minutes since arriving from Leeds.Guardiola is hopeful Phillips can return in time for the World Cup.""He is feeling good. The surgery was really good and the mobility is getting better,"" he said.""He took the right decision, otherwise he could not move forward. Now it's solved this problem and as soon as he is ready he can come back, hopefully in time to go to the World Cup.""City defender John Stones is also out of Sunday's derby against Manchester United after suffering a hamstring injury with England.Guardiola expects Stones to be absent for ""maybe 10 days, two weeks""."
/news/bangladesh/news/hasina-invites-saudi-crown-prince-visit-bangladesh-3132296,Hasina invites Saudi crown prince to visit Bangladesh,"Prime Minister Sheikh Hasina has invited Saudi Crown Prince and newly appointed Prime Minister Mohammed bin Salman Al Saud to visit Bangladesh.Mohammad Javed Patwary, Bangladesh ambassador to the Kingdom of Saudi Arabia, handed over the invitation letter to Waleed bin Abdulkarim Al-khuraiji, deputy minister of KSA's Ministry of Foreign Affairs, at the latter's office yesterday.In the letter, Hasina talked about the strong bilateral relations between the two brotherly states and hoped that the support of the two countries in different sectors will increase in the coming days."
/sports/cricket/news/nigar-sultana-3132051,Nigar Sultana,"We have been playing together for a long time, now is the time to show to the entire world how good and improved we are as a team."
/news/bangladesh/news/the-fight-save-their-field-3132146,The fight to save their field,"For decades, the residents of Mirpur-11 have made themselves well-acquainted with the only open space they have, the one located on Paris Road. Many grew up playing there every day after school, and many made lifelong friends and memories after spending hours on end in the field.Fourteen places had been earmarked as playgrounds, parks or fields in Mirpur. But they were turned into plots in 1994, as per the decision of then housing minister, violating the master plan and depriving local residents.This place was one of them.""This field on Paris Road was also turned into plots at that time. But we've been trying to protect the place since then,"" said Kazi Jahirul Islam Manik, ward-3 councillor of Dhaka North City Corporation.Manik said the three lakh residents of ward-3 do not have any field or park aside from this open space.And so, for a long time locals have been waging a fight, demanding the government protect their lone field, he added. Recently, after the new DAP was gazetted last month, their protest got momentum as the place has been designated as an open space there.Locals also organised a human chain and hunger strike to save the place, which was allotted to a section of people, violating the master plan of Dhaka Improvement Trust 1963.Currently the space remains abandoned, with piled up garbage  dumped there.""This land was earmarked as an open space in the 1963 master plan. It's also an open space in the new Detailed Area Plan,"" said Manik.Manik initiated a hunger strike on Thursday. A large number of people, including students, teachers, and guardians of 37 schools; former national football players; local clubs; and imams took part.The residents want the field to be handed over to the city corporation, no matter who the owner is. They wish for this place to turn into a proper field, he said.Sustainable Development Goals states that for every 12,500 people, a separate playground and park is a must. Going off that information, 24 such spaces are required for the ward. And yet, this is the lone playing field, Manik explained.In 2017, the prime minister issued a directive saying that this place will remain a playing field, he mentioned.The 1994 allotment is unethical and should be cancelled, Manik demanded.Ashrafun Nesa Parul, senior teacher of Jannat Academy High School, was brought up in the area. She said this field is crucial for the children's physical and mental development.""We want our children to lead a healthy life; every family here wants that,"" she added.Mohammad Anowar Hossain Ripon, principal of Mirpur Science College, said his institution has no playground or field, and locals have almost no place to play. So, the lone field is the only bastion for the youngsters. Elderly people also benefit, as they have a place for regular physical activities.Showing solidarity with the movement, DNCC Mayor Md Atiqul Islam requested the prime minister to allot the space as a playing field.The mayor, who visited the area on Thursday, said the area has over three lakh residents and around 60 educational institutes. But there is no field for them.The field is designated as an open space in the new DAP, but National Housing Authority has allotted it as plots. This is absolutely unacceptable, he said. ""We will protect this field with the support of locals.""Thirty percent of Dhaka city wards do not have any playground or park. This situation hinders the mental and physical growth of children, as they have no space to play and interact with friends, say experts.According to the DAP, 25 out of 75 wards under Dhaka South City Corporation and 10 out of 55 wards under DNCC do not have a single park or playground.About 20 million people live in the capital, and considering the population density, there should be over a dozen parks and play areas in each ward, said Adil Mohammad Khan, former general secretary of Bangladesh Institute of Planners.""But there's a dearth of open spaces, and the available places get too crowded. Ultimately, many children are discouraged to go to the few parks or playgrounds we have,"" he explained."
/news/world/usa/news/hurricane-ian-dumped-10pc-more-rain-due-climate-change-research-3132316,Hurricane Ian dumped 10pc more rain due to climate change: research,"Climate change increased the rainfall from Hurricane Ian by more than 10 percent, according to a new quick-fire analysis, as one of the most powerful storms ever to hit the United States devastated parts of Florida.Ian ""could be the deadliest hurricane in Florida history"", President Joe Biden said after the storm brought ferocious winds, turned streets into churning rivers that swept away homes and left an unknown number of casualties.According to a rapid and preliminary analysis, human-caused climate change increased the extreme rain that Ian unleashed by over 10 percent, US scientists said.""Climate change didn't cause the storm but it did cause it to be wetter,"" said Lawrence Berkeley National Laboratory's Michael Wehner, one of the scientists behind the new finding.The researchers compared simulations of today's world -- which has warmed nearly 1.2 degrees Celsius since pre-industrial times -- with counterfactual simulations of a world without human-induced climate change.Wehner said these were ""conservative estimates"", adding that while they are not peer reviewed, they are based on methods used in a study on the 2020 Atlantic hurricane season, which was published in April in the journal Nature Communication.Climate change from emissions of planet-heating greenhouse gases is warming the ocean's surface and increasing moisture in the atmosphere that fuels hurricanes.Although the total number of tropical storms, or cyclones, may not increase, scientists say warming is whipping up more powerful cyclones with stronger winds and more precipitation.""Human-caused climate change is affecting hurricanes in many ways including causing them to intensify faster, be stronger overall, and dump a lot more rain,"" tweeted climate scientist Katharine Hayhoe, who was not involved in the research.For each degree Celsius of warming, scientists expect the water in the atmosphere to increase by around seven percent.But Wehner said that his research found that storms are ""more efficient"" at turning the available moisture into rainfall.Ian swept across Cuba on Tuesday, downing the country's power network, before slamming into the Florida coast on Wednesday as a strong Category 4 hurricane.The National Hurricane Center said Thursday the now Category 1 storm is expected to bring ""life-threatening flooding, storm surge and strong winds"" to the Carolinas."
/news/bangladesh/crime-justice/news/3-get-life-imnprisonment-drug-dealing-3132311,3 get life imnprisonment for drug dealing,"A Thakrugaon court on Thursday sentenced three men to life in prison for possessing 300 bottles of Phensedyl in November 2018.The convicts, Akmal, 23, Hasem Ali, 24, and Sadekul Islam, 38, are from Haripur upazila of Panchagarh. The jail term is being counted from the day they were arrested."
/star-multimedia/news-multimedia/news/pabnas-specially-abled-children-shooting-the-stars-3132376,Pabna’s specially abled children shooting for the stars,"Proper care can turn ""disability"" into special ability -- that's what's been proven by the specially abled child athletes from Pabna.They've already won 23 prizes in 4 international tournaments, including 14 gold medals.And now they're preparing for the coming World Summer Games in Germany."
