URLS,Headline,Article/sports/cricket/news/salt-sinks-pakistan-england-force-series-decider-3132361,Salt sinks Pakistan as England force series decider,"England's Phil Salt scored a blistering half-century as the visitors raced to an eight-wicket win over Pakistan in their sixth Twenty20 clash in Lahore on Friday to level the seven-match series at 3-3.Salt, who had struggled for runs coming into the game, looked in ominous form from the outset when he opened his innings with two fours before helping England bring up 100 in just seven overs with a six off Aamer Jamal.Alex Hales gave him support with a breezy 27 while Dawid Malan contributed 26, with both batsmen falling to the leg-spin of Shadab Khan.The wickets proved to be mere consolation for Pakistan as Salt continued his onslaught and struck the winning runs in the 15th over, ending with 13 fours and three sixes in his 41-ball knock.Earlier, Pakistan lost their opening two wickets for 15 after being put in to bat before captain Babar Azam launched a fine counter-attack, hitting seven fours and three sixes in an unbeaten 59-ball 87.He was briefly supported by Iftikhar Ahmed (31) but Pakistan's middle-order failings cost them again as the bowling pair of David Willey (2-32) and Sam Curran (2-26) restricted the hosts to 169-6.The teams will contest the final match in the series at the same venue on Sunday."
/middle-east/news/mahsa-aminis-death-clashes-continue-iran-protests-enter-3rd-week-3132321,Mahsa amini’s death: Clashes continue as Iran protests enter 3rd week,"Iranian security forces opened fire on angry protesters as street violence sparked by the death of Kurdish woman Mahsa Amini entered a third week yesterday, foreign-based opposition media reported.At least 83 people had been killed in a crackdown on the protests that erupted when Amini, 22, died in custody three days after her arrest by the notorious morality police in Tehran for allegedly breaching the Islamic republic's strict dress code for women.""Death to the dictator,"" bare-headed women chanted in the northwestern city of Ardabil, said Iran International, a Persian-language television station based in London.In the southwestern city of Ahvaz, security forces fired tear gas to disperse scores of people who streamed onto the streets jeering and shouting anti-government slogans, in another video shared by the channel.Men braved gunfire as they stoned a police station in Zahedan, near Iran's southeastern border with Pakistan, other footage showed. AFP was unable to immediately verify the videos.Women have defiantly burned their headscarves and cut their hair in the protests over Amini's death, announced September 16, that are the biggest seen in Iran since protests in November 2019 over fuel price rises.Amnesty International said Iran was intentionally using lethal force against the protesters, adding that without international action ""beyond statements of condemnation"" more people risk being killed.""The Iranian authorities have mobilised their well-honed machinery of repression to ruthlessly crack down on nationwide protests in an attempt to thwart any challenge to their power,"" it said.Amnesty said it had obtained a leaked official document issued to the commanders of armed forces in all provinces on September 21 instructing them to ""severely confront"" protesters.Former Iranian international footballer Hossein Manahi was arrested yesterday after supporting the protests on his social media accounts, state media said.Security forces also arrested singer Shervin Hajipour, whose song ""Baraye"" (""For"") made up of tweets about the protests went viral on Instagram, the rights group Article 19 said.Iran also arrested a woman who drew praise online after being shown eating out in Tehran without a headscarf in an image that went viral on social media.The Committee to Protect Journalists says at least 29 journalists have been arrested, including Nilufar Hamedi and Elahe Mohammadi, female reporters who helped expose Amini's case.The crackdown has drawn widespread international condemnation."
/news/bangladesh/crime-justice/news/ex-chairman-sued-raping-physically-challenged-girl-3132291,Ex-UP chairman sued for raping physically- challenged girl,"A local Awami League leader has been accused in a case of raping a 15-year-old girl with physical disabilities in Madaripur town.Babul Sarder, also a former chairman of Chilarchar Union Parishad, has been accused of breaking into a home on Thursday and raping the girl when the parents were away at work, said Monowar Hossain, officer-in-charge of Madaripur Police Station.When the girl's parents returned home, she told her parents what happened, the officer said, quoting the complaint.Shihab Chowdhury, a doctor at the hospital where she is being treated, said a test was done to find if she was raped.The OC said police were waiting for the test report.Police are looking for the accused, he added.Contacted over the phone, Babul said, ""The allegation of rape is being made to tarnish my image. I am a victim of political conspiracy ... I will fight my legal battle.""The girl's father said Babul was an influential person. ""No one dares to speak up against him. But I want justice for my daughter."""
/news/asia/india/news/congress-president-polls-kharge-tharoor-tripathi-file-nominations-3132266,"Congress president polls: Kharge, Tharoor, Tripathi file nominations","The stage was set yesterday for a three-way race for the post of President of India's main opposition party Congress with senior leaders Mallikarjun Kharge, Shashi Tharoor and KN Tripathi filing their nominations for the October 17 elections to decide who will replace Sonia Gandhi.More than 9,100 Congress delegates are eligible to cast their votes in the October 17 election. The result will be announced on October 19.As things stand, 80-year-old Kharge appears emerging a favourite as he is thought to be enjoying the tacit blessings of the Gandhi family.What has further strengthened Kharge's candidature is that his nomination papers were signed by a number of members from the Group of 23 leaders comprising Anand Sharma, Prithviraj Chavan, Manish Tewari and Bhupinder Hooda who have called for organizational changes.Kharge is a hardcore loyalist of the Gandhi family. If elected, he will be the second AICC president from Karnataka after S Nijalingappa, and also a Dalit leader to hold the post after Jagjivan Ram.Tharoor, 66, was also a part of G-23 but it seems he has been left by his group colleagues to cut a lonely furrow as none of them endorsed his nomination papers filed on the last day of nomination filing yesterday.This would be the first time a person from outside the Gandhi clan would head the grand old party after a long hiatus.The Gandhi family did not go on record to convey its favourite candidate among the three.  Neither Sonia nor Rahul Gandhi nor Priyanka Gandhi Vadra was present when the three candidates filed nomination papers because they did not want to be publicly seen as taking sides.But Rajasthan Chief Minister Ashok Gehlot, considered close to the Gandhi family, said yesterday that all senior leaders had decided to back Kharge.""All senior leaders have together decided on Kharge's candidature,"" Gehlot told reporters in New Delhi.Tharoor, who was also part of the G-23 group, filed five sets of nomination papers while Tripathi filed a single set of poll papers with Madhusudan Mistry, the chairman of the Congress's Central Election Authority.Tharoor said he has a vision to strengthen the Congress which should be a vehicle for ""change."""
/news/bangladesh/crime-justice/news/ctg-businessman-held-loan-default-3132301,Ctg businessman held for loan default,"A Chattogram businessman hiding in Dhaka to avoid arrest was caught by police on Thursday.Tipu Sultan, chairman of Marine Vegetable Oil, was arrested by a team from Chattogram Metropolitan Police at a house in Gulshan.He is accused of loan default in 21 cases."
/news/bangladesh/news/life-lone-crafter-3132081,Life of a lone crafter,"A lone family of the Moni-Wrishi community has been continuing their ancestral profession of making rhythmic musical instruments despite facing several pitfalls.Narayan Chandra Das (84) came to Mymensingh with his parents as a 13-year-old boy from Manikganj. He now runs the instrument business along with his son Suvash Chandra Das and grandson Gopal Chandra Das.Narayan claimed now they are the only family involved in making rhythmic instruments in Mymensingh.""It is a great relief that stability in business has returned after the pandemic. Things have started to look up with the upcoming puja celebrations,"" said Narayan.""We continued this profession facing serious odds and had to pass days with no food or half-filled stomachs. We could not leave he profession due to our eternal fascination of musicals instruments, "" he added.Visiting the site, this correspondent saw Narayan and his workers were busy completing orders from Mymensingh, Jamalpur, Sherpur, Netrakona and Kishoreganj.Suvash, proprietor of ""Taal Torongo"" in Mymensingh's Boro Kalibari area, said, ""With the number of puja mandaps in Mymensingh and its adjacent districts increasing this year, the demand for musical instruments will also increase.""""The number of orders we received is satisfactory and they will increase at the last moment,"" said Narayan's grandson Gopal Chandra Das.""We also repair old one instruments,"" he said.The price of Instrument materials has also increased this year. However, as both making charges and orders have increased, the workers are also earning better this season, Gopal added.The artisans said instruments like Dhak is being sold at Tk 8,000 to Tk 12,000, Khol at Tk 6,000 to Tk 10,000, while Dholok is being sold at Tk 3,000 to Tk 6,000.Khol (Mridanga) is being sold at Tk 3,000 to Tk 6,000, while a Bangla Dhol is sold at Tk 8,000 to Tk 14,000, according to size. Rezaul Karim Aslam, proprietor of renowned instrument house Nobab & Co, said other instruments like Dugi-Tabla, Khamok, Naal, and Khonjoni are also in high demand this season.Hoping an overall better business this year, the artists said a worker could earn Tk 50,000 to 60,000 in three months marking puja."
/news/asia/south-asia/news/myanmar-rebels-shoot-airliner-3132166,Myanmar rebels shoot airliner,"A passenger on board a Myanmar domestic flight was shot in the face yesterday when rebels opened fire on the plane as it landed, the country's military junta said. A bullet passed through the fuselage of the Myanmar National Airlines plane as it made its descent carrying 63 people into Loikaw, the capital of eastern Kayah state. Myanmar has been in turmoil since a military coup ousted the civilian government of Aung San Suu Kyi in February last year, with thousands killed in a crackdown on dissent. The plane, flying from the capital Naypyidaw, came under fire at a height of around 1,000 metres (3,280 feet), about six kilometres (3.7 miles) north of Loikaw airport yesterday morning, the junta said in a statement."
/news/bangladesh/news/durga-puja-begins-today-3132056,Durga Puja begins today,"Durga Puja, the biggest religious festival of the Hindu community, begins today with Maha Shashthi puja at temples across the country with due religious fervour.Preparations at all puja mandaps have almost been completed as artisans are busy giving the final touches to idols and pandals to celebrate the festival.It is believed that Goddess Durga on this day descends on the earth with her four children -- Ganesha, Kartikeya, Lakshami and Saraswati.Maha Saptami puja will be held tomorrow, Maha Ashtami, Kumari and Sandhi puja on Monday, Maha Nabami on Tuesday and Bijoya Dashami on Wednesday.In separate messages, President Abdul Hamid and Prime Minister Sheikh Hasina yesterday conveyed greetings to the Hindu community people on this occasion, reports BSS.This year, puja will be celebrated at 32,168 mandaps across the country, including 242 in the capital, according to Bangladesh Puja Udjapan Parishad.In the capital, the main puja mandaps are at Dhakeshwari National Temple, Ramkrishna Mission and Math, Kalabagan, Banani, Shakhari Bazar and Ramna Kali Mandir.Yesterday at a press conference, Mahanagar Sarbojanin Puja Udjapan Committee issued 21-point directives, including installing CCTV cameras, frisking suspects and assigning volunteers, on maintaining security at the respective mandaps during the celebration. "
