URLS,Headline,Article
/business/economy/news/loan-write-declines-3137086,Loan write-off declines,"Loans written off by banks in Bangladesh declined in the first half of 2022 despite the upward trend of default loans. As per the rules, banks have to keep 100 per cent provisioning against delinquent assets and the coverage has to come from operating profits.So, many banks show reluctance in writing off loans, which goes on to explain why the volume of sour loans has not fallen substantially.The outstanding amount of write-off loans stood at Tk 43,360 crore in June this year in contrast to Tk 44,083 crore six months ago, data from the Bangladesh Bank showed. It amounted to Tk 43,543 crore in June last year.Usually, loans are written off when they are entirely covered by cash and there is no realistic prospect of recovering them. These assets are shifted to off-balance sheet records.But banks are not cleaning up their balance sheets despite the escalation in non-performing loans (NPLs): defaulted loans hit an all-time high of Tk 125,257 crore in June, an increase of 26.3 per cent from Tk 99,205 crore a year prior.NPLs accounted for 8.96 per cent of the total outstanding loans of Tk 13,98,592 crore as of June.One of the reasons many banks ignore tidying up their balance sheets by writing off loans is to enjoy a higher net profit, a central bank official explains.A majority of banks managed a hefty profit in the January to June half this year thanks to the recent rebound of businesses from the coronavirus pandemic and the fluctuation of the exchange rate of the taka against the US dollar. Still, many showed unwillingness to remove the bad loans from the balance sheets.Lenders are allowed to show 50 per cent of the collateral as provisions against default loans. This means banks can avoid keeping the 100 per cent mandatory cash provision against NPLs.As per BB regulations, banks have to maintain provisioning of 0.25 per cent to 5 per cent for unclassified loans. It is 20 per cent for the default loans of the substandard category, 50 per cent for the doubtful category, and 100 per cent for the bad or loss category.Banks have to keep a full amount in cash in provision for the NPLs that are written off.Syed Mahbubur Rahman, managing director of Mutual Trust Bank, says the banks that enjoy sound financial health usually write off NPLs.""Although writing off bad debts helps them clean up their balance sheets, maintaining a 100 per cent cash provision is difficult for many banks.""Banks recovered Tk 565 crore through writing off loans between January and June compared to Tk 225 crore in the identical first half of 2021, bringing down the outstanding amount of write-off loans.Since the facility was introduced in Bangladesh in 2003, a total of Tk 60,402 crore has been written off. Of the sum, Tk 43,360 crore has remained unrealised.The amount of funds that was recovered through the process increased substantially in the first half of 2022, which Rahman described as a positive development for the banking sector.The enhanced recovery has helped reduce the outstanding amount of the write-off loans as well.Although the provision base has expanded to some extent, there is still a large provisioning shortfall in the banking sector of Bangladesh.The provision deficit stood at Tk 13,219 crore in June in contrast to Tk 14,007 crore six months earlier.Mohammad Ali, additional managing director of Pubali Bank, also said keeping 100 per cent provisioning is difficult for the weak banks. ""The capacity of writing off loans is not the same for every bank.""Shah Md Ahsan Habib, a professor of the Bangladesh Institute of Bank Management, said writing off bad loans is not always bad.""It also shows how much of soured loans a bank can absorb. It is a matter of decision as well.""""We need to check and analyse data before concluding on the association between increasing NPLs and decreasing loans write-off,"" he added.Anis A Khan, a veteran banker, sees the fall of the write-off loans as a good sign.""This means that banks' efforts to recover bad loans have paid off to some extent.""    "
/star-multimedia/news-multimedia/news/beauty-circus-will-beauty-be-able-find-her-fathers-killer-3137286,‘Beauty Circus’: Will Beauty be able to find her father's killer?,"A circus troupe named 'The Beauty Circus' appears in the village of Baniyashanta. The troupe is headed by a woman named Beauty. Influential men of the village want to possess Beauty. On the other hand, Beauty has come to this village to find the person who killed her father in 1971. Will Beauty be able to find her father's killer?Written and Directed by Mahmud Didar, the film 'Beauty Circus' stars Jaya Ahsan, Ferdous, Tauqeer Ahmed, ABM Sumon, Gazi Rakayet, Humayun Sadhu and many others.Watch today's Star Movie Review to know more about the film."
/news/bangladesh/crime-justice/news/5-arrested-stabbing-ssc-examinee-pallabi-3137366,5 arrested for stabbing SSC examinee in Pallabi,"Rab arrested five members of a teen gang on charge of stabbing an SSC examinee in Dhaka's Pallabi area on September 23.Three of the arrestees have been identified as Ramzan Ali (20), Al Amin (20) and Ismail Hossain (18) and the two others are under 18, Rab said. A team of Rab arrested them from Dhaka and two other districts yesterday, Mozammel Haque, commanding officer of Rab-4 told a press briefing today. The victim Rakib (16) is undergoing treatment at Dhaka Medical College Hospital with stab wounds on his back.The Rab official said there are two groups--senior group and junior group-- operating in the area who are involved in different types of crimes including drug abuse and mugging.Rakib was a part of the senior group while the accused are from the junior group.The two groups were constantly involved in rivalry over establishing dominance in the area. Some members of senior group rebuked members of the junior groups including Ramzan for smoking in front of them which led to the attack on Rakib."
/opinion/views/interviews/news/energy-prices-should-be-consciously-regulated-the-government-3137126,Energy prices should be consciously regulated by the government,"Dr MM Akash, professor at the Department of Economics of Dhaka University, talks to Eresh Omar Jamal of The Daily Star about the ongoing inflation in the country, as well as the role of the government and trade syndicates in it.Despite the global rise in energy prices, Bangladesh has at times seen disproportionately higher prices in comparison. But when global prices dropped, we did not see the energy prices here go down. Why is that?Most of the markets are not regulated by the government directly, but the price for energy, since it is a strategic commodity like, let's say, food products, is actually politically sensitive and therefore must be consciously regulated and/or monitored by any government. For example, in Bangladesh, energy prices should be determined by the Bangladesh Energy Regulatory Commission (BERC) through a transparent tripartite meeting of all stakeholders, after conducting detailed public hearings about the real cost of energy supply, including the international buying price, freight charges, tariff, and internal transportation cost, taking into consideration a reasonable profit margin, etc. But this institutional price mechanism has been violated and the Consumer Association of Bangladesh (CAB) has lodged a legal suit against the ministry and BERC in the recent past.So, prices – of LNG, electricity, petroleum, gas, diesel, etc – have become subjected to a ""cat and mouse"" game that has been going on among BERC, CAB, and the concerned ministry. Sometimes, BERC yields to vested interests, other times CAB goes to court, and sometimes, using the indemnity ordinance for the energy sector or for so-called ""urgent reasons,"" the ministry determines and announces the prices through an administrative order.People have been experiencing tremendous inflationary pressure for some time now. Has the government done enough over the past couple of years to support them? How could it have been done better?
One measure taken for controlling essential commodity prices by the government in urban areas is the Trading Corporation of Bangladesh (TCB) outlets that were selling necessities at lower prices. The long lines and the fact that even middle-class people are now standing in them prove that what the TCB supplied was not enough, and that it was just a temporary measure.
The popular demand is for rationing or cash expenditure support to target people who cannot afford what they need to consume. But some privileged groups enjoy rations and other indirect advantages. In rural areas, vulnerable groups also have access to such facilities. But the system should be made universal. A rational system will have to be built to ensure minimum food security (rice, lentil, sugar, cooking oil, etc) for low-income groups – that may then show and prove the goodwill of the government in this regard.
On the one hand, we see farmers struggling to earn enough from farming. On the other hand, we see prices of agricultural products increasing. Why do we see such discrepancies, and who is benefitting from them?



The markets for our agricultural products at the producer level are highly competitive and there are numerous sellers of surplus products. They do not have staying power, modern marketing connections or storage facilities. So they greatly depend on middlemen to connect them to the retail market at the consumer end. It is the middlemen that are benefitting.








Government’s decision to hike fuel prices will hurt every section of society Read more
Trade syndicates artificially pushing prices up has plagued our country for years. Recently, the Bangladesh Competition Commission filed 44 cases against 36 individuals and organisations, accusing them of creating an artificial crisis in the market. But why haven't we seen the government taking meaningful actions to stop such collusion in the past? Do you see any indication to believe that things might change going forward?
In the case of imported products, the syndicate of sellers is very strong and it controls wholesale prices. As you have noted correctly, trade syndicates artificially pushing prices up has continued to plague our country for years. The issue is whether the government has been able to identify those syndicates, and if it did really take effective measures to break them up by applying competition laws against them. The answer in the past has been ""no.""
However, the Bangladesh Competition Commission has filed numerous cases against many large companies. I think we must wait and see whether this time any real punishment or fine or tax is charged against their monopoly to make super profits.








Who is afraid of DAP? Read more
But for a permanent solution, the TCB must have an adequate, say, one-third of the total supply as a buffer stock for all selected necessary items – imported or locally-produced.
TCB also must have an attached network of small suppliers all over the country, so that price intervention through open market sale (OMS) can be resorted to at any time and in any place, whenever the strong syndicates try to raise prices by creating an artificial supply deficit or import crisis.
This long-term solution was preached in the taskforce reports of Prof Rehman Sobhan in the 1990s, when politicians were still not following the so-called ""mukto bazaar orthoniti"" (free market economics) – when business syndicates were not as strong as they are now, and when bureaucrats and politicians still had a pro-people vision or manifesto before them.
One measure taken for controlling essential commodity prices by the government in urban areas is the Trading Corporation of Bangladesh (TCB) outlets that were selling necessities at lower prices. The long lines and the fact that even middle-class people are now standing in them prove that what the TCB supplied was not enough, and that it was just a temporary measure.The popular demand is for rationing or cash expenditure support to target people who cannot afford what they need to consume. But some privileged groups enjoy rations and other indirect advantages. In rural areas, vulnerable groups also have access to such facilities. But the system should be made universal. A rational system will have to be built to ensure minimum food security (rice, lentil, sugar, cooking oil, etc) for low-income groups – that may then show and prove the goodwill of the government in this regard.On the one hand, we see farmers struggling to earn enough from farming. On the other hand, we see prices of agricultural products increasing. Why do we see such discrepancies, and who is benefitting from them?The markets for our agricultural products at the producer level are highly competitive and there are numerous sellers of surplus products. They do not have staying power, modern marketing connections or storage facilities. So they greatly depend on middlemen to connect them to the retail market at the consumer end. It is the middlemen that are benefitting.Trade syndicates artificially pushing prices up has plagued our country for years. Recently, the Bangladesh Competition Commission filed 44 cases against 36 individuals and organisations, accusing them of creating an artificial crisis in the market. But why haven't we seen the government taking meaningful actions to stop such collusion in the past? Do you see any indication to believe that things might change going forward?
In the case of imported products, the syndicate of sellers is very strong and it controls wholesale prices. As you have noted correctly, trade syndicates artificially pushing prices up has continued to plague our country for years. The issue is whether the government has been able to identify those syndicates, and if it did really take effective measures to break them up by applying competition laws against them. The answer in the past has been ""no.""
However, the Bangladesh Competition Commission has filed numerous cases against many large companies. I think we must wait and see whether this time any real punishment or fine or tax is charged against their monopoly to make super profits.








Who is afraid of DAP? Read more
But for a permanent solution, the TCB must have an adequate, say, one-third of the total supply as a buffer stock for all selected necessary items – imported or locally-produced.
TCB also must have an attached network of small suppliers all over the country, so that price intervention through open market sale (OMS) can be resorted to at any time and in any place, whenever the strong syndicates try to raise prices by creating an artificial supply deficit or import crisis.
This long-term solution was preached in the taskforce reports of Prof Rehman Sobhan in the 1990s, when politicians were still not following the so-called ""mukto bazaar orthoniti"" (free market economics) – when business syndicates were not as strong as they are now, and when bureaucrats and politicians still had a pro-people vision or manifesto before them.
In the case of imported products, the syndicate of sellers is very strong and it controls wholesale prices. As you have noted correctly, trade syndicates artificially pushing prices up has continued to plague our country for years. The issue is whether the government has been able to identify those syndicates, and if it did really take effective measures to break them up by applying competition laws against them. The answer in the past has been ""no.""However, the Bangladesh Competition Commission has filed numerous cases against many large companies. I think we must wait and see whether this time any real punishment or fine or tax is charged against their monopoly to make super profits.But for a permanent solution, the TCB must have an adequate, say, one-third of the total supply as a buffer stock for all selected necessary items – imported or locally-produced.TCB also must have an attached network of small suppliers all over the country, so that price intervention through open market sale (OMS) can be resorted to at any time and in any place, whenever the strong syndicates try to raise prices by creating an artificial supply deficit or import crisis.This long-term solution was preached in the taskforce reports of Prof Rehman Sobhan in the 1990s, when politicians were still not following the so-called ""mukto bazaar orthoniti"" (free market economics) – when business syndicates were not as strong as they are now, and when bureaucrats and politicians still had a pro-people vision or manifesto before them."
/opinion/letters/news/plug-the-brain-drain-3137416,Plug the brain drain,"As a developing country, Bangladesh is a victim of brain drain. Generally, this issue is more prevalent among students who have access to higher education abroad. Although a large number of students migrate abroad for higher studies every year, the rate of return is declining alarmingly. According to UNESCO's ""Global Flow of Tertiary-Level Students"" report, 60,390 Bangladeshi students were pursuing higher studies abroad in 2017. This number is increasing at the rate of 10 percent every year. Most of them are settling permanently in those countries after completing their studies.In our country, the idea of living abroad permanently is viewed as something prestigious. The potential of Bangladesh becoming an incompetent nation is not visible to most people. Besides high salaries, developed countries ensure a more secure life. These facilities are still inadequate in our country.The inconsistency of the education system in Bangladesh and the inability to ensure world-class education is one of the reasons behind brain drain. When a research enthusiast realises that his/her lifelong dream cannot be fulfilled in their own country, he/she will naturally want to go abroad. According to the annual report of the University Grants Commission (UGC), 125 public and private universities of the country altogether spent only Tk 153 crore on research activities in 2019, which is only one percent of their total expenditure.Rich nations are also indirectly luring talented people from less-developed and developing countries to contribute to their own development. But it would be foolish to view Bangladesh's brain drain only through the few reasons mentioned above. Firstly, we must understand exactly which factors are discouraging a highly educated person from settling permanently in their homeland.State policymakers need to think about issues related to quality of life, employment opportunities, social structure, financial security, development, gender equality, and freedom of all walks of life. After all, a state can only become full of opportunities with the contribution of its most skilled people.Syed Rifat, Jagannath University



 "
/opinion/editorial/news/it-still-accident-if-death-caused-systemic-negligence-3137306,Is it still an accident if death is caused by systemic negligence? ,"That residents of any modern capital city could be exposed to accidents related to septic tanks or uncleaned sewerage lines is quite unthinkable. Yet, this is what the residents of Dhaka are being exposed to everyday. On November 11, a 40-year-old woman, who worked as a cleaner at a car showroom, lost one of her legs when, while returning from work, three slabs of a manhole suddenly blew up around 15 to 16 feet high and fell on her. Needless to say, her life, since then, has been an overwhelming struggle.In the last several years, a number of such events have hogged the headlines. For example, on March 27, 2018, a septic tank blast in the capital's Pallabi area led to the death of a three-year-old while also leaving four others critically injured. On November 30, 2015, at least five members of a family sustained burn injuries in a septic tank blast in Dakkhinkhan's Faridabad area.According to experts, residents of Dhaka are being exposed to such risks because many of the city's sewerage lines are not maintained properly, and some were not even constructed following proper designs. Adding to its long list of failures, the Dhaka Water Supply and Sewerage Authority (Wasa) has also failed to bring the whole city under one sewerage network. Thus, residents in many areas were either forced to set up septic tanks or connect their sewage lines with storm water drains.As of last year, 71 percent of household latrines in the city were directly or indirectly open to drains, eventually discharging wastes into the city's lakes and canals. Meanwhile, Dhaka's septic tank soak pits have also not been working properly because of their low capacity for soil infiltration. The culmination of all these and other factors has led to a situation where people are constantly exposed to such freak accidents. However, can such incidents really be called ""accidents"" when it is the apathy of the authorities that causes them? According to a report by this newspaper, Wasa prepared a 15-year sewerage master plan in 2015 to bring 100 percent of its areas under the sewerage network. However, only one among the proposed five sewerage treatment plants is now near completion.How long will people have to wait for Wasa to get such a basic service done right? How many more people will have to lose their limbs or lives before Wasa officials are held accountable for failing to properly maintain sewerage lines? It is embarrassing to hear our government officials constantly boast about our development achievements when our sewerage system – the most basic element of any liveable city – is in such shambles.We call on the government to urgently hold relevant officials accountable for these failures. It is unacceptable for anyone to be at constant risk of injury or death simply because of the negligence of Wasa."
/sports/football/news/messi-out-psg-trip-reims-calf-injury-3137441,Messi out of PSG trip to Reims with calf injury,"Lionel Messi has been ruled out of Paris St Germain's Ligue 1 visit to Stade de Reims on Saturday with a calf injury, coach Christophe Galtier said.""He asked to be replaced during the Champions League game (against Benfica on Wednesday). He has a little problem with his calf but he will be back to training on Sunday,"" Galtier told a news conference on Friday.There are more injury woes for PSG as fullback Nuno Mendes will be out of action for three weeks with a muscle injury while Kylian Mbappe is suffering from a throat infection.The France forward, however, is expected to be included in the squad, Galtier said, though he could be on the bench, allowing 20-year-old Hugo Ekitike to be handed another start.Unbeaten PSG lead the standings with 25 points from nine games, two ahead of second-placed Olympique de Marseille, who host bottom side AC Ajaccio on Saturday.Galtier said he would stick to the usual defensive system when asked if he would change his three-man central defence to a steadier four-man backline in light of injuries to Mendes and Presnel Kimpembe, who is still out with a hamstring injury.""I'm not going to change the system, especially because we do not have much time to work, having come back from Lisbon yesterday morning at 6am,"" he explained.After coming under fire for their alleged excessive use of planes to travel to Ligue 1 games, PSG will this time travel by bus for the 150km journey to Reims, Galtier added.
 "
/health/disease/coronavirus/events-who/deaths-infections/news/5-covid-19-death-24hrs-positivity-rate-10-3137421,"5 Covid-19 death in 24hrs, positivity rate 10%","Five people died from Covid-19 in 24 hours till 8:00am today (October 7, 2022), said a press release issued by the Directorate General of Health Services (DGHS).The total number of deaths from Covid-19 is currently 29,380 in the country and the death rate stands at 1.45 percent.At least 491 new coronavirus cases were recorded during this period.The daily positivity rate is 10 percent while the total positivity rate stands at 13.61 percent.With the new infections, the total number of cases rose to 20,29,015, the release added.A total of 4,912 samples were tested across the country during this period.At least 701 Covid-19 patients have recovered within this time.The total number of recoveries now stands at 19,68,654 and the recovery rate at 97.03 percent, said the release.Of the deceased, one was male and four were female, aged between 21-80 years old."
