URLS,Headline,Article
/sports/cricket/news/could-hathursingha-tonic-work-soumya-again-3142401,Could Hathurusingha tonic work on Soumya again?,"When Soumya Sarkar came onto the international scene, his impact was felt fairly quickly. His ability to dictate terms and put fear in the opposition ranks were traits that best showcased his attributes.Eight years down the line, the carnage that he wrought against the likes of South Africa and Pakistan seems to be missing a few punches. The definitive factor is the confidence level that the left-hander has portrayed, oftentimes being moved down the order for the purpose of the team or following off-colour performances.Sri Lankan coach Chandika Hathurusingha, who oversaw the Tigers as head coach from 2014 to 2017, was able to get the best out of Soumya with a tonic of confidence. It appears current technical consultant Sridharan Sriram might replicate such a remedy.Chandika was known as a strict professional, micro-managing various details during his tenure and keeping a tight leash on things. However, he had a simple message regarding the left-hander's approach. ""You may get out, but don't change your approach"" was the gist of that message.Soumya, given the licence to play his natural game, was able to become a match-winner for the Tigers during that period.So, with limited options and a crisis at the top becoming apparent even to the team management at this point, Soumya made a return to the Tigers' line-up in the tri-nation T20I series in New Zealand despite only making the squad for the upcoming T20 World Cup as a standby player.He started well in the New Zealand game despite struggling with the pace and bounce on offer, but he was keen on his own approach. In the second game against Pakistan yesterday, when Bangladesh slumped to a seven-wicket loss, he got just four runs. But Sriram defended his intent.""He played a shot and got out. That's intent. I think he was selfless and played for the team. He tried to get going in the first few overs when we got only six or seven runs. He tried to force the pace and got out, but it happens. He played a good knock at number three in the last game so I think there are good signs. With a player like him, we need to really instill confidence,"" Sriram said after the game yesterday.It is evident that Soumya is being backed to go about his natural game. Whether that confidence boost can work its way to him making the T20 World Cup squad remains to be seen, but Sriram was open to change.""We still have time. We have two more days. There will definitely be discussions and I said this earlier, we're open to changes but we're very clear in our heads as to what we want. We will let you know in a few days,"" he said about whether there were any impending changes to the World Cup squad.""We do have trust. This is our best group. Those who are here with us are the best from Bangladesh and we have complete faith in that.""The Tigers finished without a win in the tri-nation series but played both Soumya and pacer Shoriful Islam, both of whom are stand-by options for the T20 World Cup, leading to Sriram maintaining that combinations were still being worked out.He clarified that the opening slots and batting position did not matter because they would keep ""modifying"" and ""adapting"" according to conditions and scenarios. There is every bit of chance of changes taking place, especially with Sabbir Rahman not having produced the necessary impact. For Soumya meanwhile, the Sriram tonic could be a chance to revive his game.The Tigers will head to Australia and play two World Cup warm-up matches on October 17 and 19 against Afghanistan and South Africa respectively. They take the positives of skipper Shakib Al Hasan and Liton Das's form at the top. Soumya's fast hand could just add that X-factor."
/news/bangladesh/news/kabir-suman-concert-yet-get-permission-3142561,Kabir Suman concert yet to get permission,"Eminent singer Kabir Suman was supposed to perform in Dhaka after almost 13 years, and the tickets for the three-day musical event have already been sold out.The concert is supposed to be held on October 15, 18, and 21 at the main auditorium of the National Museum, according to the organisers.However, Dhaka Metropolitan Police informed The Daily Star that no permission from their side was given for the event, as the venue is a key point installation (KPI).""The National Museum is a key point installation, and this is why we did not grant permission for the event,""  said DMP Commissioner MD Shafiqul Islam yesterday.Asked if the organisers applied for another venue, he said no such request was made.On Wednesday, the organisers arranged a press conference at Bishwa Shahitya Kendra, to reveal the last-minute preparations for the event.Mir Arif Billah from Peephole, one of the organisers of the event, said they are trying to get permission for the event at the moment. ""We hope we will get the permission soon,"" he added. "
/tech-startup/science-gadgets-and-tech/tech-news/news/elon-musk-under-federal-investigations-twitter-3142606,Elon Musk under federal investigations: Twitter,"Elon Musk is being investigated by federal authorities over his conduct in his $44 billion takeover deal for Twitter Inc, the social media company said in a court filing released on Thursday.While the filing said he was under investigations, it did not say what the exact focus of the probes was, and which federal authorities are conducting them.Twitter, which sued Musk in July to force him to close the deal, said attorneys for the Tesla Inc (TSLA.O) CEO had claimed ""investigative privilege"" when refusing to hand over documents it had sought.In late September, Musk's attorneys had provided a ""privilege log"" identifying documents to be withheld, Twitter said. The log referenced drafts of a May 13 email to the U.S. Securities and Exchange Commission (SEC) and a slide presentation to the Federal Trade Commission (FTC).""This game of 'hide the ball' must end,"" the company said in the court filing.The court filing, which asked Delaware judge Kathaleen McCormick to order Musk's attorneys to provide the documents, was made on Oct. 6 - the same day that McCormick paused litigation between the two sides after Musk reversed course and said he would proceed with the deal.Alex Spiro, an attorney for Musk, told Reuters that Twitter's court filing was a ""misdirection"" and asserted: ""It is Twitter's executives that are under federal investigation.""Twitter declined to comment on Spiro's statement. It also declined comment when asked by Reuters about its understanding of any investigation into Musk.The SEC did not immediately respond to a request for comment and the FTC declined to comment.The SEC has questioned Musk's comments about the Twitter acquisition, including whether a 9% stake he had built up before announcing his bid had been disclosed late and why it indicated that he intended to be a passive shareholder. Musk later refiled the disclosure to indicate he was an active investor.In June, the SEC asked Musk in a letter whether he should have amended his public filing to reflect his intention to suspend or abandon the deal.The Information, a tech news site, reported in April that the FTC was scrutinizing whether Musk failed to comply with the antitrust reporting requirement relating to an investor's intentions of being a passive or active shareholder.Twitter said in June, however, that the takeover deal with Musk had cleared an antitrust waiting period for review by the FTC and U.S. Justice Department. McCormick has given Musk until Oct. 28 to close the acquisition. If the deal does not get done by then, a trial date will be set for November."
/news/bangladesh/news/maddhapara-mining-company-production-resumes-after-five-months-3142156,Maddhapara Mining Company: Production resumes after five months,"State-owned Maddhapara Granite Mining Company in Dinajpur yesterday resumed its operations after a five-and-a-half-month suspension due to the unavailability of explosives, which are required to extract granite.The company began functions yesterday afternoon, a day after a consignment of explosives arrived at the mining area at Parbatipur upazila, said its officials.""Our production resumed around 4:00pm today [yesterday]. We need more days to ensure that production is in full swing,"" said Pinak Iqbal, general manager (production) of MGMCL.On April 30, the company shut its operations due to the explosives crisis.""Our production requires four types of explosives. But the reserve of explosives ran out on the night of April 30. That is why we were compelled to shut our operations,"" said Pinak.Around 650 local miners, who were appointed on a ""no-work-no-pay"" condition, were given leave indefinitely. The entire mining area took on a deserted look in the last few months, said officials and workers.Later, MGMCL officials assigned its enlisted vendor Germania Trest Consortium for importing explosives from India.The mine officials said the LC (letter of credit) was opened in May for importing the explosives, and an order to import 226 tonnes of explosives was awarded.A vehicle carrying 75 tonnes of explosives reached the mining area on Wednesday night, said Pinak.""The rest will arrive at the mining site within a week,"" he added.Mine officials said the company suffered a loss of around Tk 165 crore during these five and a half months due to the suspension.Currently, around 70 lakh tonnes of rocks are required annually in Bangladesh. Of these, around 10 lakh tonnes are produced by MGMCL, while the rest are imported, the mine officials said.Seeking anonymity, multiple officials of MGMCL said the company's production cost is much higher than its earnings, because it has been failing to produce the target amount of rocks for years.According to the company's financial statements, it incurred a loss of around Tk 433 crore in one decade (2012–2022)."
/news/world/usa/news/5-dead-north-carolina-shooting-juvenile-arrested-3142601,5 dead in North Carolina shooting; juvenile arrested,"Five people including an off-duty police officer were shot dead in the North Carolina capital of Raleigh on Thursday, triggering a massive manhunt that shut down part of city for hours and resulted in the arrest of a juvenile suspect, officials said.Two people were wounded: a police officer who was treated and released and a person in hospital in critical condition, a police spokesman said.Multiple law-enforcement agencies took part in the manhunt, turning neighborhoods into crime scenes flooded with first responders. Citizens were told to shelter in place.The shooting broke out at or near the Neuse River Greenway, a trail that runs through part of the city. About three hours later, police said they ""contained"" the suspect in a residence near a wooded area, later reporting that the suspect, described only as a juvenile white male, was taken into custody.Mayor Mary-Ann Baldwin decried the latest outbreak of gun violence in America, while North Carolina Governor Roy Cooper lamented that ""terror has reached our doorstep.""""The nightmare of every community has come to Raleigh. This is a senseless, horrific and infuriating act of violence that has been committed,"" Cooper told a late night news conference.Media reported the shooter used a long gun. Police offered no details about how the shooting spree unfolded nor about the circumstances of the suspect's capture.Like others briefing reporters, Baldwin appeared pained and angry.""We must do more. We must stop this mindless violence in America. We must address gun violence,"" the mayor said."
/news/asia/india/news/india-axes-rule-jk-voting-rights-3142536,India axes rule on J&K voting rights,"India yesterday scrapped a rule granting voting rights to new residents of its Jammu and Kashmir region after widespread anger among political parties, who labelled it a bid to change the demographics of the country's only Muslim-majority region.In 2019, India stripped its part of the region of its remaining measure of autonomy, reorganising Jammu and Kashmir state into two federally-controlled territories and changing the constitution to let non-Kashmiris vote and own land there.It had allowed Indians who have lived in Kashmir for a year or more to register as voters, replacing a rule that limited the franchise only to those who had lived there in 1947 - the year that India gained independence - or their descendants.The measure of October 11 ""is withdrawn and to be treated as void"", an electoral officer in the Jammu region, Avny Lavasa, told Reuters, without giving a reason for the withdrawal.In August, the government said it expected to add 2.5 million voters to Kashmir's rolls, which would swell the electorate by more than a third from 7.6 million now."
/sports/cricket/news/more-600000-tickets-sold-t20-world-cup-3142596,"More than 600,000 tickets sold for T20 World Cup","More than 600,000 tickets have been sold for the T20 World Cup in Australia, officials said Friday, hailing big demand for a host of sell-out blockbuster games.The global showpiece starts on Sunday at the preliminary stage, before the big guns join in from October 22. Seven Australian cities are hosting.Australia's opening match as defending champions against New Zealand, a repeat of last year's final, will be played before a capacity crowd at the Sydney Cricket Ground.The India-Pakistan fixture the following night is also a sell-out with more than 90,000 fans set to jam the Melbourne Cricket Ground after additional standing-room tickets were snapped up within 10 minutes.Only a small number of tickets remain for the event's opening match-day, which pits Sri Lanka against Namibia before UAE face the Netherlands at the 36,000-capacity Kardinia Park Stadium in Geelong.""We're delighted that we're set to see big crowds for both the opening match of the event in Geelong this Sunday and the first weekend of the Super 12 stage in a week's time,"" said ICC T20 World Cup chief Michelle Enright.""It's going to be fantastic to see full stadiums for cricket in October."""
/news/bangladesh/news/regional-climate-data-centre-timely-need-3142301,Regional climate data centre a timely need,"A regional climate data centre in the Hindu Kush Himalayan region to share non-sensitive data for a better collaboration to fight the impacts of climate change is imperative, said speakers at a conference yesterday.They made the remarks on the concluding day of the two-day Hindu Kush Himalaya Climate Regional Conference, titled ""Climate Data: Opportunities for Resilient Development"", held at a Dhaka hotel.Deutsche Gesellschaft für Internationale Zusammenarbeit (GIZ) GmbH, in collaboration with the Ministry of Environment, Forest and Climate Change, the Department of Agricultural Extension (DAE), and the Planning Commission organised the conference.Gyanendra Karki of the United Nations Environment Programme (UNEP) said the data currently in the hand of the countries in the region are enough to start any initiative.Data is scattered across the region, prompting the need to develop a platform regionally. Whatever we have in hand, we have to put it in a way that connects local people and helps them in their fight to be resilient against the climate impact. Mandira Singh Shrestha of ICIMOD
""Every nation having its own strategy can have a complementary adaptation plan that will help bridge the gap in collaboration. It is easy to discuss the problem. However, no practical solution will come up until there is a political commitment underlining the need to form a regional centre for cooperation among the countries in the HKH region,"" he said.
Mandira Singh Shrestha from The International Centre for Integrated Mountain Development (ICIMOD), said capacity building was a key part of understanding data.



""Data is scattered across the region, prompting the need to develop a platform regionally. Whatever we have in hand, we have to put it in a way that connects local people and helps them in their fight to be resilient against the climate impact,"" she said.
She said ICIMOD could lead any such centre to be built for coordination and collaboration across the Hindu Kush Himalaya region.
Anuj Sharma, co-founder of Earth Analytics, said, ""The formation of a geospatial academy to generate climate data could help us to mutually understand the impacts of climate change.""
""The region also needs a climate change database to guide and mitigate national mitigation efforts. We have to have a realistic goal along with transboundary collaboration,"" he added.
Malik Fida A Khan, executive director of Centre for Environment and Geographical Information Services (CEGIS), highlighted the need for a specific policy for data sharing.
""An integrated system for sharing climate data sharing could be a step forward in the process of regional cooperation. We can start with non-sensitive data sharing,"" he said.
Hasna Jamiuddin Moudud, councillor of South and East Asia at International Union for Conservation of Nature (IUCN), said Bangladesh must prioritise getting flood forecasting from India in advance for the preparation to reduce the damage during a flood.
She also highlighted the need for an equitable share of water from transboundary rivers in line with international convention.
Farhina Ahmed, secretary of the environment ministry, in her chief guest speech, said data sharing and regional collaboration were of immense importance for all the countries across the Hindu Kush Himalaya region.
She also expressed her hopes that the conference will be able to create the much-needed data generation journey in the region.
Data is scattered across the region, prompting the need to develop a platform regionally. Whatever we have in hand, we have to put it in a way that connects local people and helps them in their fight to be resilient against the climate impact. ""Every nation having its own strategy can have a complementary adaptation plan that will help bridge the gap in collaboration. It is easy to discuss the problem. However, no practical solution will come up until there is a political commitment underlining the need to form a regional centre for cooperation among the countries in the HKH region,"" he said.Mandira Singh Shrestha from The International Centre for Integrated Mountain Development (ICIMOD), said capacity building was a key part of understanding data.""Data is scattered across the region, prompting the need to develop a platform regionally. Whatever we have in hand, we have to put it in a way that connects local people and helps them in their fight to be resilient against the climate impact,"" she said.She said ICIMOD could lead any such centre to be built for coordination and collaboration across the Hindu Kush Himalaya region.Anuj Sharma, co-founder of Earth Analytics, said, ""The formation of a geospatial academy to generate climate data could help us to mutually understand the impacts of climate change.""""The region also needs a climate change database to guide and mitigate national mitigation efforts. We have to have a realistic goal along with transboundary collaboration,"" he added.Malik Fida A Khan, executive director of Centre for Environment and Geographical Information Services (CEGIS), highlighted the need for a specific policy for data sharing.""An integrated system for sharing climate data sharing could be a step forward in the process of regional cooperation. We can start with non-sensitive data sharing,"" he said.Hasna Jamiuddin Moudud, councillor of South and East Asia at International Union for Conservation of Nature (IUCN), said Bangladesh must prioritise getting flood forecasting from India in advance for the preparation to reduce the damage during a flood.She also highlighted the need for an equitable share of water from transboundary rivers in line with international convention.Farhina Ahmed, secretary of the environment ministry, in her chief guest speech, said data sharing and regional collaboration were of immense importance for all the countries across the Hindu Kush Himalaya region.She also expressed her hopes that the conference will be able to create the much-needed data generation journey in the region."
/business/economy/news/protect-environment-ensure-good-governance-3142346,"Protect environment, ensure good governance","Businesses of the country should be friendly towards the environment and need to ensure good governance to make Earth safer and promote wellbeing, said stock market analysts yesterday. They were addressing the closing ceremony of World Investor Week 2022 organised by the Bangladesh Securities and Exchange Commission (BSEC), Central Depository Bangladesh and Central Counterparty Bangladesh at Le Méridien Dhaka.This year the week targets to promote environment, sustainability and good governance in businesses.Sustainable financing has been being focused as the adverse effects of environmental degradation has already increased all over the world, said Shaikh Shamsuddin Ahmed, a BSEC commissioner.Between 2011 and 2020, deaths from natural calamities rose 15 times, he said, adding that entrepreneurs should focus as much as possible on producing goods safeguarding the environment.Developed countries make the most carbon emissions. ""However, we are the victims of the situation,"" he said.Some analysts are suggesting to reduce production to reduce carbon emissions. ""If we do it, our job market will be impacted,"" he pointed out.""Bangladesh has no way to sacrifice jobs in the course of maintaining environment-friendly business,"" said the commissioner.Some big buyers of European countries pay premium prices if any company uses recycled materials, pointed out Mohammad Tareq, a director of Central Counterparty Bangladesh.So, time has come to give importance on environment-friendly production, he said.Many companies have already taken up a stance on focusing environmental and governance issues in financial reports so that investors can realise how the company reacts towards the environment, sustainability and good governance, he added.Profit maximisation should not be the main goal of a company in today's world, moreover, it should be being friendly towards the environment, said Mohammed Nasir Uddin Chowdhury, managing director of LankaBangla Securities.The stock market regulator can launch a policy with some parameters so that listed companies are also categorised over their sustainability, he said.While the world is focusing on the environment the most, Bangladesh needs to give massive focus on good governance issues as it is a big problem here, said Md Moniruzzaman, managing director and CEO of IDLC Investments.Ensuring good governance has a huge impact on society, he said, adding that the government's tax collection may rise if good governance can be ensured among businesses.For instance, the government can increase its contribution to the wellbeing of the masses if it can properly secure taxes from businesses, he added.A tendency to run only after profits took over entrepreneurs since the 1990s, said AKM Nurul Fazal Bulbul, vice chairman of Central Depository Bangladesh.Now, many have changed their mindset already. It should be much better in the coming days, all to ensure sustainability of their businesses and betterment of the country, he added.Md Eunusur Rahman, chairman of Dhaka Stock Exchange, Shuvra Kanti Chowdhury, managing director and CEO of Central Depository Bangladesh, and Farhad Ahmed, managing director and CEO of Central Counterparty Bangladesh, also spoke at the event. "
/sports/football/news/ten-hag-pleased-man-utd-showed-will-win-3142616,Ten Hag pleased Man Utd showed will to win,"Manchester United manager Erik ten Hag said his side were guilty of poor finishing but praised their self-belief after Scott McTominay scored in stoppage time to give them a 1-0 Europa League win over Cypriots Omonia Nicosia on Thursday.United had 34 shots and dominated possession in the Group E encounter but were unable to break the deadlock until substitute McTominay scored in the 93rd minute.""I would say the performance till the box was good, but then the finishing of course was not that good. Let's hope that we have saved the goals for the coming week,"" Ten Hag told reporters.He said his team have enough creativity to win matches but that some of his players just had an off-night in front of goal.""What the good thing is, and I have to credit the team for that, they keep going and they don't give up,"" he added. ""They keep believing (that they could) score and in the end, they got rewarded. And that is the way you have to do it.""Group leaders Real Sociedad have sealed their spot in the next round while United are six points ahead of Sheriff Tiraspol, with Omonia bottom after losing all four of their games.United host Sheriff on Oct. 27 before finishing their group campaign with a trip to Spain to face Real Sociedad on Nov. 3."
