URLS,Headline,Article
/news/bangladesh/agriculture/news/azizar-pioneer-organic-farming-3142436,"Azizar, a pioneer in organic farming","In an interview in 2010, Ramnivas Agarwala, owner of Annapurna Organic Fertiliser Factory in Nilphamari, said, ""Soil is the mother. Soil says you give me 10kg of seeds and one maund of fertiliser. In return, I give you 50 maunds of paddy and 50 maunds of straw. Have you ever wondered where it comes from? It comes from my own body. You do one thing; you keep the paddy and give me the straw. You are my children. I wonder what will happen to you when I (soil) will die. So, keep me alive for your own sake.'' The philosophical thoughts from Ramnivas inspired me.During the time of the country's independence, our population was seven crores (70 million), and the number has gone up to over 17 crores (170 million) now.All our food is being produced from the land we had since the liberation. It hasn't increased by an inch, rather, decreased further over the years.To produce more crops from less land, we have put excessive pressure on the soil by applying chemical fertilisers. In the process, the soil loses its fertility, resulting in organic quality loss. In the meantime, although crop diversity has increased, farmers in our country are not aware of the proper use of fertiliser in different types of crops.At the open-field discussion among farmers and policymakers 'Krishi Budget, Krishoker Budget (Farmers' Voices in Budget),' I asked the farmers whether they went for a soil test. Less than one percent of farmers said they did. Most disappointingly, not even five percent of farmers were aware of soil testing. But these people needed to know that organic matter is the life of the soil.Five percent organic matter in the soil is required to maintain crop productivity. Unknowingly, they have been using excessive fertilisers and pesticides over the years. This has reduced the organic matter in the soil by one percent in most parts of the country, posing a major threat to food production for the growing populations.I took a programme, 'Grow-Green' some years back to boost farmers toward use of organic fertilisers. Also, I wanted to highlight the success of those who practice organic farming.Probably you would remember, Kaliganjpara village in Rangpur's Mithapukur upazila, which is known as an 'organic village' for decades. I showed their activities on Hridoye Mati O Manush as they were the pioneers in organic farming. Since then, the use of vermicomposting (a natural process whereby earthworms convert waste material with rigid structures of compost) started extensively.Farmer Azizar Rahman, like many others, was associated with the programme of making vermicompost on a very small scale. He used to apply the earthworm produced in his factory. Seeing good production of Azizar many farmers started using earthworms to make natural fertilisers for enhancing plant growth.Soon Azizar realised that the production of earthworms could be a good business potential. Vermicompost contains 10 of the 16 essential plant nutrients.According to research, organic matter is 28.32 percent, nitrogen 1.57 percent, phosphorus 1.26 percent, potassium 2.60 percent, calcium 2 percent, magnesium 0.66 percent, sulphur 0.74 percent, boron 0. 06 percent and iron 975, manganese 712, zinc 400 and copper 20 PPM.Vermicompost can be applied to all types of crops. Usually, three to four tonnes are used per hectare for vegetables and other agricultural products, while five to 10kg is used for each fruit plant. Farmers said with the use of vermicompost the yield has increased by 20 to 25 percent. Azizar said earthworms contributed to better soil health and fertility. Azizar now earns Tk 25,000 (USD 246.13) from his vermicompost factory every month.Azizar built a factory on three decimals of land, spending Tk 2.5 lakh (USD 2461.07), and produces five to six tonnes of organic fertiliser every month.The demand for his fertiliser is gradually increasing, not only in the surrounding areas. A small regional company regularly buys Azizar's fertiliser and sells those, using their brand name and packets.Azizar has a dream to start his own organic fertiliser product in future.   The use of organic fertilisers not only protects the soil's health, but it also reduces the need for chemical fertilisers.When chemical fertilisers are witnessing a short supply worldwide, moderate use of chemical fertilisers along with organic fertilisers can ensure good yields. It would reduce the production cost as well.Alongside the cultivation of fruits and vegetables, rooftop farming is also increasing across the country. In these cases, the use of vermicompost can play a huge role.A number of companies have now come forward in organic fertilisers and vermicompost production. Azizar's factory can be an inspiration for many unemployed youths and entrepreneurs.Besides, an employment sector can be created with a little investment that can contribute to sustainable agricultural development."
/middle-east/news/us-seeking-destabilise-iran-3142296,US seeking to destabilise Iran,"Iran's President Ebrahim Raisi yesterday accused arch-enemy the United States of seeking to destabilise the Islamic republic, which has been rocked by nearly a month of women-led protests sparked by the death of Mahsa Amini.Outrage over the 22-year-old woman's death, three days after she was arrested by Iran's notorious morality police, has fuelled the biggest wave of street protests and violence seen in the country for almost three years.Young women, university students and schoolgirls have been at the forefront of the protests, shouting anti-government slogans, setting their headscarves ablaze and facing off with security forces in the streets.Chants of ""Woman, Life, Freedom"", the protest movement's catchcry, were again heard overnight in the northwestern city of Bukan, where demonstrators burned the Iranian flag, in a video verified by AFP.Protesters also rallied in the capital Tehran, Isfahan in the south, Mashhad in the northeast, Rasht in the north and in Amini's western hometown of Saqez.Raisi again blamed the United States, its bitter foe since Iran's 1973 Islamic Revolution and chief adversary in a standoff over Iran's nuclear programme.""Following the failure of America in militarisation and sanctions, Washington and its allies have resorted to the failed policy of destabilisation,"" he said, speaking in Kazakhstan.Iran's judges have been issued orders against handing down soft sentences for people found to be the ""main elements of riots"", the judiciary said yesterday.Iran has charged more than 100 people over the ""riots"" in Tehran and the southern Hormozgan province alone, it said.Gunshots and tear gas were fired on Wednesday as security forces confronted protests in a crackdown that rights groups say have already claimed at least 108 lives.New online videos showed the public confronting security forces as they sought to arrest demonstrators, at times forcing officers to run away.Oslo-based group Iran Human Rights said energy industry workers had joined protest strikes this week at the Asalouyeh petrochemical plant in the southwest, Abadan in the west and Bushehr in the south.Deadly unrest has rocked especially Sanandaj in Amini's western home province of Kurdistan -- but also Zahedan in Iran's southeastern Sistan-Baluchestan province, where demonstrations erupted on September 30 over the reported rape of a teenage girl by a police commander.The Human Rights Activists News Agency charged that ""the unregulated use of shotguns with pellets by law enforcement has resulted in the injury of many protesters"", including elderly people, teenagers or even children.In a report released on Wednesday, HRANA said it had the names of at least 106 people slain by the security forces, and knew of another 11 dead who remained unidentified.At least 94 more had been killed in Zahedan, one of the few Sunni-majority cities in predominantly Shia Iran, HRANA said, adding that 20 security personnel had been killed, including six in Zahedan.""The number of detainees is estimated to be at least 5,500 individuals,"" the rights group said.In its widening crackdown, Iran has restricted internet access and blocked social media platforms including Instagram and WhatsApp.The United States, which has imposed new sanctions against Iran amid the Amini protests, said it was taking steps to ensure Iranians would have online access."
/nrb/departure-arrival/airlines-more/news/biman-breaking-all-records-3142186,‘Biman breaking all records’,"Biman Bangladesh Airlines has earned a record amount of revenue by carrying a record number of passengers in the last three months. The national flag carrier carried around 8.8 lakh passengers and earned Tk 1,563 crore breaking all previous records.Biman Managing Director and CEO Zahid Hossain announced the numbers yesterday at a press conference at Biman's headquarters in the capital's Uttara.""If the trend continues, at least 32 lakh passengers can be transported in this year,"" the Biman boss said.He also mentioned that ground handling services have also improved as now all luggage can be delivered to passengers within a maximum of 45 minutes.""Biman Bangladesh Airlines is the only organisation recognised by IATA. A recent audit conducted by European Union Aviation Safety Agency (EASA) did not give any (negative) observations over Biman,"" said Zahid.When asked about the allegations against a captain regarding the recruitment of pilots and harassment of female pilots, Zahid Hossain said, ""We will take necessary actions regarding  such complaints.""He also said the biggest challenge of Biman is to ensure quality services to the passengers.When asked about the boycott of yesterday's press conference by Aviation Tourism Journalist Forum of Bangladesh for not cooperating with journalists, Zahid Hossain said, ""They have the right to boycott. I assure you that in the next three months you will see a lot of progress on Biman's media operations as well. I will do my best to give you the respect you deserve."""
/news/bangladesh/diplomacy/news/unga-resolution-dhaka-votes-against-russias-annexation-3142251,UNGA resolution: Dhaka votes against Russia’s annexation,"Bangladesh has voted in favour of a UN General Assembly resolution demanding that Russia reverses its course on ""attempted illegal annexation"" of four regions of Ukraine.In the voting that took place in New York early yesterday (Dhaka time), the UNGA passed the resolution by a large majority, calling on countries not to recognise the four Ukrainian regions which Russia has claimed following so-called referendums late last month.A total of 143 member states voted in favour of the resolution and Belarus, North Korea, Nicaragua, Russia, and Syria voted against. Thirty-five nations abstained, including China and India.This was the highest number of votes against Russia since its invasion of Ukraine in February this year.The debate over the Ukrainian resolution began on Monday.Last week, President Vladimir Putin signed documents to make the eastern Ukrainian regions of Luhansk, Donetsk, Zaporizhzhia, and Kherson part of Russia. The UN Security Council failed to adopt a resolution, condemning the annexation, as Russia vetoed.Bangladesh said it strongly believes that the purposes and principles of the UN Charter regarding respect for sovereignty and territorial integrity, and peaceful settlement of all disputes must be complied universally for everyone, everywhere under all circumstances, without any exception.In a statement, the foreign ministry yesterday said, ""In this connection, we specially underscore the need to take similar uniform stand by the international community against the annexations of Palestinian and other Arab land by Israel.""Bangladesh remains deeply concerned by the continuation of the conflict in Ukraine and its global socio-economic implications, with the countries facing high inflation, disruptions in energy supplies and a possible global economic recession.""We believe that antagonism like war or economic sanctions, counter-sanctions cannot bring good to any nation. Dialogue, discussion and mediation are the best ways to resolve crises and disputes. ""As a firm believer of multilateralism, we will continue to stand with the United Nations and the office of the secretary-general and supporting them in every way we can.""We urge that in order to gain the trust and confidence of the people at all levels, the UN and the office of the secretary-general must lead from the front and work to fulfill the expectations of all,"" it said.Bangladesh urged all parties in the conflict to play positive role for de-escalation and resume immediate diplomatic dialogue in order to settle all disputes by peaceful means, and refrain from taking any action that may endanger international peace and security.The statement said all should work towards ending war and stopping arms race for the good of mankind."
/news/bangladesh/crime-justice/news/40-bnp-men-get-anticipatory-bail-three-cases-3142141,40 BNP men get anticipatory bail in three cases,"A total of 40 BNP leaders and activists including its Gazipur president AKM Fazlul Haque Milan received six weeks' anticipatory bail from the High Court yesterday in three cases filed on charges of vandalising vehicles, blasting bombs, and obstructing police in discharging duties.The bench of Justice Mustafa Zaman Islam and Justice Md Khairul Alam passed the order after hearing three petitions filed by the accused BNP men from Gazipur, Munshiganj and Rangamati.The HC bench also asked them to surrender before the lower courts concerned in six weeks.Lawyers Zainul Abedin, AJ Mohammad Ali, Gazi Kamrul Islam Sajal, Kayser Kamal and Abdul Zabbar Bhuiyan argued for them during the hearing. Kamal said police filed the cases against the BNP men under the similar charges during the ongoing movement against the government. They were filed on false charges to harass them."
/business/economy/news/sea-pearl-posts-profit-jul-sep-quarter-3142461,Sea Pearl posts profit in Jul-Sep quarter,"Sea Pearl Beach Resort & Spa Ltd posted profit in the July-September quarter of 2022.    The company made a net profit of Tk 15.36 crore during the quarter. It lost Tk 1.05 crore in the first quarter of 2021-22.Thus, its earnings per share were Tk 1.27 in the July-September quarter against a negative of Tk 0.09 in the identical three-month period in 2021, according to the un-audited financial statements.In a filing on the Dhaka Stock Exchange (DSE) yesterday, Sea Pearl credited the improvement in the coronavirus pandemic situation, higher revenue for the utilisation of rooms during peak seasons, and full-fledged operation of the water park, and cruise ship for the turnaround.Net operating cash flow per share surged to Tk 2.43 in the quarter from Tk 0.74 earlier. Its net asset value per share stood at Tk 13.01 on September 30 and Tk 11.77 on June 30.The profit of the hotel, located in Cox's Bazar, jumped by more than 118 per cent year-on-year to Tk 16.13 crore in the last financial year as people have begun travelling again following the improvement in the coronavirus situation.Sea Pearl's shares closed down 0.47 per cent at Tk 146.90 on the DSE yesterday. "
/news/bangladesh/accidents-fires/news/boat-capsize-bay-3-bodies-recovered-3142721,Boat capsize in Bay: 3 bodies recovered,"Bodies of three people, who went missing after a stone-laden ship -- MV Sultan Sanjana – capsized in the outer anchorage of the Bay of Bengal on Wednesday were recovered today (October 14).Three more people are still missing, Chattogram Coast Guard media officer Lt Commander Abdur Rouf told The Daily Star.He said the Coast Guard recovered the bodies of two people and the Navy recovered one body.The families have been informed to identify the bodies, he added.Captain Kazi Shah Alam, zonal commander of the Coast Guard's East Zone, said the lighterage ship capsized after a collision with another ship in the outer anchorage on Wednesday afternoon.The Coast guards rescued three people and six remained missing.The bodies of three among the six missing were recovered today. The Coast Guard members are working to locate the remaining three."
/opinion/editorial/news/the-power-sector-needs-urgent-overhaul-3142586,The power sector needs an urgent overhaul ,"The power sector seems to be in a shambles at the moment. Unfortunately, when people are struggling with long hours of load shedding every day, the government and power-producing companies seem to be doing little to bring an end to the problem. The crisis has become acute this month as many of the independent power plants (IPPs) that run on heavy fuel oil have stopped producing electricity, because of a standoff with the government over non-payment of bills. Reportedly, the government owes a staggering Tk 16,000 crore to the IPPs, and the latter are unwilling to import fuel to generate electricity until their bills are cleared.The bills include the price of fuel, power purchased by the government, and capacity charge, which the government is legally obligated to pay even if it does not buy power from a plant. Reportedly, on October 12, as many as 48 power plants were sitting completely idle citing fuel shortages and engine problems – a quarter of them run on heavy fuel oil. While, according to the president of Bangladesh Independent Power Producers' Association, the unpaid bills have mostly hampered small- and medium-sized power plants – which exhausted their banking lines and can no longer open lines of credit – even big companies that can buy fuel from Bangladesh Petroleum Corporation are reportedly also sitting idle citing high import costs. Moreover, some of the companies are not operating despite having the fuel to go into production. Thus, it seems, most of the IPPs are using the power crisis to create a pressure on the government. This is totally unacceptable.From the present power crisis, it is clear that our policies regarding power generation have been flawed on many grounds. It has been identified in various news reports published over the past few months that the deals the government had signed with the power plants and companies went against our national interests. These companies have not only been taking an insane amount of money from the exchequer as capacity charges, they are also selling electricity at much higher prices. Many of the short-term rental power plants have been running for a decade now with high profit margins. As they went through multiple renewals over the years, they kept the provisions for capacity payments intact, which means huge amounts of public money are still being wasted on them.In order to recover from the present power crisis, the government must come to an understanding with the IPPs so that they do not stop their production. While the government must pay the companies their dues as soon as possible, it must also take action against the companies that are unnecessarily worsening the crisis. Finally, we need a complete overhaul of our energy policies, including a critical rethink of the provision for capacity charges, to avoid any further crisis."
/opinion/editorial/news/election-commission-shows-rare-courage-will-courage-be-enough-3142591,"EC shows rare courage, but will it be enough?","That a day would come when the Election Commission would do anything beyond perfunctory efforts to stop electoral irregularities was unthinkable even a few days ago. But the unthinkable has happened. The suspension of the Gaibandha-5 by-poll, after voting was stopped in 50 out of 145 centres amid widespread irregularities and a mass boycott by all but one candidate, is an extraordinary move, an exercise of the highest power granted to the EC. We welcome the EC for showing such courage – a rarity for bureaucrats-turned-commissioners – which is perhaps the only silver lining to an otherwise botched operation. But courage alone will not be enough to ensure fair elections, nor can it make up for the EC's – and by extension, the administration's – inability to control the Gaibandha situation.   The suspension decision has, justifiably, stunned both political parties and election observers, who noted its unprecedented nature in the recent history of parliamentary elections. But too much focus on the merits of the decision risks taking away from the fact that serious irregularities did occur, in the presence of election and law enforcement officials no less. The EC cited irregularities including illegal presence of individuals in polling booths, voters being forced to vote for a certain candidate, criminals cutting the cables of CCTV cameras, etc. The situation was ""out of control"", it said. Some candidates also alleged that their agents were forced out of the centres. An independent candidate even said that Awami League men didn't allow him to cast his own vote.So, while it's true that the EC took a drastic decision in its first brush with parliamentary elections, it is also true that it did so in the face of tremendous odds. If this is a sign of things to come, we have every reason to worry about the upcoming national election. Right now, the challenge for the EC is to get the Gaibandha-5 by-poll back on track. But it also has to investigate all reported irregularities and the potential complicity of election officials, and punish those responsible. Otherwise, all this will amount to nothing but a token concession to disgruntled opposition parties.Until Wednesday, the EC largely appeared to be appeasing the ruling party in election-related decisions. It allowed the use of electronic voting machines (EVMs) in the upcoming national election, despite protests from most political parties. It refused to punish high-profile violators of electoral codes. It failed to send a strong message to field-level administrators – deputy commissioners (DCs) and superintendents of police (SPs) – after their grievous misconduct in a recent conference. As well as setting examples of neutrality and transparency in all its actions and preventing any collusion among election officials and the ruling party, the EC also has to figure out a way to secure unconditional support from the administration.This is a tall order indeed, and we remain unconvinced that the EC can navigate all these challenges and hold fair elections on its own. This is why the support of all stakeholders, especially the ruling party and the administration, is vital. The public has grown tired of watching violent and non-participatory elections year after year. The authorities must find a way to avoid that in the future."
