URLS,Headline,Article
/sports/football/news/saka-earns-win-arsenal-bodoglimt-europa-league-3142456,Arsenal win in Europa League as McTominay rescues Man Utd,"Arsenal maintained their perfect start to the Europa League as Bukayo Saka's goal clinched a 1-0 win at Bodo/Glimt, while Manchester United left it late to beat Omonia Nicosia.Saka struck midway through the first half in Norway to give the Gunners a third win in as many outings in Group A.""I'm really happy with the win against a team that has won the last 14 games here at home,"" Arsenal coach Mikel Arteta told BT Sport.""We were expecting a really tough night here and we made a lot of changes again but I'm delighted to find a way to win.""Arsenal are two points clear of PSV Eindhoven, who thrashed FC Zurich 5-0. Bodo/Glimt have four points from four matches.Scott McTominay spared United's blushes with a 93rd-minute goal in a 1-0 win over Cypriots Omonia at Old Trafford.Omonia goalkeeper Francis Uzoho pulled off a string of fine saves to frustrate a wasteful United before the Scotland midfielder fired home in stoppage time.""You have to be patient sometimes. Their goalkeeper was a different class but we created enough chances and deserved to score in the end,"" McTominay told BT Sport.""It's a massive goal because we need to win the group.""Erik ten Hag's team stayed three points behind Group E leaders Real Sociedad, who beat 10-man Sheriff Tiraspol 3-0 to record a fourth successive win.La Real are guaranteed to advance. They host United on November 3 in a clash likely to determine which team goes directly into the last 16.Each of the eight group runners-up will face a team that drops down from the Champions League, in a knockout round play-off in February.- Betis lose perfect record -Real Betis dropped their first points of the competition after a 1-1 draw at home to Roma in Group C as they missed the chance to secure a last-16 spot.Sergio Canales put Betis ahead on 34 minutes but Andrea Belotti equalised for Roma, who remain third in the section behind Ludogorets. The Bulgarians won 2-0 at home to HJK Helsinki.Freiburg eased to a fourth consecutive victory in Group G, piling further misery on Nantes with a 4-0 win away to the French Cup holders.Fenerbahce and Rennes both ensured they will progress from Group B. Fenerbahce won 2-1 at AEK Larnaca, while Rennes defeated Dynamo Kyiv 1-0 in Krakow.Belgium's Union Saint-Gilloise must wait to make sure of a place in the last 16 despite coming from two goals down in a thrilling 3-3 draw against Braga.Union Berlin revived their hopes in Group D as Robin Knoche's 89th-minute penalty gave the surprise Bundesliga leaders a 1-0 victory over Malmo.All four teams in Group F are level on five points. Lazio drew 2-2 at home to Sturm Graz while Feyenoord were held by the same scoreline by Midtjylland.Ferencvaros are three points clear in Group H after beating Red Star Belgrade 2-1. Trabzonspor hammered Monaco 4-0 to climb above the Ligue 1 side into second.Villarreal qualified for the last 16 of the Europa Conference League as winners of Group C. Senegalese midfielder Nicolas Jackson scored the only goal in their 1-0 win at Austria Vienna.West Ham advanced from Group B following a 2-1 win over Anderlecht courtesy of goals from Said Benrahma and Jarrod Bowen.The Hammers need just a point from their final two games to wrap up top spot.Istanbul Basaksehir and Djurgarden will also continue their European adventure in the new year."
/entertainment/tv-film/news/dui-diner-duniya-masterful-mix-logic-and-supernatural-mystique-3142776,‘Dui Diner Duniya’: A masterful mix of logic and supernatural mystique,"When an enigmatic figure—who claims to be from the future—crosses paths with a regular truck driver, where does the story go? Well, this is the plot of Chorki's newest release, ""Dui Diner Duniya"".Starring the stellar duo of Chanchal Chowdhury and Fazlur Rahman Babu, the mystery-thriller is where the past, the present, and the future collide, all at once, to show how life's simplest philosophy of retribution has the strangest ways of manifesting itself.One night, while trucking through the highway, Samad (Chanchal Chowdhury) spots a lone old man—later introduced as Jamshed (Fazlur Rahman Babu)—who is following him everywhere. Upon accepting Samad's offer for a free ride, Jamshed confesses that he has come here from the year 2033.He goes on to say that he is here to help Samad survive grave danger, which will inevitably take place soon. To Samad, all of this sounds like the tale of a madman, or the conspiracy of a fool. Samad continues to believe this narrative until a string of unfortunate events, caused in the wake of Samad's past misdeeds, start to surface. This is when we see Jamshed's life and true identity begin to gradually unravel themselves.Anam Biswas's direction and Ashraful Alam Shaon's storytelling was a highly anticipated collaboration, yet I was not ready for the sheer magnitude of their masterful layering of earthly logic and supernatural mystique.Although, by the end of the story, the core message becomes quite clear, the brilliance lies in the multifaceted possibilities of interpreting everything leading up to it.From the birds' eye shots of Samad's truck navigating the long stretch of the highway, eerily reminiscent of life's stubborn continuity despite the burdens of the past; to the role of Jamshed himself in the crescendo, seemingly a personification of one's own karma, it felt as if I might miss a subtle metaphor every time I dared to blink.The climax, in particular, hit home because of the clever do-or-die implications, a fine illustration of kismet's merciless revenge. Immediately followed by yet another mind-boggling turn, the ending manages to leave a trail of questions despite providing closure, leaving us with somewhat of a pleasant dilemma.When one takes attention away from the small details and looks at the bigger picture, it's astounding how ""Dui Diner Duniya"" utilises its female side-characters, as all of them— despite minimal screentime—play a massive part in the outline of the core plot.It might not seem noticeable at first, but Samad—whose vilest deeds include a woman as one of his victims—finds his daughter in the crux of his ultimate destiny, the key to which also lies in the hand of another woman, equal retribution once again. My personal favourite female character in this case was Moushumi Hamid as Lata, who doesn't get to say much, and yet leaves a mark.Chanchal Chowdhury and Fazlur Rahman Babu fit into their roles as neatly as puzzle pieces falling in place, maintaining perfectly convincing character, while delivering performances without overshadowing one another throughout the entire duration. As a whole, ""Dui Diner Duniya"" is a story viewers might need some time to process, but it will be one that stays with you."
/tech-startup/news/xiaomi-12s-ultra-kicking-it-notch-3142381,Xiaomi 12S Ultra: Kicking it up a notch,"Xiaomi has been playing the safe game in Bangladesh for a while now. Churning out generic yet market-tested devices is in its local DNA. We understand that and it does not mean it is a bad thing. In fact, quite the contrary- it has been able to secure the top seat in the market in the last quarter by following the safest playbook. But at its root, Xiaomi is an innovator and pusher of boundaries. The Xiaomi 12S Ultra, which we had the opportunity to fiddle with for a month or so, is a very good example of that. Unfortunately, despite having killer specs and top-notch hardware, we could only utilise its camera as it came with Chinese ROM. Even the keyboard was hard to use as it came with only generic Chinese keyboards. As the camera is the central aspect of the phone let's keep our focus locked on the camera for this review: Firstly, the main camera system is massive and top-heavy. The Leica-designed camera module is the mainstay here. Supplementing it is a Sony IMX989 processor for the 50 megapixels module. IMX989 is renowned for delivering top-notch photos that are crisp and full of colours. The main camera, as a whole as a unit, delivers outstanding photos. The vibrance and details are better than another top-tier Samsung smartphone we are reviewing right now. It performs splendidly well in a low-light environment. Due to the 1-inch sensor, we can get a hint of a bokehish effect in some of the images. The 5x periscopic optical zoom does an average job of bringing the far objects closer. The ultra-wide-angle camera also does not stand out, unfortunately. The images visibly lacked the colour contrast and sharpness that is a must in many high-end smartphones these days. Before wrapping up, a few things we noticed about the phone: the fingerprint processor is blazingly fast and the vegan leather fill on the back does not do a good job replacing ceramic backs that we have seen on the high-end smartphones of Xiaomi. The phone also comes with an extremely crisp display with a 10-bit colour gamut with a variable refresh rate of up to 120Hz. The brightness of the display is also as good as many other flagships you will encounter in the market.Verdict: Xiaomi outdid itself. For that, we certainly recommend patting itself on the back. The phone's extraordinary camera can certainly put the top dogs of Samsung and Apple on a chase. Unfortunately, the Chinese ROM hindered us from trying out the rest of the functions of the phone. The phone's price is close to BDT 1 Lac on the grey market. Xiaomi is officially not selling it in Bangladesh so that's a bummer."
/news/bangladesh/diplomacy/news/refrain-violence-3142181,Refrain from violence,"German Ambassador Achim Tröster yesterday expressed concern over growing political violence and called upon all to refrain from it.""This (refraining from violence) is not difficult. It is a everyone's personal decision to behave in a civilised or uncivilised manner,"" he said replying to questions from the media at a press conference at his residence.The event was organised to launch the German Business Council (GBC), a platform for German private companies operating in Bangladesh.He said recently, his colleagues representing other countries uttered their concern because of the growing political violence.He said as a friend of Bangladesh, he was ""very concerned at the deep antagonism"" he found here.""I don't think that considering political opponents as the enemy is very conducive to a healthy democratic environment,"" he said.He said his government is of the firm opinion that a country is best ruled by a democratic system. And his country is convinced that free, fair and transparent election is a big contributing factor to political stability.""A stable business environment is important for foreign direct investment Nobody would like to have his investment at risk,"" Tröster said. "
/entertainment/music/news/kabir-suman-live-dhaka-will-now-take-place-engineers-institute-3142691,‘Kabir Suman Live in Dhaka’ will take place at Engineer’s Institute,"Eminent singer Kabir Suman was supposed to perform in Dhaka after almost 13 years on October 15, 18 and 21, with tickets for all three days already being sold out. The concert was initially announced to take place in the main auditorium of the Bangladesh National Museum.However, yesterday, the Dhaka Metropolitan Police (DMP) had informed The Daily Star that they had not given permission from their side, to use the venue for the event, as it is a Key Point Installation (KPI).""The Bangladesh National Museum is a Key Point Installation, and this is why we did not grant permission for the event"", said DMP Commissioner MD Shafiqul Islam, to The Daily Star.MD Shafiqul Islam had also informed The Daily Star, as of yesterday, that the organisers of the event had not applied for permission to use any other venue. Now, it has been revealed by the organisers that the event will take place at the Institute of Engineers, Bangladesh (IEB). The news was also confirmed by the Additional Commissioner of DMP, AKM Hafiz Akter, who told several media outlets that the permission will be given.The programme will mark the 30th year of the release of Suman's popular solo album, ""Tomake Chai"". The noted singer will be performing his modern Bengali songs and Bangla Khayal at the three-day musical event."
/business/economy/news/cargo-complex-airport-boost-export-sylhet-3142441,Cargo complex at airport to boost export from Sylhet ,"The history of people from Bangladesh's Sylhet division living in European countries, especially the United Kingdom, goes back around 350 years and the diaspora there has kept growing over the centuries.But despite living abroad for so long, the Sylheti people have never let their cultural heritage fade away. As a result, the demand for food and other products from the region, such as different types of citrus and rattan furniture, is rising in the countries they reside in.These goods are mostly exported through the Hazrat Shahjalal International Airport in Dhaka as the required facilities at the Osmani International Airport in Sylhet were not put in place.But as an export cargo complex has finally been set up at the airport, the days of wait, extra efforts and expenses, and the drop in the quality of goods are over.The facility was constructed between February 2020 and August 2021 by the airport authority in association with Biman Bangladesh Airlines at a cost of around Tk 30 crore.Later, Tk 14 crore was spent on installing explosive detection scanners in the facility, which was validated by the European Union in April this year.Currently, no cargo flights are operated from Sylhet although each Biman flight is capable of carrying 12 tonnes to 18 tonnes of goods, according to Md Hafiz Ahmed, director of the Osmani International Airport.Even though the export cargo complex is all set to facilitate shipments, one hurdle remains in sending perishable items abroad: agricultural produce needs to be packed in a warehouse of the Department of Agricultural Extension (DAE) and must be certified after testing at a laboratory operated by the same authority.However, such a facility is only available at Shyampur in Dhaka. As such, Sylhet-based businesses have long been urging the authorities to establish the facility in the region.Md Hizkil Gulzar, an exporter and a director of the Sylhet Chamber of Commerce and Industry (SCCI), said local businesses suffer a lot in exporting goods via Dhaka due to a lack of warehouses and a certification lab nearby.""If such facilities were in Sylhet, the export would receive a boost since many new traders would open businesses.""The SCCI has sent several letters to the agriculture, commerce and foreign ministries to press home its demand since January last year. It also organised a seminar in this regard on February 15, where Agriculture Minister Mohammad Abdur Razzaque was present.At the event, the minister assured the association of taking the necessary steps to establish such facilities in the northeastern divisional city.On September 6, the SCCI handed over a letter to Prime Minister Sheikh Hasina mentioning 17 demands, including that for a warehouse and a certification laboratory.Md Mustafizur Rahman, president of the Jalalabad Vegetable and Frozen Fish Export Group, said the demand for citron and other citrus fruits, naga chilli, sour fruits, beans and many vegetables is rising abroad but exporters in Sylhet do not want to go to Dhaka to process shipments.Currently, there are 15 exporters in Sylhet.""Once the warehouse and the certification laboratory are established, more people will be interested in exporting,"" he added.At present, the DAE has no plan to establish a warehouse and certification lab in the city.""But we realise the need for such facilities at the Sylhet airport as it will help export fresh perishable produce from the region,"" said Sayed Rafiqul Amin, director of the DAE's plant quarantine wing.Amin went on to say that as the need for such facilities is huge, the DAE could extend various support, including human resources, for private initiatives to establish the required facilities.Tahmin Ahmed, president of the SCCI, said the chamber has been urging the authorities to set up the warehouse and certification facilities for years but to no avail.""We have recently informed the prime minister of our demands and we are hopeful that the premier will take necessary initiatives soon."" "
/news/bangladesh/crime-justice/news/bgb-arrests-3-people-seizes-illegal-indian-products-khagrachari-3142666,"BGB arrests 3 people, seizes illegal Indian products from Khagrachari  ","BGB arrested at least three people and seized illegal Indian products including sarees, cigarettes and Buddha statues when the goods were being smuggled through S A Paribahan in Khagrachhari district.The operation led by the district deputy commissioner's team was conducted at Narkel Bagan area around 10pm on Thursday (14.10.2022), reports our local correspondent.The arrestees are deputy manager of Khagrachhari S A Paribahan office Amzad Hossain, parcel assistant Badol Hossain and one Jhantu Singh.Khagrachhari district Senior Assistant Commissioner and Executive Magistrate Manjurul Alam said, for a long time a group had been smuggling illegal Indian products through the border area which was then distributed  countrywide using S A Paribahan network.During the operation, at least ten Buddha statues, 1110 pieces of sarees, 838 cigarette boxes, 200 pieces of lungi and some other goods estimated to be about Tk 10 lakh was seized."
/news/bangladesh/politics/news/gaibandha-5-al-questions-ecs-decision-halt-polls-3142221,Gaibandha-5: AL questions EC’s decision to halt polls,"The ruling Awami League yesterday questioned the Election Commission's decision to postpone the by-elections to Gaibandha-5 while its archrival the BNP said the decision proved that no free and credible election is possible under a partisan government.The AL also said the commission's decision proved that elections are always held under the EC and as per its decisions and thus there is no justification for the BNP's demand for a polls-time caretaker government.Addressing a programme in the capital, AL General Secretary Obaidul Quader said it was not clear why the voting in the by-polls was stopped on Wednesday.""I will humbly request the Election Commission to think about how logical, legal and realistic its decision was on halting the polls through monitoring CCTV footage from Dhaka,"" he said.Quader, also the road transport and bridges minister, however hoped that the EC would take appropriate measures to hold free, fair, and acceptable elections.AL Joint General Secretary Hasan Mahmud said people are saying that the EC's decision has been called into question as it suspended the by-polls watching CCTV footage sitting about 500km away from the electoral constituency.Hasan, also the information and broadcasting minister, said this decision proved that ""elections are always held under the EC and as per its decisions and the government has no role in this regard"".That's why there is no justification for the formulas of polls-time caretaker government, neutral government or other governments, put forward by the BNP and others, the minister told reporters at his Secretariat office.Meanwhile, BNP Secretary General Mirza Fakhrul Islam Alamgir yesterday said the EC itself withheld the Gaibandha-5 by-election after not being able to conduct the polls in a fair manner.This proved that holding a free and credible election is not possible under a partisan government, he told journalists at his hometown Thakurgaon in the afternoon.The BNP leader once again demanded an election-time caretaker government.Our Thakurgaon correspondent contributed to this report."
/entertainment/tv-film/news/vicky-kaushal-and-katrina-kaif-celebrate-their-first-karva-chauth-3142566, Vicky Kaushal and Katrina Kaif Celebrate Their First Karva Chauth,"Since last year Bollywood has witnessed many weddings and this Karva Chauth is the first one for many of our lovely Bollywood Couples. Here's the first Karva Chauth celebration of Vicky Kaushal and Katrina Kaif.Katrina Kaif tied the knot with actor Vicky Kaushal on 9 December 2021, in an intimate ceremony attended by family members and close friends in Rajasthan.She, like all married Hindu women, was dressed up for the auspicious occasion. She chose to wear a lovely watermelon pink saree with a floral blouse. She completed her ethnic ensemble with red bangles and sindoor. A post shared by Katrina Kaif (@katrinakaif)
Katrina took to Instagram to share a few photos from her Karwa Chauth celebrations with her husband and in-laws.Fans expressed their awe in the comment section whereas other celebrities wished the beautiful couplePriyanka Chopra commented on the post saying ""Congratulations so beautiful ""While Karisma Kapoor wished the couple saying, ""Happy 1st Karvachauth."""
/entertainment/tv-film/news/emon-joins-mithila-childrens-film-nuliachhorir-shonar-pahar-3142681,Emon joins Mithila on children’s film ‘Nuliachhorir Shonar Pahar’,"Popular actor Mamnun Emon has joined the cast of the children's film, ""Nuliachhorir Shonar Pahar"", where he will be working alongside Rafiath Rashid Mithila. The shooting of the film is expected to begin on October 28 in Chattogram.Regarding his decision to join the film, Emon said, ""This is the first time I will be working on a government-funded project, that too a children's film. I will be playing the role of Major Jahid in the movie.""   ""Nuliachhorir Shonar Pahar"" is an adaptation of the popular children's novel of the same name, authored by noted journalist and human rights activist, Shahriar Kabir. The government-funded project will be directed by Lubna Sharmin, and co-produced by Meghla Islam.Aside from Emon and Mithila, the film has also cast Shopnil, Hiya, Raheen, and Israt, among others. "
/tech-startup/news/netflix-launches-ad-supported-subscription-plan-3142636,Netflix to launch ad-supported subscription plan,"Netflix is launching a new ad-supported tier called Basic with Ads in the US, the UK and a few other countries, states a recent announcement by the popular streaming platform. The Basic with Ads plan will come with a cost of $6.99 per month and will be officially launched on November 3 at 9 am PT.To compare, the current pricing of Netflix's plans are as follows: Basic for $7.99/month, Standard for $9.99/month, and Premium for $11.99/month. The ad-supported plan, when launched,  will be a cheaper alternative to these existing plans.The ad-supported Basic with Ads subscription plan will be launched in a total of 12 countries: Australia, Brazil, Canada, France, Germany, Italy, Japan, Korea, Mexico, Spain, the UK and the US. It is currently unconfirmed when this plan will be made available in Bangladesh, India or other South Asian countries.According to Netflix, the Basic with Ads plan will not affect the plans and subscription options the platform currently provides. Users will still be able to access and avail of the regular Basic, Standard and Premium plans. Netflix has also stated that due to licensing restrictions, some movies and TV shows will not be available in the Basic with Ads plan. Users will also not have the option to download movies and shows with this plan, and the video quality will be 720p/HD at maximum. As for the number of ads, Netflix has specified that Basic with Ads plan users can expect an average of 4 to 5 minutes of ads per hour. Ads will be 15 to 30 seconds long, which will be played before and during the shows and movies. Like current plans, this plan can be changed or canceled any time. "
/entertainment/music/news/queen-release-rediscovered-song-featuring-freddie-mercury-3142546,Queen release rediscovered song featuring Freddie Mercury,"Queen released a rediscovered song featuring Freddie Mercury on Thursday, the band's first new track with the late frontman's instantly recognisable vocals to come out in more than eight years.Guitarist Brian May and drummer Roger Taylor first told fans about the existence of ""Face It Alone"" during an interview in the summer. The track was originally recorded in the late 1980s during sessions for the band's chart-topping album ""The Miracle"" but it did not make it to release.Queen's production and archive team found it again when they began working on an upcoming box set reissue of the album, due to be released in November.""We'd kind of forgotten about this track,"" Taylor said in a statement. ""But there it was, this little gem. It's wonderful, a real discovery. It's a very passionate piece.""""The Miracle"", Queen's 13th studio album, came out two years before Mercury died from AIDS-related pneumonia in 1991.The upcoming reissue, released as an eight-disc collector's edition box set, will feature six unpublished songs as well as dialogue between the band - Mercury, May, Taylor and bassist John Deacon - while in the studio.Queen last included three previously unheard songs featuring Mercury on their 2014 album ""Queen Forever"". ""I'm happy that our team were able to find this track ('Face It Alone'),"" May said.""After all these years, it's great to hear all four of us ... working in the studio on a great song idea which never quite got completed ... until now!"""
