URLS,Headline,Article
/news/bangladesh/news/pm-more-food-production-tackle-any-challenge-3139986,PM for more food production to tackle any challenge,"Prime Minister Sheikh Hasina today (October 11, 2022) called upon the countrymen to produce more food to tackle any challenge as the world community is apprehending a deep crisis next year.""Food production has to be increased. It is now inevitable and the utmost importance issue for us,"" she said.The premier was speaking at the beginning of the meeting of the executive committee of the national economic council (ECNEC) held at the NEC Conference Room in city's Sher-E-Bangla Nagar. She joined the meeting virtually from her official residence Gono Bhaban.Referring to her recent visit to the United Kingdom and the United States, she said she talked with the world leaders and representatives formally and informally, especially at the funeral of Queen Elizabeth II.The premier said she talked with the head of states, head of governments and head of different organisations as they all apprehended that there might be a grave famine in 2023 while the economic recession will be deepened and food crisis will appear.Sheikh Hasina said many countries are discussing the issue in the world. ""So, we have to increase food production and make arrangement of preserving food as well as process the food taking it into consideration,"" she said.The prime minister also urged the people to exercise austerity in every sector. ""We should not increase any unnecessary expense, rather we should be more economical and aware of using power, energy, water, gas etc.""She requested each family of the country to do savings whatever they can.""It is also applicable for the government,"" she said."
/business/economy/news/bangladesh-has-huge-export-potential-kosovo-dcci-3139591,Bangladesh has huge export potential in Kosovo: DCCI,"Bangladeshi investors should invest more in Kosovo to expand the south Asian country's export market in the landlocked nation, said Rizwan Rahman, president of Dhaka Chamber of Commerce and Industry (DCCI), yesterday.Increased communication between the private sectors of the two countries is needed now to boost bilateral trade with Kosovo, he said.He made the call in a meeting with the visiting Deputy Foreign Minister of Kosovo Kreshnik Ahmeti at a hotel in Dhaka, the chamber said in a press release.Bangladesh established its diplomatic relation with Kosovo in 2018 and the bilateral trade figure stood at only $0.31 million in 2020, which rose to $1.41 million in 2021, Rahman said.He proposed organising virtual business-to-business match-making sessions between the businessmen of the two countries to know each other and create new opportunities.""Kosovo can also hire IT professionals, engineers and skilled workforce from Bangladesh. Garments and pharmaceutical products of Bangladesh also have huge export potential in Kosovo.""Kosovo is a free market, but to know each other reciprocal exchange of business delegation can play a pivotal role, Ahmeti said."
/news/bangladesh/crime-justice/news/man-picked-3-weeks-ago-shown-arrested-3139741,Man ‘picked up’ 3 weeks ago shown arrested,"Nurul Afsar Hawladar, who was picked up from Uttara on September 22 allegedly by Rab, was shown arrested on charges of ""terrorism"" in Cox's Bazar on Sunday.Rafiqul Islam, officer-in-charge of Cox's Bazar Sadar Police Station, said Nurul was wandering around Kolatoli beach when Rab found him.Since he had former cases against him, the law enforcement agency arrested him and brought him to the station on Saturday night.However,  just the day before, this newspaper published a story on how CCTV footage from Afsar's office shows him being picked up by a group of plain-clothed men.Commander Khandaker Al Moin, media wing director of Rab, said nobody from the CCTV footage could be identified.""There was nobody wearing a Rab uniform and we tried matching the faces in the footage with the members of our force and concluded that they are not our men,"" said Moin, adding that it could be ""some other force claiming to be Rab"".""Maybe Nurul orchestrated the whole thing to go into hiding since there is an arrest warrant against him.""OC Rafiq told The Daily Star that Nurul had two cases filed against him regarding a land dispute in his village in Satkhira's Ashashuni of Satkhira. The cases were related to violence and assault.However, a press release sent by Rab-15 late last night said Nurul is accused in two cases from 2015 under the anti-terrorism act filed with Chattogram's Banshkhali and Hathazari police stations.The statement claimed that Nurul, as a terrorist, used to radicalise youths and run a training centre in Banshkhali, adding that he was seeking to reorganise a terrorist outfit called ""Amir Hamza Brigade"".It further said he had previously been arrested in 2009 in Bandarban's Naikhongchhari and spent a month in jail."
/news/bangladesh/news/4659-migrant-workers-went-malaysia-last-month-3139641,"4,659 migrant workers went to Malaysia last month","As many as 4,659 migrant workers went to Malaysia for employment in September, after fresh workers started to go to the Southeast Asian country in August following nearly four years of suspension.According to the data of the Bureau of Manpower, Employment and Training (BMET) uploaded to its website yesterday, the latest monthly employment in Malaysia saw a jump from August, when 573 workers were hired by the Southeast Asian country.Malaysia started to take fresh Bangladeshi workers from early August, in line with a new MoU signed between the two countries in December last year.The MoU lifts the embargo imposed by Malaysia in September 2018 on allegations of ""syndication"", malpractices in the recruitment process and high recruitment costs.But concerns over worker exploitation, timely wage payment, and high migration cost remain.Shariful Hasan, head of Brac Migration Programme, said the government needs to look at whether Malaysia-bound fresh workers are paying extra to secure a job, and whether they are getting their promised job, wage and other entitlements.There are allegations that fresh migrant workers are paying between Tk 3.5 lakh and 4 lakh for a job in Malaysia, Shariful told this newspaper over phone.""Due to high migration costs, workers often face exploitation,"" he added.Malaysia is one of the largest labour markets for Bangladesh. Starting from 1978, Malaysia has so far hired about 10.62 lakh workers from Bangladesh, shows BMET data.As per the MoU, Malaysia is entitled to select Bangladeshi recruiting agencies, whereas, the Bangladesh expatriates' welfare ministry will give recruitment approval to agencies based on proper documents.According to the Malaysian government's new salary structure, migrant workers are expected to get a monthly salary of at least 1,500 ringgit per month.In addition, they will be entitled to other benefits including overtime and accommodation.Contacted over phone, Nazmus Sadat Salim, minister (labour) at the Bangladesh High Commission in Kuala Lumpur, yesterday said the fresh migrant workers can earn 2,200 to 2,300 ringgit a month from their wage and by doing overtime.According to BMET's latest data, Malaysia rounds up the top five destination countries in September.As many as 90,814 migrant workers went overseas in September for employment, which is a decline from 92,908 workers going overseas in August, show BMET data.In the first nine months of this year, over 8.74 lakh migrant workers have gone overseas for employment. "
/business/economy/news/singer-investing-78m-new-plant-3139611,Singer investing $78m in new plant,"Singer Bangladesh is investing about $78 million to set up a new home appliance manufacturing plant inside the special economic zone in Narayanganj to expand local production of its products, according to company officials.The  home appliance manufacturer and retailer, in association with Arcelik, the flagship company of Koç Group, yesterday inaugurated the construction of their very first state-of-the-art manufacturing unit in the country, they said.The new unit will produce refrigerators, televisions, washing machines, air conditioners and other major home appliances, which will in turn decrease the imports of such items.In addition, the facility will generate around 4,000 employment opportunities while also developing the local supplier base that will cater to the industry in the future, the officials said during a press briefing at the Radisson Blu Dhaka Water Garden.At the event, Dr Fatih Kemal Ebiclioglu, president of Durable Goods Companies of Koc Holding, said they hope this initiative will increase the manufacturing capacity of Singer Bangladesh and strengthen its position in the local market.Ebiclioglu, who hopes the new unit will go into production by 2023, then said they would consider exporting products made at the new plant after catering to domestic demand.Cemal Can Dincer, chief commercial officer of Arcelik, said this investment marks a new chapter in their journey in Bangladesh.""With the support of our new factory, we are planning to locally produce 90 per cent of our products for local consumers,"" he added.MHM Fairoz, managing director and chief executive officer of Singer Bangladesh, said the company's new state-of-the-art manufacturing facility will be built according to the gold standards of LEED.LEED is a green building certificate that is recognized all over the world.He went on to say that Singer will bring the know-how on energy-efficient products and production technologies to Bangladesh, and this will help the country transition to a low-carbon economy.""Besides, Singer's green factory in Bangladesh's special economic zone will make a significant contribution to economic activity and employment,"" he said.Nihat Bayiz, chief technology officer of Arçelik, was also present at the event.Mustafa Osman Tarun, ambassador of Turkey to Bangladesh; Abdul Azim Chowdhury, additional secretary and executive member of the Bangladesh Economic Zones Authority, and other high officials and stakeholders were present at the ground breaking ceremony earlier the same day.Koç Holding is the only Turkish company represented in the global Fortune 500 list. Arcelik acquired the holding company of Singer Bangladesh in 2019.Koc Group envisions sustainability as a business model and places it at the center of all its operations. As such, Arcelik is committed to net-zero emissions by 2050 to tackle the climate crisis.The group aims to expand their sustainability vision to every country they operate in and create value for all people and the planet, and their investments in Bangladesh will continue with this understanding, according to Singer Bangladesh."
/news/bangladesh/news/heavy-gunfire-shelling-again-myanmar-side-border-3139451,"Gunfire, shelling again on Myanmar side of border","Panic grips the locals in bordering areas of Cox's Bazar's Whaikhyang and Bandarban's Tambru, as heavy gunfire and intermittent shelling on the Myanmar side have been heard again after a pause of 10 days.Residents of the bordering villages said they heard the sound of gunfire and shelling from the Myanmar side around 11:00pm on Sunday and it continued till 8:30am yesterday.At least 3,127 families comprising 15,000-20,000 people live within 500 metres of the border in Teknaf upazila of Cox's Bazar, while around 300 families with 1,200-1,500 members reside in Tambru area close to the border. Besides, 4,200 Rohingyas have been living at a camp in no-man's land of the Tambru border over the last five years.There have been reports of shelling and heavy gunfire in Myanmar close to the Bangladesh border over the last two months, as tensions between the Myanmar Armed Forces and the Arakan Army escalated into violent conflicts in Myanmar's Rakhine and southern Chin in June.Earlier in November 2020, the two sides had reached a temporary ceasefire.Talking to reporters yesterday, Maj Gen Shakil Ahmed, director general of the Border Guard Bangladesh, said the border guards have been on high alert along the border with Myanmar.""The BGB has remained very watchful and taken up positions [along the border],"" he said after visiting Tambru and other border outposts in Naikhongchhari upazila of Bandarban.""Since this is an internal issue of Myanmar, it's their concern to deal with.""The BGB chief further said Myanmar's border guards agreed to hold a flag meeting with them.""The flag meeting is expected to take place very soon,"" he added.Meanwhile, the local administration has formed committees with the ward members and councillors of the bordering areas as their heads to prevent any Rohingya from entering Bangladesh illegally.""We have formed the committees based on blocks,"" Erfanul Hoque Chowdhury, acting upazila nirbahi officer of Teknaf, told this newspaper yesterday.As a tense situation prevails in the bordering areas, these committees will be vigilant so that no Rohingya can enter Bangladesh crossing the Naf River, he said.He further said the local administration is also keeping a watch over the families in the bordering areas.Jalal Ahmed, a member of ward no-1 of Whaikhyang union parishad, said the sound of gunfire was heard from the Myanmar side around 11:00pm on Sunday. It continued till 8:30am yesterday.""The people in the bordering area are now in a state of panic...,"" he said yesterday.Those living close to the Tambru border also heard gunfire and shelling around 1:15am yesterday, said Dil Mohammad, chairman of the management committee at the Rohingya camp in no-man's land of the border.Firing continued till 7:30am yesterday, he added.Sayed Bashar, a resident of Konapara in Tambru bordering area, said he woke up to the sound of heavy gunfire around 3:30am yesterday.AK Jahangir Aziz, chairman of Ghumdhum union parishad in Naikhongchhari upazila, said life in the bordering area  was getting back to normal after gunfire and shelling in Myanmar stopped about 11 days ago.But tensions again flared up in the area since Sunday night, he added."
/top-news/news/bangladesh-fail-make-semis-after-washout-against-uae-3139806,Bangladesh fail to make semis after washout against UAE,"Defending champions Bangladesh were eliminated from the group stages of the Women's Asia Cup following a washout against UAE in their last round-robin match in Sylhet on Tuesday.Bangladesh, who beat India in the final of the last edition four years ago, finished fifth on the table with five points from six matches after sharing a point each with UAE in the abandoned match on Tuesday.Thailand, who have six points from six matches, go into the semifinals alongside six-time champions India as well as Pakistan and Sri Lanka.A win against UAE would have ensured Bangladesh a last-four spot, given their superior net run rate over Thailand but rain enforced a complete washout without a ball bowled.The hosts had beaten Thailand and Malaysia in this competition while losing against India, Pakistan and Sri Lanka.The elimination comes as a stark reminder for Bangladesh in regards to the gulf with the top-tier nations in women's cricket. Given the way the team capitulated against Sri Lanka while chasing 41 in seven overs on the previous day -- a defeat which made their semifinal berth difficult --shows there is a lot of work to be done on the batting department. "
/middle-east/news/12-year-old-palestinian-boy-dies-gunshot-wound-israel-army-raid-3139716,12-year-old Palestinian boy dies of gunshot wound from Israel army raid,"A 12-year-old Palestinian boy died Monday after being shot and wounded by Israeli soldiers during a September army raid in a refugee camp in the occupied West Bank, the Palestinian Health Ministry said.Mahmoud Samoudi was shot in the abdomen on Sept. 28 during an army raid in Jenin, a refugee camp and stronghold of armed Palestinians.On Monday, the ministry mistakenly reported the boy was wounded during the weekend, but the Israeli military said the incident happened in September and the ministry has since corrected its initial reporting.During the raid, soldiers entered the camp and surrounded a house. In videos circulated on social media, exchanges of fire could be heard. At the time, Palestinian health officials said two teens, ages 16 and 18, were killed and that 11 people were wounded.The Israeli army said it was ""aware of an allegation regarding injuries to a minor who participated in the violent riots and hurled stones at the security forces."" It said the circumstances surrounding the event are being examined.Israel has been carrying out nightly arrest raids across the West Bank since a spate of attacks against Israelis in the spring killed 19 people. The army said it had traced some of the perpetrators of those attacks back to Jenin.Israeli fire has killed more than 100 Palestinians during that time, making it the deadliest year in the occupied territory since 2015.The Israeli military says the vast majority of those killed were militants or stone-throwers who endangered the soldiers. But several civilians have also been killed during Israel's months-long operation, including a veteran journalist and a lawyer who apparently drove unwittingly into a battle zone. Local youths who took to the streets in response to the invasion of their neighborhoods have also been killed.Israel says the arrest raids are meant to dismantle militant networks. The Palestinians say the operations are aimed at strengthening Israel's 55-year military occupation of territories they want for an independent state.Also on Monday, Israeli soldiers entered the Shuafat refugee camp and searched homes and shops for a Palestinian suspected in the killing of an Israeli soldier over the weekend. Dozens of camp residents threw stones at the soldiers who fired tear gas.Saturday night's shooting happened at a checkpoint near the camp in east Jerusalem. Police said at the time that the assailant got out of a car and opened fire, seriously wounding the female soldier and a security guard before running into the camp. The army announced early Sunday that the woman, who was 19, had died."
/news/bangladesh/news/overcoming-obstacles-3139651,Overcoming obstacles,"Around the age of 15, Azmeri Nishat lost hope in life right after she lost her vision, due to a doctor providing her wrong treatment. But the courageous girl overcame all obstacles and continued her studies.""Since I had sight till I was 15, I started thinking that my life would stop right there, and I would not be able to do anything. After learning Braille system, I resumed my studies under the system and took computer training from another institute,"" said Nishat, who won the first prize in ""Screen Reader Software"" category of a talent competition for the visually impaired.Nishat, who is now pursuing her bachelor's degree at Prime University, said she wants to work to ensure proper education and rehabilitation of children with autism and visually impaired persons.Like her, 16 people with visual impairment were recognised at the competition organised by Institute of Hazrat Muhammad (SAW), marking Eid-e-Miladunnabi.Hridoy Haque Tanim, who placed second in the ""Hamd and Naat e Rasool"" category, told the newspaper that he wants to become a social worker and work for the betterment of the country's people.Among others, Mohammad Huzaifa, Khademul Islam and Mahmuda Akhter were recognised the Quran competition. Sumaiya Akhtar and Mehelong Marma were awarded in the Hamad and Naat e Rasool (PBUH) competition.Shah Md Mahamudul Hasan, Farzana Islam and Ferdowsi Akhtar won the Bangla essay writing competition, while Fatematuzjohra, Obaidur Rahman, Mokhlesur Rahman and Abu Farez won the English essay competition.Ajmeri Nishat, Mokhleshur Rahman and Raisul Islam won the screen reader software competition.Planning Minister MA Mannan handed over awards to the winners at a programme held at Banani Sheraton Hotel on Sunday.Addressing the programme as chief guest, the minister said, ""The present government believes in the overall welfare of the people. We have ensured the right of every religious person to practise their own religion.""Lt General (retd) M Nooruddin Khan, president of the institute, Indonesian envoy to Bangladesh Heru Hartanto Subolo, Assistant High Commissioner of Pakistan Qamar Abbas Khokar, and managing director of Unique Hotel and Resort Ltd, among others, spoke at the programme.Institute of Hazrat Muhammad (PBUH) has been providing various language training, computer training, braille and internet training for the visually impaired since 2004. "
/sports/football/news/my-homage-the-fans-says-griezmann-after-signing-atletico-contract-3139826,"My homage to the fans, says Griezmann after signing Atletico contract","Antoine Griezmann on Monday welcomed the confirmation that his loan from Barcelona had become a permanent move as he signed a contract with Atletico Madrid until 2026.The striker has been back at the Metropolitano since arriving on loan in August 2021 after a difficult spell at Camp Nou, following his 120 million euro (116.5 million dollar) move from Atletico in 2019.""I'm very happy because it's what I wanted since I returned,"" Griezmann said in a video published by Atletico on their social networks.""To stay at Atletico, enjoy being at the club, with the coach, my team-mates, the stadium, the fans, I did everything possible to stay here.""When I saw there was the chance to stay for many years, I spoke with the club. I knew what they wanted from me, I didn't think much. I didn't care what I had to do. The one thing I wanted was to stay here.""Reports in Spain say the 31-year-old agreed to reduce the salary he was earning at Barcelona in order to make his stay permanent.""I will give everything for my club, the trust of the coach, the fans, Atletico,"" continued Griezmann. ""I'll give everything for the badge. I could miss chances, or passes, but I will give everything until the last second, as much as I can. I want that to be seen and felt.""The fans make the effort of having their season ticket, of coming, of supporting us from the stands. This is my homage to the fans.""Key figureThe 2018 World Cup winner was a key figure in coach Diego Simeone's plans last season but has largely been reduced to substitute appearances in the current campaign as Atletico tried to escape paying a reported 40 million euro purchase fee if he played over a certain number of games.With the World Cup approaching and Griezmann keen to feature more, Atletico and Barcelona negotiated a new deal, with Barcelona president Joan Laporta confirming the fee during the club's members assembly on Sunday.""It is for 20 million euros plus four more in variables,"" said Laporta.""There is another clause in the deal to sell the player, which is that if Atletico decide to sell him in the future they will have to pay us the difference that remains, up to the value of the 40 million which was agreed before.""Atletico did not disclose the value of the new agreement.Griezmann has played 303 times for the club, scoring 144 goals, across his two stints in the capital.He netted 35 goals in 102 appearances for Barcelona, winning the Copa del Rey there in 2021. His arrival at Barcelona was due to happen in 2018 but he infamously decided to stay at Atletico for another season, making his choice on a television documentary called ""La Decision"".In club football, his biggest success has come at Atletico, winning the Europa League in 2018, as well as the UEFA Super Cup in the same year."
/sports/cricket/news/pakistan-handed-afridi-boost-ahead-t20-world-cup-3140166,Pakistan handed Afridi boost ahead of T20 World Cup,"Pakistan have been handed a major boost ahead of the Twenty20 World Cup in Australia with pace spearhead Shaheen Afridi set to join the team for warm-up games against England and Afghanistan, the country's cricket board (PCB) said on Tuesday.Afridi, 22, has been sidelined since sustaining a ligament injury to his right knee during a test match in Sri Lanka in July, missing the Asia Cup and home series against England.""Shaheen is now available for selection for the 17 and 19 October warm-up matches against England and Afghanistan, respectively during which his match fitness will be assessed by the team management,"" the PCB said in a statement.Afridi, who has picked up 47 wickets in 40 T20s, is key to Pakistan's set-up, with his ability to bowl at high speeds and generate bounce likely to come in handy on Australian pitches.""I am super excited ... it has been a difficult period for me to be miles away from the game and the team I love the most,"" said Afridi, who was named in the 15-man squad in the hope that he would be fit in time for the tournament.""I have been bowling six to eight overs trouble-free for the past 10 days with full run-up and pace.""Reserve batsman Fakhar Zaman, who has been out with a knee injury, will also travel to Brisbane with Afridi.Pakistan, T20 World Cup winners in 2009, open their campaign against India at the Melbourne Cricket Ground on Oct. 23."
