URLS,Headline,Article
/world/europe/news/failed-economic-plan-truss-quits-after-6-weeks-uk-pm-3148071,Failed economic plan: Truss quits after 6 weeks as UK PM,"British Prime Minister Liz Truss yesterday announced her resignation just six crisis-filled weeks after taking office, becoming the shortest-lived premier in UK history.Her Conservative party detailed a rapid process to elect a new leader on October 28, setting a high bar of 100 nominations among its MPs for candidates -- which might block any comeback by former premier Boris Johnson.The race will be effectively limited to three candidates at the start, before the 357 Tory MPs vote on their preferred candidate on Monday.Party members will then get an online vote, in an accelerated timetable that avoids the drawn-out contest in which Truss defeated Rishi Sunak over the summer following Johnson's resignation.Truss admitted she ""cannot deliver the mandate"" on which she was elected by the members, after her right-wing platform of tax cuts disintegrated and as many Conservative MPs revolted.Labour leader Keir Starmer, whose opposition party has surged in opinion polls on the back of Truss's short, eventful tenure, demanded a general election ""now"".""This is not just a soap opera at the top of the Tory party,"" he said, warning of ""huge damage"" to the UK economy, although the pound surged against the dollar after Truss's dramatic announcement.Speaking outside 10 Downing Street, Truss said she would stay on as prime minister until a successor was chosen to serve as Tory leader.""We've agreed that there will be a leadership election to be completed within the next week,"" she said, after senior backbench MP Graham Brady told her the game was up.""This will ensure that we remain on a path to deliver our fiscal plan and maintain our country's economic stability and national security.""The new leader will be in place in time for new finance minister Jeremy Hunt to deliver a crucial budget statement on October 31.Hunt has already thrown out nearly all of debt-fuelled Truss's tax promises, which Sunak had warned would bring about higher inflation and market turmoil.Sunak's warnings were vindicated, and the former finance minister quickly emerged as the bookmakers' favourite. But he remains held in deep suspicion by Johnson loyalists.Johnson himself was eyeing a comeback, the Times and Telegraph newspapers reported, despite remaining deeply unpopular with many Tory MPs and the electorate for the many scandals that brought him down.Another potential runner is senior cabinet member Penny Mordaunt, who narrowly failed to make the Truss-Sunak runoff this summer.The end for Truss came after a key minister resigned and many Tory MPs rebelled over an important vote in chaotic scenes at the House of Commons late Wednesday.By yesterday morning, more than a dozen Conservative MPs had publicly urged Truss to resign, after her tax-cutting plans caused a market meltdown during an already severe cost-of-living crisis.Many more were reported to have submitted letters to Brady calling for Truss to be removed, although party rules would have forbidden another leadership campaign for 12 months.""The prime minister acknowledges yesterday was a difficult day and she recognises the public wanted to see the government focusing less on politics and more on delivering their priorities,"" her official spokesman told reporters.Barely two hours later, she quit, and will fall well short of Tory predecessor George Canning who served 118 days as prime minister in 1827 before dying in office.Amid Russia's war in Ukraine and growing economic problems, Britain's allies have been observing the tumult with concern, with political instability recurrent since the country voted in 2016 to quit the European Union.US President Joe Biden vowed to ""continue our close cooperation with the UK government"" on shared challenges including Ukraine.""It is important that Great Britain regains political stability very quickly, and that is all I wish,"" French President Emmanuel Macron said.For its part, the Russian foreign ministry said Britain has ""never known such a disgrace as prime minister"".Events reached a head after what right-wing tabloid The Sun called ""a day of extraordinary mayhem"" on Wednesday.Interior minister Suella Braverman left, apparently at Truss's demand after she sent a government document in a personal email.But Braverman, an arch right-winger who enjoys strong support among the Tory membership, used her resignation message to attack Truss in blistering terms.There then followed farcical scenes in parliament as many Tory MPs rebelled against the government's demand that they drop the party's manifesto commitment to maintain a ban on fracking."
/news/world/uk/news/poll-cost-living-crisis-britons-skipping-meals-3148416,Poll on Cost of living crisis: Britons skipping meals,"Millions of Britons are skipping meals in current the cost-of-living crisis, a consumer group warned yesterday. The news came after data showed UK inflation jumped back above 10 percent in September on rampant food prices. Half of UK households are cutting back on the number of meals, consumer group Which? said citing a survey of 3,000 people. A similar proportion are finding it harder to eat healthily compared with before the crisis, while almost 80 percent are finding it difficult financially."
/news/asia/india/news/dengue-patient-dies-after-india-hospital-administers-fruit-juice-instead-platelets-3148501,Dengue patient dies after India hospital “administers fruit juice instead of platelets”,"A dengue patient was allegedly administered fruit juice instead of blood platelets at a private hospital leading to his death later in Prayagraj (former Allahabad) in India's Uttar Pradesh state, police said.The hospital was sealed on Thursday after a video of the alleged incident went viral on social media and the district administration swung into action, reports our New Delhi correspondent.The patient Pradeep Pandey was shifted to another hospital where he died after his condition deteriorated, PTI reported quoting officials.The family of Pandey alleged that he was transfused with ""mosambi"" juice and chemicals in a platelet bag. After the patient's condition deteriorated, he was shifted to another hospital where he passed away, according to officials.""Taking cognizance of the viral video at the hospital where a dengue patient was transfused with sweet lemon juice instead of platelets, on my directive the hospital was sealed and the platelet packets have been sent for testing,"" UP Deputy chief minister Brijesh Pathak tweeted.Nanak Saran, chief medical officer, Prayagraj, told reporters that the content of the platelets bag can be confirmed after a forensic probe.Saurabh Mishra, owner of the private hospital claimed that the platelets were brought from a different medical facility and the patient had a reaction after three units were transfused, according to PTI.Mishra said since the patient's platelets level dropped to 17,000, his relatives were asked to arrange blood platelets for him.""They brought five units of platelets from SRN Hospital. After transfusion of three units, the patient had a reaction. So, we stopped it,"" he said."
/business/organisation-news/news/singers-profits-fall-despite-sales-growth-3148301,Singer’s profits fall despite sales growth,"Although Singer Bangladesh logged higher sales between July and September this year, the company still incurred losses in the quarter, according to a press release.Sales of the multinational electronic and home appliance company were 12.8 per cent higher at Tk 520 crore in the July-September quarter compared to the same period of the previous year.However, Singer's profit decreased from Tk 59.5 crore to Tk 14.6 crore at the same time with its earnings per share decreasing from Tk 5.97 to Tk. 1.46 as a result.The profit dropped because of losses in the July-September period, when the company's earnings per share stood Tk 0.85 in the negative.Singer's profits decreased as it has lost a 5.1 percentage point gross margin compared to the same quarter of last year mainly due to significant cost increases that could not be adjusted with the sales price, the company said.The sales price was not raised due to market sensitivity, both from the consumer and competitors' end, it added.Expenses were also higher in the period compared to last year, mainly for the utilisation of borrowing at a higher level and with higher interest rates as well.Singer continued to focus on managing operating expenses, which slid down to 17.5 per cent of its revenue in the third quarter while it was 19.3 per cent at the same time last year.Negative profit in the third quarter resulted in the company's strategy to remain competitive in the market because of sensitivity both from the consumers and competitors end. The company's stocks listed with the Dhaka Stock Exchange remained unchanged yesterday at Tk 151.9.Singer commenced operations in the region in 1905. Having started the journey with a reputation for making quality sewing machines, the company now has 437 stores in the country.Singer Bangladesh is 57 per cent owned by Retail Holdings Bhold BV of the Netherlands."
/business/economy/stock/news/dse-turnover-drops-less-tk-1000cr-3148336,"DSE turnover drops to less than Tk 1,000cr","Stocks more or less flatlined following fluctuations of the benchmark index at Dhaka Stock Exchange (DSE) yesterday while turnover dropped to less than Tk 1,000 crore. The DSEX, the benchmark index of the DSE, went up 2 points, or 0.03 per cent, to 6,392 points.Turnover at the DSE dropped 17 per cent to Tk 975 crore from that on the previous trading day. The last time it had gone below Tk 1,000 was on October 12, when it was Tk 994 crore.The DS30, the index that consists of blue-chip companies, went up 0.29 per cent to 2,277 points while the DSES, the Shariah-compliant index, dropped 0.03 per cent to 1,407 points.At the DSE, 60 securities advanced, 78 declined, and 225 remained the same.Dhaka stocks inched up snapping a five-day losing streak as pessimist investors continued to go on a selling binge from the opening of the session till an hour before the closing, said International Leasing Securities in its daily market review.Confused about the market's direction, the apprehensive investors attempted to remain on the sidelines and were reluctant to make fresh investments in stocks, it said.The increasing rate of inflation that crossed 9 per cent is signaling another interest rate hike in the coming months.As a result, the flow of funds to the capital market may shrink, it added.Among the sectors, paper advanced 2.7 per cent, travel 0.6 per cent and miscellaneous 0.5 per cent whereas jute dropped 4.9 per cent, service 1.2 per cent and cement 1 per cent.Based on the turnover, investors' focus was mainly on miscellaneous (18.5 per cent), pharmaceuticals (17.9 per cent) and engineering (17.6 per cent) sectors.Navana Pharmaceuticals topped the gainers' list, advancing 10 per cent. ADN Telecom, Indo-Bangla Pharmaceuticals, Orion Pharma and Summit Alliance Port also rose over 6 per cent.Gemini Sear Food suffered the highest correction, sliding down almost 14 per cent. BDCOM Online, Tamijuddin Textile Mills, Paper Processing and Packaging, and Apex Foods declined by more than 8 per cent.The Caspi, the all-share price index of Chattogram Stock Exchange, decreased by 20 points, or 0.10 per cent, to end at 18,800.Of the issues that were traded on the bourse in the port city, 34 advanced, 76 declined, and 91 did not show any price movement. "
/sports/more-sports/news/police-snatch-title-exciting-final-day-3148026,Police snatch title on exciting final day,"Bangladesh Police Club were crowned as champions of the Premier Division Table Tennis League after an exciting 3-2 win over Wari Club in the last match of the Super Four League at the Shaheed Tajuddin Ahmed Indoor Stadium yesterday.Police Club, which on Wednesday clinched their maiden Women's Premier Division Table Tennis League title, came into a must-win final match against eventual runners-up Wari Club, who had beaten Police Club 3-1 in the first phase of league matches.However, former national champions Javed Ahmed and Manosh Chowdhury held their nerve to not only exact vengeance but also deliver a maiden trophy for Police Club, who were runners-up in their maiden appearance in the last edition.Javed first beat Ramhim Lian Bawm in straight sets in the first match before defending champion Mohtasin Ahmed Hridoy beat former champion Manosh in straight sets to level the margin. Wari then took a 2-1 lead overall, with Emon beating Imran Hossain Rridoy 3-1 in the third match. Manosh brought Police back into the match by beating Ramhim 3-2 before Javed showed his character by defeating Mohtasin 3-1 in the deciding fifth match.The win saw Police Club join Wari Club in first place, with both teams tied on 22 points from 12 matches. However, Police Club emerged as champions by virtue of their head-to-head record in the Super League match as per bylaws.""It was really tough challenge for the players, who prepared themselves individually due to a shortage of practice venues. However, they showed their brilliance once they started playing. They also had the experience of playing together before. Manosh, Javed and Sajib also played together to make Sheikh Russel KC champions in last edition,"" said Police coach Mohammad Ali, adding that new clauses in the bylaws had given the players a boost ahead of the match.""We came to know some hours before our last match that if we could beat Wari Club, we would be champions since no records from the first-phase would be considered. So, it inspired the players to perform better because there was no pressure,"" said Ali, who also guided the Police women's team to glory."
/sports/cricket/news/tamim-attend-brazil-match-fifa-wc-3148621,Tamim to attend Brazil match at FIFA WC,"Bangladesh ODI captain Tamim Iqbal will attend the FIFA World Cup match between Brazil and Serbia.When contacted, Tamim confirmed to The Daily Star that the tickets were gifted to him. The match between Brazil and Serbia will be played on November 24th at the Lusail Stadium in Qatar.The FIFA World Cup draws attention from people all across the globe and watching the five-time world champions, lead by players such as Neymar and Vinicus Jr. at the World Cup is an exciting prospect for any sportsperson.Earlier, Bangladesh ace all-rounder Shakib Al Hasan bought two tickets of Argentina's second group-stage game against Mexico, slated for November 27, from the Bangladesh Football Federation (BFF) who were allocated 290 World Cup tickets by FIFA, football's governing body."
/health/disease/coronavirus/news/one-dies-covid-3148216,One dies of Covid,"One person died of Covid-19 in the 24 hours till 8:00am yesterday, said a press release from the Directorate General of Health Services.This brings the total number of deaths to 29,411.A total of 243 more were infected with the virus against 4,174 tested samples during this period. The positivity rate decreased to 5.82 percent from the previous day's 7.18 percent.Meanwhile, 468 have recovered from the disease with the recovery rate now at 97.18 percent.The deceased was a female from Sylhet, aged between 31 and 40."
/opinion/the-third-view/news/will-free-media-be-harassed-the-name-data-protection-3147976,Will free media be harassed in the name of data protection?,"While Bangladesh is facing all sorts of challenges and our prime minister is regularly warning us about the food crisis that lies ahead, our government's relentless pursuit of putting impediments on the functioning of the free media continues unabated. Nothing appears to either slow the pace or dim the enthusiasm among a section of bureaucrats and policymakers, who appear to see nothing good in free media and miss no opportunity to shackle them under this pretext or another.The hugely restrictive and controversial Digital Security Act (DSA), which has already caused havoc to the free media in Bangladesh, has suddenly re-emerged with another set of restrictive initiatives that has us all in the media extremely worried. In a gazette published on October 2 by the ICT Division, 29 institutions have been declared as ""critical information infrastructure""(CII) under Article 15 of DSA.Protecting critical information infrastructure is the government's duty, and we are fine with it. From the media, we will be happy to raise public awareness in the area of cybersecurity. Here, the government and the media are on the same page, and we would be happy to work together.However, the problems start when we see the vague formulations and lack of clarity of the CII notification and the names of the institutions covered by it. Of the 29 listed bodies – the whole rationale remains unclear – the ones whose inclusion are most likely to hamper the work of journalism include the Bangladesh Bank and state-owned banks such as Sonali, Janata, Agrani and Rupali, the National Board of Revenue (NBR), Bridges Division, Biman Bangladesh Airlines, Bangladesh Power Development Board (BPDB), Dhaka and Chittagong stock exchanges, and the Department of Immigration and Passports, just to mention a few.When an institution like Bangladesh Bank is designated as a CII without clearly mentioning whether the whole building is a ""critical information infrastructure"" or only its digitalised operating system, then of course journalists are left confused and worried. So when the next time a journalist enters the Bangladesh Bank, does he or she risk being accused of ""illegally"" entering a CII facility? Will that journalist then be prosecuted? The question is obviously of access to cover these institutions. Can a journalist now enter the premises of Biman, or the BPDB or even the two stock exchanges to carry out his or her duties?Let's examine the case of one institution: our national airlines. We can understand that the digital network that controls air traffic, the ticketing system, security for the planes, etc needs to be protected. But what about stories that deal with passenger services, Biman's profitability, its staff qualifications and performance, its commercial operations, its inflight services, etc? To cover these and similar stories, journalists need and must be given access to these institutions and the relevant officials. Being listed as a CII installation and without any clarification as to what is covered by it will definitely result in limiting our access, which may even be denied if sought frequently.Equally of concern is the dire possibility that the concerned officials will become more and more reluctant to share their insights with the media as the whole environment will be driven by restrictions. In time, we will be told that we can only deal with the public relations officer (PRO) of these institutions, and access to other officials will be denied. We might as well stop sending reporters and wait for the press releases from these bodies. We are afraid this new gazette will reduce journalism to ""public relations"" and prevent us from doing ""public service,"" which is why we exist.Then there is the issue of punishment that ranges from seven to 14 years in prison and a fine of up to Tk 5 crore. This high level of punishment together with the vagueness of the provisions makes it almost forbidding for journalists to carry out their professional tasks out of fear. Even life imprisonment is on the table for a crime whose mere definition we do not know.Supervising the whole process is a director-general whose power is enormous. The DSA states, ""If the director-general has reason to believe that any activity of an individual regarding any matter within his jurisdiction is threatening or detrimental to any critical information infrastructure, then he may, suo moto, or upon a complaint of any other person, inquire into the matter."" His conclusions may entail anything and, being a government servant, is not likely to reflect the media's point of view. Hence punishment can well be the result.As if to mock freedom of expression and all of us who demand it, on Wednesday, the government finalised the draft regulation for digital social media and OTT platforms that empowers the Bangladesh Telecommunication Regulatory Commission (BTRC) to block, take down or remove any content that ""threatens the secrecy of the government."" So, are we to understand that everything that a government does has to be considered a secret? It is the old ""official secrets act"" in a new bottle. What about the media's primary role of keeping the government accountable by revealing to the public the workings of their elected executive? Will any government voluntarily reveal that their projects are riddled with corruption or that they have failed to provide good governance? Such a provision will directly work against independent media, especially investigative reporting. The final draft clearly states that all the restrictive provisions will apply to ""publishers of news and current affairs content or a publisher of an online curated content."" The law may be vague in other aspects, but in restricting the media, it is amply clear.Over the last few days, with the gazette notification of ""critical information infrastructure"" and the final draft of the OTT rules, we have two new legal formulations meant to restrict the working of the free media.Are these in preparation for the coming election? We don't want to draw conclusions yet, but are finding it increasingly difficult not to. Pablo Neruda wrote, ""You may cut all the flowers, but you cannot keep spring from coming."" We say, ""You may prevent us from saying what we think to be right, but can you prevent us from thinking what is right?""Mahfuz Anam is the editor and publisher of The Daily Star.
"
/business/organisation-news/news/stanchart-brac-university-develop-curriculum-3148276,"StanChart, Brac University to develop curriculum","Standard Chartered Bangladesh and Brac University signed a memorandum of understanding recently to develop a curriculum on financial crime and compliance for both undergraduate and graduate students.  The aim is to develop professionals trained to prevent financial crime while following both local and international standards of compliance, the lender said in a press release yesterday.""This initiative builds on a major need for (relevant) knowledge in Bangladesh…(the initiative) ensures Bangladesh's youths and future human resources receive the necessary training prior to entering the job market,"" it said.Naser Ezaz Bijoy, chief executive officer of the lender, and Vincent Chang, vice chancellor of the university, were present at the signing ceremony at the bank's head office in Dhaka.""Working together with organisations to share knowledge and act swiftly in response to evolving threats better prepares us all to identify and thwart financial crime,"" said Bijoy.""Financial crimes are a significant ongoing challenge for institutions and individuals. This industry-academia partnership will help us better examine the extent and costs of the deceptions alongside major regulatory and criminal justice policy options,"" Prof Chang said.""Eventually, it can play a vital role in taking further measures that need to be in place to both protect institutions and individuals and achieve regulatory compliance,"" he added. "
/news/bangladesh/accidents-fires/news/gazipur-cylinder-blast-another-victim-dies-3148211,Gazipur Cylinder Blast: Another victim dies,"One more person, who suffered burns in a gas cylinder explosion at a filling station in Gazipur, died at a hospital in Dhaka yesterday.Sirajul Islam Tutul (25) breathed his last around 7:00am while being treated at Sheikh Hasina National Institute of Burn and Plastic Surgery.He had 40 percent burns on his body.The victim's brother-in-law Mahbubur Rahman said, Tutul, a mechanical engineer at a textile factory in Gazipur, went to the filling station on a covered van to refill some cylinders.With him, the death toll rose to four.They were injured in a blast at the filling station at Gazipur's Gachha Barabari on October 13."
/news/bangladesh/crime-justice/news/samrats-bail-extended-till-november-8-3148116,Samrat’s bail extended till November 8,"A Dhaka court yesterday extended bail of expelled Jubo League leader Ismail Hossain Chowdhury Samrat until November 8 in a case filed for laundering around Tk 222 crore, funneling it into casinos in Singapore and Malaysia between 2011 and 2018.Judge Al Asad Md Asifuzzaman of the Special Judge's Court-6 passed the order."
