URLS,Headline,Article
/opinion/editorial/news/food-court-the-cost-heritage-3140116,Food court at the cost of heritage?,"The Dhaka South City Corporation (DSCC) has reportedly taken it upon itself to construct a food court inside the historical Bahadur Shah Park of Old Dhaka. This park houses two memorials – one of them in honour of those martyred during the Sepoy Mutiny of 1857. And currently, it is one of the only open spaces wherein the old and young residents of Old Dhaka can get some respite and reconnect with nature. Yet, rather than preserving such a rare space of greenery, which also is part of Dhaka's hundreds of years of heritage, the city corporation itself is attempting to ruin the park's sanctity. Already, a metal structure has been erected in the park, taking up space that should be reserved for visitors. What's more surprising is that all this is being done despite adamant protests from citizens. So, given that those who actually frequent the park do not want a food court there, whose good is it being built for? Is it just a way for city authorities to pocket some profit? Do they realise that not every bit of land needs to be profitable in order to be deemed useful? It is disappointing that ruining heritage sites has become a fad for our authorities as of late. In Old Dhaka itself, ancient structures such as Bara Katra and Choto Katra are facing demolition. Earlier this year, Tetultala playground in Kalabagan had to be saved by locals from the police, who wanted to construct a police station there. Even Suhrawardy Udyan, a witness to so many crucial moments of Bangladesh's birth and early years, faced the threat of a food court last year. Often, it is seen that those heritage sites which are being destroyed belong to the High Court's 2018 list of 2,200 buildings which it directed Rajuk to preserve. In fact, the Bahadur Shah Park itself has a place in that list. Are we to believe that, for our city authorities, so-called development is above the wishes of citizens and even above the law? In the case of the food court being constructed in Bahadur Shah Park, the chief estate officer of DSCC told this newspaper that they had only allowed for the setting up of ""a movable food van"" in the park, and that they have already ""instructed the contractor to remove the iron structure."" We hope the DSCC representative's assurance that ""no permanent structure will be allowed"" to be built in Bahadur Shah Park is something we can rely on. It is high time for government authorities to ensure that ""development"" does not get in the way of heritage, and for them to stop behaving as if the opposite is the case. Citizens care about historical structures and greenery – and authorities need to do the same."
/business/news/trading-govt-bonds-takes-place-3140106,Trading of govt bonds takes place,"The trading of treasury bonds and bills took place on the stock exchanges of Bangladesh today, a day after their debut.There are about 270 treasury bonds worth more than Tk 2.5 lakh crore with their tenures ranging from two years to 20 years, data from the Bangladesh Bank showed.Of them, 222 treasury bonds were listed on the Dhaka Stock Exchange (DSE) as of August, with a combined value of Tk 59,359 crore. But they were not traded like shares and mutual fund units and they could be bought and sold only over the counter.But it changed for the better on Monday as the BSEC allowed treasury bills and bonds to be traded like stocks and mutual fund units, albeit on a trial basis.No items, however, could change hands on the exchanges because of a technical glitch on the day. Data migration could not be completed on time so trading was not possible although there were some buy orders, said the DSE.But several treasury bonds were traded on the DSE and the Chittagong Stock Exchange yesterday.Thanks to the commencement of the trading of government securities, Bangladesh has taken a major leap forward by making them easily available to investors through the exchanges and diversifying the product base.However, the lot of the bonds is 1,000 with a face value of Tk 100 means investors need to pay at least Tk 1 lakh or above to buy a single set of securities. As a result, small investors did not show much interest in buying them.While stocks are ownership in a company, bonds are a loan to a company or government. Because they are a loan, with a set interest payment, a maturity date, and a face value that the borrower will repay, they tend to be far less volatile than stocks."
/entertainment/tv-film/news/girls-are-fools-who-become-victim-their-hearts-sabnam-faria-3140076,"‘Girls are fools, who become a victim of their hearts’: Sabnam Faria ","Popular actress Sabnam Faria isn't afraid to speak her mind when it comes to issues that are close to her heart.Recently, the actress posted a status where she talked about the difficulty of being a female artiste and how women often fail to judge people, using their hearts instead of their brains.""We girls are fools. We don't listen to our brains, but become a victim of our hearts. We might be strong on the professional front, but we are soft as a marshmallow when it comes to our personal lives. It's extremely hard for women, especially if you are an artiste in the field of entertainment,"" wrote the actress.She went on to say that while one can see the red flags of men for themselves, and even their families point it out for them, they usually avoid believing the reality of things. ""You don't listen to them and just tell them that they don't know him as well as you do. They point out the evidence, they show you that he is a drug addict, but you make up tons of excuses to prove that it's not his fault.""""You know very well that he has mental health issues, that he suffers from bi-polar disease. Your mother and your sister warn you against him, but you tell them that not all men are the same and that you can fix him. However, pretty soon, he let's his anger loose and then abuses you mentally and physically. He raises his hands against you, and then tries to reconcile through sweet words,"" the post continued.""I guess women are feeble and frail fools that easily believe the words of men. We were born to suffer and to tolerate the endless sea of pain. We were destined to shed tears, as God created us like that,"" concluded the post."
/news/bangladesh/diplomacy/news/uk-seeks-bangladeshs-support-unity-ukraine-unga-3139701,UK seeks Bangladesh's support for unity of Ukraine at UNGA,"UK Foreign Secretary James Cleverly MP called Foreign Minister AK Abdul Momen yesterday (October 10, 2022) afternoon and sought Dhaka's support in a session on Ukraine that will begin today at the UN General Assembly.A diplomatic source in Dhaka said the new UK foreign secretary appointed in September, discussed various bilateral and global issues during the phone call.""The major issue was Dhaka's support for the unity of Ukraine,"" he said.According to AP, the UNGA convened yesterday in a special session to discuss Russia's recent attempt to annex four regions of Ukraine. The session could reveal whether Russia's international isolation is growing as its war grinds on.""The UN Charter is clear: Any annexation of a state's territory by another state resulting from the threat or use of force is a violation of the principles of the UN Charter and international law,"" UN Secretary-General Antonio Guterres said September 29, a day ahead of a theatrical Kremlin ceremony to incorporate the territories into Russia.Guterres said any attempt to annex Donetsk, Luhansk, Kherson and Zaporizhzhia would have ""no legal value"" and would be a ""dangerous escalation.""The following day, Russia exercised its veto in the UN Security Council to block a resolution condemning its actions. That has spurred a move to the General Assembly, where no state has a veto.In addition to the debate, countries will be asked to state their stance on the issue by voting on a European-drafted resolution condemning Russia's move to annex Ukrainian territory.""It is clinically focused on the legality or illegality of what Russia is doing,"" European Union Ambassador Olof Skoog told reporters of the draft text.The final draft, seen by VOA on Friday, reiterates the secretary-general's pronouncement and reaffirms states' commitment to Ukraine's sovereignty, independence, unity and territorial integrity within its internationally recognized borders.It also clearly condemns Russia's ""illegal so-called referenda"" and ""attempted illegal annexation"" and says they are invalid under international law."
/southeast-asia/news/malaysia-pm-calls-snap-elections-3139706,Malaysia PM calls snap elections,"Malaysia's prime minister yesterday dissolved parliament to clear the way for snap elections in a bid to restore political stability as the country emerges from the ravages of Covid-19 and a multi-billion dollar corruption scandal.Elections could be held within weeks, mostly likely in November, following Prime Minister Ismail Sabri Yaakob's announcement, analysts said.Polls were not due until September next year but Ismail faced intense pressure from within his United Malays National Organisation (UMNO) party to dissolve parliament and secure a strong mandate in early elections.""Yesterday I met the king ... and I sought his permission to dissolve the parliament. And the king agreed to my request to dissolve parliament today,"" Ismail said in a televised address following his audience with Sultan Abdullah.The palace said the king ""expressed displeasure with the current political developments"" and had no choice but to agree to the prime minister's request for early polls for the people ""to vote for a stable government"".The election commission will announce the polling date likely in the next few days. Parliament's dissolution came days after the government unveiled a populist budget that included a cut in personal income taxes."
/opinion/views/news/mermaids-arent-real-and-neither-race-3140096,"Mermaids aren’t real, and neither is race","A recent tweet explained the often-elusive difference between science fiction and fantasy: ""Fantasy is when Black people are told they're historically inaccurate, sci-fi is when Black people are told 'it's woke garbage' they exist.""The concept of race in speculative fiction comes up in media discourse whenever someone in some well-known media franchise turns up with a crumb of melanin. It is a debate that is particularly frustrating, because like most issues of the 21st century, it requires an exhausting amount of nuance and analysis while simultaneously being incredibly stupid.We've had Black stormtroopers (Star Wars, not the Sturmabteilung, though there is that one Key & Peele sketch), who apparently couldn't exist because of (a worryingly racist reason). The casting of people of colour in Netflix's adaptation of The Witcher was derided because of (a worryingly racist reason). Black women cannot exterminate ghosts because of (a worryingly racist reason). And over the past few months, it's been Black elves, Black dwarves, Black Targaryens, and now Black mermaids can't exist because of (you get the idea).Why not a Black mermaid? Because Hans Christian Andersen was a White guy? Disney, a multibillion-dollar corporation with a vice grip on global entertainment, is not making a loving homage to 19th century Danish culture. (Nor, I suspect, are people who are mad about Black mermaids particularly interested in 19th century Danish culture or the sanctity of Andersen's body of work.) Disney has no in-text reason to not cast people of colour in whatever role. We are at a point in our history, thankfully, where denying roles to actors of colour is recognised as racial discrimination. Meanwhile, House of the Dragon's prominent change of characters to black and mixed race is not merely colourblind, but in fact adds to the plot. The show still largely has a White cast, but its decision to show the existence of racial diversity in Fantasy Europe has been treated as ""historically inaccurate.""There is a point to this: Westeros is not real, but it does represent a vision of Europe, and so we can expect the people within its world to look European. Of course, if you look at Europe, you'll find Bangladeshis running gulyás éttermek in Budapest, even though Viktor Orban told me Hungary is for white people. But historically, right?Black and Brown people are ""historically accurate"" to any fantastical rendering of Europe. The imagination of medieval Europe that serves as the template for your bog-standard fantasy setting is White, because Europe has historically been imagined to be White, as a project to imagine the presence of supposedly non-White bodies as interlopers, outsiders, people who do not belong. Even if the faulty imagination of a ""White Europe"" were true (it is, to reiterate, not true), the modern Western world that generates the bulk of our entertainment is demonstrably not a White world, and to insist on a performance of Whiteness in the media where the diversity underlying the real world is erased cannot be justified except by (a worryingly racist reason).Let's go deeper. Are elves, Targaryens and mermaids White? No. Because elves, Targaryens, mermaids and White people don't exist in the real world.Race itself is not real. Race is the idea that humanity can be sorted into discrete groups with unique behavioural and intellectual characteristics, largely corresponding with physiological differences and similarities between potentially related groups of people. The ways in which these physical characteristics dictate identity and culture are fantasies, and our current conceptualisation of race derives heavily from the last couple centuries of European imperialism, and from the dominance of American media. Race is one of the most important concepts underlying modern social relations while simultaneously completely fictional.This means that while there are no mermaids in real life, the skin tone we ascribe to the mermaid's human half is a legitimate battleground for how we view race. Speculative fiction has long held what Helen Young called ""Habits of Whiteness."" We live in a world that continues to be dominated by a former imperial core, whose self-declared rightful inhabitants in turn self-declared as ""White,"" and their viewpoint continues to dictate the shape of the world through global culture. It is a viewpoint that centralises Whiteness as the normal. Speculative fiction has its roots in genre conventions established by writers who hailed from an era of explicit imperialism (rather than the more genteel liberal capitalism of today). JRR Tolkien, we can very safely say, never imagined the existence of a Black elf. He was a White supremacist. Though he was no Lovecraft, who wrote primarily to express race anxiety, race as hierarchy is intrinsic to Tolkien's worldbuilding.Let's circle back. As elves aren't real, they can be Black. In the context of a Tolkien adaptation, however, skin colour matters. The canonical Whiteness of elves isn't just the default assumption of a writer imagining Ye Olde England as a supermarket mayonnaise aisle. It is thematically consistent with Tolkien's view of racial hierarchy. In Tolkien's legendarium, elves are White for a reason: because he wanted to represent a superior form of life. What elves are to the Men of Numenor (the Men of the West), Numenoreans are to the other categories of men, and then on down to the orcs et al. Sentient life is sorted into racial categories of greater and lesser worth. The parallels are not coincidental. Tolkien famously despised allegory, but everyone writes an allegory whether they want to or not. Just as racial hierarchy was not incidental to the world in which Tolkien lived, it was not incidental to the world he invented.Should a Tolkien elf only be played by a White actor? No. However, a better show than The Rings of Power might have had something insightful to say about race through the casting of Black actors in roles that were, in the original, expressions of White supremacist race hierarchy. Instead, The Rings of Power represents yet another sort of fantasy: a world where anyone anywhere can look like anything, and you don't need to think about it too much. This sort of fantasy of diversity would certainly feel less cynical if it were not being beamed at us by Amazon.The fantasy of racial diversity that Amazon and Disney relay relies on a lack of history, where we have no politics or opinions that trouble a society making money for our bosses. Race is a fiction, but its pages are burnt and bloody. Race matters. The politics of the representation of this fantasy in fields of make-believe are not clear-cut, the stories we appear in are often written with the subtext of our exclusion, and our increasing presence on the screen (rather than just consuming content) cannot be to passively legitimise anodyne projects of racist capitalism. Zoheb Mashiur is a doctoral researcher on racial discourse and colonial history, based at the University of Kent.
"
/entertainment/tv-film/news/3-movies-and-2-shows-watch-following-world-mental-health-day-3140181,3 movies and 2 shows to watch following World Mental Health Day,"Yesterday marked the occasion of World Mental Health Day. With growing awareness regarding the importance of mental health, it has become a key ingredient for the plotline of a variety of media.These stories not only help normalise such issues, but also act as brilliant sources of representation.So, with that in mind, here are five such shows and films that you can binge, following World Mental Health Day.Atypical
""Atypical"" is a Netflix original series about an 18-year-old American high school student, who has been diagnosed on the autism spectrum—a neurodevelopmental disease characterised by confined, repetitive behaviours and social communication problems.The show takes us through the life of Sam, brilliantly capturing the diversity of the autism spectrum. While it addresses heavier themes like grief and interpersonal conflict, it blends all these themes within lighter layers of honesty, humour, and warmth.The show not only focuses on Sam as an individual, but also his family members and loved ones as the plot leaves behind subtle questions regarding what is actually considered normal.Normal People
""Normal People"" covers several important themes, including grief, loneliness, and mental health. It has been critically acclaimed for its realistic depiction of men's mental health difficulties, something which is usually not discussed in mainstream media.While general loneliness pervades the series, the last few episodes highlight the challenges of living with mental issues. It does not undermine or exaggerate the conditions, and while it moves away from the narrative that a depressed person is supposed to stay isolated, it hints at the finer elements like the lack of energy to carry out every day mundane tasks.All the Bright Places
This show is a popular young-adult film, which explores the lives of two teenagers struggling with their individual, yet complex, issues. While Violet suffers from depression rooting from post-traumatic stress disorder (PTSD), Finch is haunted with an unnamed mental illness that has symptoms similar to bipolar disorder.Although the film does not explicitly address mental illness, it skilfully depicts how solitary, tiring and tough it can be to live with any form of mental health issue. ""All the Bright Places"" also emphasises the importance of discussing mental health, and carrying out important conversations before it's too late.The Perks of being a Wallflower
Directed by Stephen Chbosky, the plot of this film revolves around Charlie, a high school student who is haunted by past traumas, following the suicide of his friend.As the story continues, tales of childhood abuse are unveiled and he finds it extremely difficult to move on. ""The Perks of being a Wallflower"" presents a rather relatable story, with the familiar element of bottling up of emotions. The film received a lot of love from the audience, due to the strength displayed by the protagonist and the use of literature throughout the healing process.  Silver Linings Playbook
This popular film follows a person diagnosed with bipolar disorder, as he seeks treatment and recovers from an event caused by a manic episode. The main character's reluctance to acknowledge his mistakes adds to the truth of his diagnosis and the overall portrayal of his character.
At its core, ""Silver Linings Playbook"" is a love story, that also illustrates the smaller and more everyday ways in which mental health may affect a person's life. What makes this film critically acclaimed is the honest character development, coupled with truthful depictions of the disorder.
This popular film follows a person diagnosed with bipolar disorder, as he seeks treatment and recovers from an event caused by a manic episode. The main character's reluctance to acknowledge his mistakes adds to the truth of his diagnosis and the overall portrayal of his character.At its core, ""Silver Linings Playbook"" is a love story, that also illustrates the smaller and more everyday ways in which mental health may affect a person's life. What makes this film critically acclaimed is the honest character development, coupled with truthful depictions of the disorder."
/opinion/views/news/big-tech-and-our-right-know-3140071,Big Tech and our right to know,"The world observed International Day for Universal Access to Information last month, recognising the importance for every individual to be able to access information held by public institutions. Traditionally, it has been an opportunity to examine whether countries have adopted a law on access to information and if, in practice, public bodies adhere to their transparency obligations.At present, 126 countries have access to information laws. This means 91 percent of the world's population can formally request information from a state or local authority.But we know that the right to know doesn't end with the existence of a law. It is a right that empowers people to participate in decisions that affect them, a tool to hold entities that make such decisions accountable. Information is power, as we often say.However, it is not just governments that make those decisions. From the extractive industry to Big Tech, private corporations hold enormous power over individuals, both online and offline.Yet, laws do not make them accountable in the same way that access to information laws do public institutions. They are not obliged to be transparent, and individuals do not have the guarantees that the right to know gives them. So far, only data protection laws have tried to fill this gap, allowing people whose data have been processed by companies to ask how it is being used.Until very recently, the importance of the right to know for corporate transparency has been neglected, or perhaps just ignored. Nowhere is this more visible than on social media.Social media platforms are no longer considered just private companies whose users simply accept terms and conditions. They are spaces where free expression, democratic debate and participation are realised. Given their power, the transparency of Big Tech firms is becoming increasingly important.There is a massive concentration of market power in a handful of companies that have total control over the content that is distributed and consumed: they actively control, select, and censor what we see online. This much power cannot be left unchecked.The European Union (EU) has recently taken a major step towards addressing this issue, by introducing regulations in the digital sphere. The Digital Services Act is meant to ensure that users are able to choose from a wide range of products and services online, while the Digital Markets Act is aimed at allowing businesses to freely and fairly compete online. The European Commission's initiative sets transparent and clear rules for companies, and outlines sanctions if they fail to respect them.Crucially, the legislations put a strong emphasis on transparency, to shed light on issues such as the platforms' content moderation practices. That way, users can operate in a predictable environment and know the possibilities and limits on their behaviour online. Platforms will be required to explain and publish their terms of services, explain their content moderation decisions and make them publicly available.Social media companies will also have to produce transparency reports, including information about requests from governments to remove user-generated content, notices submitted to flag alleged illegal content, and information about measures against misuse. This will benefit researchers, oversight bodies, and the public who will be able to better understand how content moderation decisions are made.But while a law is a key and fundamental step, for it to be effective, it requires implementation on two sides. One, institutions need to know the law well and see it with a positive, instead of a suspicious, attitude. Second, people need to know that a law exists and that they can use it freely to ask for information.The same needs to happen with Big Tech. Companies need to understand how transparency will benefit them in the long run, through building trust with their users and the public at large.It is also crucial that users are informed about their right to know and know how to use it. This two-way awareness of transparency is a long process and we're just getting started. The road ahead is long, but one thing is clear: companies have a duty to respect human rights, and the right to know is one of them.Ilaria Fevola is ARTICLE 19's legal officer focused on transparency.
"
