URLS,Headline,Article
/news/bangladesh/transport/news/jashore-bus-owners-decide-continue-services-without-joining-khulna-strike-3148636,Jashore bus owners decide to continue services without joining Khulna strike,"Bus owners in Jashore district have decided not to join the two-day strike called by Khulna Bus Owners and Workers Association on October 21-22, ahead of opposition BNP's public rally slated for October 22.The association in Khulna called for the transport strike on 18 routes demanding the authorities to stop plying of easy-bikes and other motorised three-wheelers on the highways. However, bus owners in Jashore say they are not joining the transport strike and will continue their operations, reports our Benapole correspondent quoting Pabitra Kapudia, president of Jashore Inter-district Bus Syndicate.As usual, buses are operation on all inter-district and other long routes from Jashore, he said.However, buses are not being allowed to enter Khulna district and hence buses on Jashore-Khulna route are operating till Abhoynagar upazila, he added.Talking to The Daily Star, Selim Reza Mithu, general secretary of Bangladesh Transport Association Workers' Union, said the bus owners' bodies in Jashore and Khulna are different entities and passenger services on all long routes are normal.Terming the bus strike as a planned sabotage, Anindya Islam Amit, organizing secretary of BNP's Khulna divisional unit, said it was announced to prevent the party's rally from becoming a success.""If necessary, BNP activists will join the rally in Khulna by travelling on foot,"" he added.BNP is scheduled to hold a rally in Khulna on October 22, assembling all leaders and activists from the 10 districts under the division. Central BNP leaders including Secretary General Mirza Fakhrul Islam is expected to attend the rally."
/opinion/editorial/news/acute-gas-crisis-hurting-everyone-3148576,Acute gas crisis is hurting everyone,"There is an element of irony in the public assessment of the ongoing gas crisis – that it has reached a ""boiling point,"" given that we have hardly enough gas to burn or boil. The crisis, as per a report by this newspaper, has been affecting domestic and commercial consumers equally. And despite assurances to the contrary, it's evident that a drastic improvement in the situation is unlikely to happen anytime soon. This means people will have to go on to make painful compromises indefinitely. The crisis has been attributed to a considerable shortfall in gas supply – claimed to be 10 percent – caused by the government's decision to stop purchasing liquefied natural gas (LNG) from the international spot market in July. Its effect has been felt across the board: while households had to grapple with arbitrary and unscheduled gas rationing – unlike the more predictable load-shedding – the same in industries requiring gas to run their boilers and burners saw a significant fall in production. According to the Bangladesh Ceramic Manufacturers & Exporters Association, the ceramic industry alone has seen a 10 to 30 percent drop in production due to the ongoing crisis. Industry insiders say this has hurt their business prospects, including cancellation of orders from foreign buyers. Clearly, the government is at a critical juncture, unable to affect the outcome of global events pushing up gas prices. But at the same time, and rather inexplicably, it is unwilling to adapt itself to better cushion external shocks. 
At the CNG filling stations, there has been a five-hour daily shutdown along with insufficient gas pressure during active hours, an affliction shared by households and industries as well. To top it all off, the power sector, which consumes 42 percent of the total gas supply, had to reduce electricity generation at around 30 gas-fired plants, leading to over six hours of load-shedding a day. These problems, interlinked and mutually exacerbating as they are, have only compounded suffering. The extent of suffering becomes clear from the remark of Jummatul Bida, a resident in Dhaka's Gandaria area, who told this newspaper, ""For the last two months, we haven't got any gas from 8am till 7pm… If I can't get up very early in the morning, we either have to starve or buy food from restaurants."" 











Our own resources can help us get over the energy crisis Read more
Clearly, the government is at a critical juncture, unable to affect the outcome of global events pushing up gas prices. But at the same time, and rather inexplicably, it is unwilling to adapt itself to better cushion external shocks. These external shocks, in the form of price volatility and supply disruptions in the wake of the Russia-Ukraine war, would have been more manageable, had the government diversified its sources of energy or, better yet, not been so heavily reliant on gas imports.
The government has long rubbished calls for further exploring and extracting our own gas reserves. It has allowed a quick-fix mentality and collusive deals to compromise our energy security. This cannot happen any longer. We urge the government to take urgent steps to mitigate people's suffering. The acute gas and electricity crises must have an expiration date. The authorities should immediately engage with experts to find durable and long-term solutions to these problems.



 Clearly, the government is at a critical juncture, unable to affect the outcome of global events pushing up gas prices. But at the same time, and rather inexplicably, it is unwilling to adapt itself to better cushion external shocks. At the CNG filling stations, there has been a five-hour daily shutdown along with insufficient gas pressure during active hours, an affliction shared by households and industries as well. To top it all off, the power sector, which consumes 42 percent of the total gas supply, had to reduce electricity generation at around 30 gas-fired plants, leading to over six hours of load-shedding a day. These problems, interlinked and mutually exacerbating as they are, have only compounded suffering. The extent of suffering becomes clear from the remark of Jummatul Bida, a resident in Dhaka's Gandaria area, who told this newspaper, ""For the last two months, we haven't got any gas from 8am till 7pm… If I can't get up very early in the morning, we either have to starve or buy food from restaurants."" Clearly, the government is at a critical juncture, unable to affect the outcome of global events pushing up gas prices. But at the same time, and rather inexplicably, it is unwilling to adapt itself to better cushion external shocks. These external shocks, in the form of price volatility and supply disruptions in the wake of the Russia-Ukraine war, would have been more manageable, had the government diversified its sources of energy or, better yet, not been so heavily reliant on gas imports.The government has long rubbished calls for further exploring and extracting our own gas reserves. It has allowed a quick-fix mentality and collusive deals to compromise our energy security. This cannot happen any longer. We urge the government to take urgent steps to mitigate people's suffering. The acute gas and electricity crises must have an expiration date. The authorities should immediately engage with experts to find durable and long-term solutions to these problems."
/entertainment/theatre-arts/news/ganga-jamuna-cultural-festival-begins-grandeur-3148651,Ganga Jamuna cultural festival begins in grandeur,"After about a year, the Ganga Jamuna Cultural Festival finally returned at the premises of Bangladesh Shilpakala Academy (BSA), at 6 pm.Throughout 11 days, the festival will host a variety of plays, elocution, musical and dance performances by 172 different theatre troupes from Bangladesh and India. These plays will take place from 7pm onwards in BSA and Mahila Samity every day, until October 31.Performances will also take place at the Unmukta Mancha in the National Theatre Hall premises every day until 4 pm.Eminent thespian Manchasharathi Ataur Rahman inaugurated the opening ceremony at 6 pm, at the auditorium of the National Theatre Hall. The programme was presided by the convener of Ganga Jamuna Shangskritik Parshad, Ghulam Kuddus, while Minister of Cultural Affairs, K M Khalid, MP graced the occasion as the Chief Guest.The welcome speech for the event has been delivered by Aktaruzzaman, Member Secretary of the festival board, who also took on the role of the event's host.All dance performances at the programme was directed by Warda Rihab.Eminent cultural personalities, including the likes of Ramendu Majumdar, Asaduzzaman Noor, MP, Mamunur Rashid, Nasir Uddin Yousuff, Liaquat Ali Lucky and Md Ahkam Ullah, along with Shah Alam Sarwar, Managing Director and Chief Executive, IFIC Bank Limited, graced the occasion as special guests. The event is being arranged with the support of the Ministry of Cultural Affairs, BSA and IFIC Bank Limited.On the opening day, the following plays were staged— ""Pohela Shorbori"" produced by Theatre troupe (National Theatre Hall), ""Obhishoptop August"" by Bangladesh Police Theatre (Experimental Theatre Hall), ""Juimalar Shoimala by Nirabhoron Theatre, Manikganj (Studio Theatre Hall).""Konjush"", produced by Loko Nattyadal (Banani), was staged at Mahila Samity, on the inaugural evening."
/news/bangladesh/politics/news/govt-removing-officials-fear-losing-power-3148256,Govt doing it out of fear of losing power,"BNP Secretary General Mirza Fakhrul Islam Alamgir yesterday alleged the government is removing the government officials from their jobs out of anxiety.""The government of (Sheikh) Hasina is so anxious that they have started removing the officials… out of fear of losing power,"" he saidFakhrul made the remarks while addressing a rally in front of the BNP's Nayapaltan central office in the capital.BNP's Dhaka south and north city units organised the rally to protest against the police attacks on party leaders and activists, their arrests and harassment in ""false"" cases.The protest was also meant for registering the party's anger over police raids on the houses of opposition leaders and workers, sending them to jail in other cases despite obtaining bail from courts.Referring to a newspaper report, Fakhrul said the government is now unable to repay the loans it borrowed from abroad and different lending agencies. ""So, what will happen now? All foreign lending agencies will stop giving loans while the reserves are falling.""He categorically said the current regime has now no right to rule the country. ""You have turned the country into a failed state through corruption and misrule. You please quit power with dignity...''The BNP leader renewed their party's demands for the resignation of the government, dissolution of parliament, handing over power to a non-party neutral government and formation of a fresh election commission to conduct a credible national election and establish a government and parliament of people.At the same time, he said BNP chairperson Begum Khaleda Zia must be released and all the ""false"" cases against the opposition leaders and activists have to be withdrawn.Fakhrul alleged that the government is creating obstacles in their party's ongoing democratic movement in various ways. ""You know, transport services were stopped during our divisional rally in Mymensingh. Similarly, they are stopping public transport in Khulna two days ahead of the rally.""He said such a move of the government will not help prevent people from joining the rally. ""People will participate in the rally… lakhs of people will attend the rally.""As part of its divisional rallies, BNP will organise the rally on Sonali Bank premises in Khulna city on Saturday amid suspension of the bus services for two days. "
/nrb/migration/undocumented/news/52-migrants-including-16-bangladeshis-arrested-malaysia-3148646,52 migrants including 16 Bangladeshis arrested in Malaysia,"Malaysia's immigration authorities have arrested 52 immigrants, including 16 Bangladeshis, for not having valid documents.The Road Transport Department (RTD) handed them over to the immigration police as they did not have valid documents after making the arrests for vehicle-related offences.They were arrested yesterday (October 20, 2022) in a raid from Kuala Lumpur wholesale market. Among the arrestees, 16 were Bangladeshi nationals, 28 from Myanmar, six from Indonesia and two were from India.The arrestees were between the ages of 30 and 50.RTD Deputy Director Zulkifly Ismail told local media that the crimes of the migrants were not having driving licences and expired insurances of vehicles.During the raid, 58 vehicles including eight lorries, 12 vans, 25 motorcycles, six forklifts, and seven tricycles were seized.Later, they were shown arrested and handed over to immigration authorities.The writer is an expatriate journalist living in Malaysia"
/youth/education/campus/news/jnu-observes-17th-founding-anniv-3148101,JnU observes 17th founding anniv,"Jagannath University yesterday observed its 17th founding anniversary amid festivity and fanfare.To mark ""JnU Day"", the university chalked out elaborate programmes, including hoisting national and university flags, a procession as well as various cultural performances.JnU Vice Chancellor Md Imdadul Hoque inaugurated the day-long celebration by hoisting the national flag and releasing pigeons and balloons in front of the Shaheed Minar on the campus at 9:15am.Students, teachers and employees later joined a colourful procession."
/news/bangladesh/news/it-was-eyewash-3148286,"Stakeholders’ consultation mostly ignored in final draft of social media, OTT regulation","Even though Bangladesh Telecommunication Regulatory Commission (BTRC) had invited feedback on the draft of its new social media regulation, the finalised version shows that little or no heed was paid to the major stakeholders.Last Wednesday, BTRC gave the High Court the meeting minutes of the last three sessions held by the Regulation Formation Committee when finalising the draft of the regulation. The minutes portray that crucial feedback given by stakeholders was not even discussed, let alone adopted.The finalised ""BTRC Regulation for Digital, Social Media and OTT Platforms"" was submitted to the High Court on the same day.The final draft allows the government to order individuals to take down content, empowers it to order social media companies to block content, and grants it indemnity for its actions under the law.Over the months, Transparency International Bangladesh (TIB), Bangladesh Legal Aid Services Trust (BLAST), Global Network Initiatives and others sent feedback ringing alarm bells about the government constricting the space for free expression.BLAST, in its recommendations, had told BTRC that ""imposing restrictions on the creation and dissemination of online content will create a chilling effect on freedom of expression concerning issues of rights and justice, including by and about marginalised communities, and will inhibit democratic debate and discourse.""""The grounds on which social media intermediaries are required to take down content are similar to certain Digital Security Act provisions that have already been identified by commentators as arbitrarily restricting freedom of speech and expression,"" read the recommendations by BLAST.The grounds on which social media intermediaries are required to take down content are similar to certain Digital Security Act provisions that have already been identified by commentators as arbitrarily restricting freedom of speech and expression. BLAST, in its recommendations on the regulation
This includes content that threatens the ""unity, integrity, defence, security, or sovereignty of Bangladesh, [and its] friendly relations with foreign states"" or ""is against the Liberation War of Bangladesh, the spirit of the Liberation War, the Father of the Nation, the national anthem, or the national flag"", ""threatens the secrecy of the government"" or ""creates unrest or disorder or deteriorates the law and order situation"" or ""threatens public order"".
TIB had pointed out that requiring all social media intermediaries, tech companies, internet service providers, OTT platforms and online news publishers to get locally registered, and empowering BTRC to cancel the registration if their activities go against the regulation will put them in a bodysuit.
It said it puts foreign companies at risk of surveillance and disincentivises them from operating in Bangladesh.
These concerns -- among many others -- were not addressed and the finalised draft still retains these provisions.
The BTRC submission to the HC reads, ""It was agreed that the Regulation shall be finalised after necessary consideration and/or evaluation of the feedback/input from several concerned stakeholders in this regard.""
Yet this commitment to evaluate feedback from stakeholders is not reflected in the meeting minutes.
During the eleventh session, held on September 4, the committee reviewed the definitions of terms like ""content"", ""digital device"", ""intermediary"" and ""curated content"".
Two weeks later, on September 18, the committee met again for their twelfth session. They discussed and decided that companies that are already registered, do not need to register again. However, it did not speak of doing away with the requirement.
During this meeting, they decided to adopt one feedback made by Global Network Initiatives (GNI), a collective whose members include Meta, Microsoft, Uber, Zoom, Telenor Group, Yahoo, Google, Nokia, Vodafone, Verizon, Human Rights Watch, Wikimedia, Committee to Protect Journalists and others.
GNI had expressed alarm at the fact that the draft regulation features excessive penalties for violations, including fines of up to Tk 3 billion and/or imprisonment for up to 5 years and targets company personnel.
During the 12th meeting, the committee decided to scrap criminal liability, and include corporate liability instead. The latest draft kept intact provisions for fines if the regulations were violated but removed the ceilings that were mentioned in the previous drafts. Instead, it just added that the ""fine should not be excessive"".
In addition, during the 12th meeting, the committee dropped the section in the previous draft that forced companies to circumvent end-to-end encryption and identify ""first originators"" of any content or message sent.
Ten days later, the committee met for the 13th time, and finalised the draft, leaving key concerns up in the air.
Ashish Kumar Kundu, the director-general (legal and licensing division), who signed the meeting minutes, told this newspaper that many stakeholders were consulted and met with before this draft was finalised.
The commissioner of the division was contacted several times over the phone, but this newspaper was unable to reach him.
The grounds on which social media intermediaries are required to take down content are similar to certain Digital Security Act provisions that have already been identified by commentators as arbitrarily restricting freedom of speech and expression. This includes content that threatens the ""unity, integrity, defence, security, or sovereignty of Bangladesh, [and its] friendly relations with foreign states"" or ""is against the Liberation War of Bangladesh, the spirit of the Liberation War, the Father of the Nation, the national anthem, or the national flag"", ""threatens the secrecy of the government"" or ""creates unrest or disorder or deteriorates the law and order situation"" or ""threatens public order"".TIB had pointed out that requiring all social media intermediaries, tech companies, internet service providers, OTT platforms and online news publishers to get locally registered, and empowering BTRC to cancel the registration if their activities go against the regulation will put them in a bodysuit.It said it puts foreign companies at risk of surveillance and disincentivises them from operating in Bangladesh.These concerns -- among many others -- were not addressed and the finalised draft still retains these provisions.The BTRC submission to the HC reads, ""It was agreed that the Regulation shall be finalised after necessary consideration and/or evaluation of the feedback/input from several concerned stakeholders in this regard.""Yet this commitment to evaluate feedback from stakeholders is not reflected in the meeting minutes.During the eleventh session, held on September 4, the committee reviewed the definitions of terms like ""content"", ""digital device"", ""intermediary"" and ""curated content"".Two weeks later, on September 18, the committee met again for their twelfth session. They discussed and decided that companies that are already registered, do not need to register again. However, it did not speak of doing away with the requirement.During this meeting, they decided to adopt one feedback made by Global Network Initiatives (GNI), a collective whose members include Meta, Microsoft, Uber, Zoom, Telenor Group, Yahoo, Google, Nokia, Vodafone, Verizon, Human Rights Watch, Wikimedia, Committee to Protect Journalists and others.GNI had expressed alarm at the fact that the draft regulation features excessive penalties for violations, including fines of up to Tk 3 billion and/or imprisonment for up to 5 years and targets company personnel.During the 12th meeting, the committee decided to scrap criminal liability, and include corporate liability instead. The latest draft kept intact provisions for fines if the regulations were violated but removed the ceilings that were mentioned in the previous drafts. Instead, it just added that the ""fine should not be excessive"".In addition, during the 12th meeting, the committee dropped the section in the previous draft that forced companies to circumvent end-to-end encryption and identify ""first originators"" of any content or message sent.Ten days later, the committee met for the 13th time, and finalised the draft, leaving key concerns up in the air.Ashish Kumar Kundu, the director-general (legal and licensing division), who signed the meeting minutes, told this newspaper that many stakeholders were consulted and met with before this draft was finalised.The commissioner of the division was contacted several times over the phone, but this newspaper was unable to reach him."
/sports/football/news/man-utd-display-seasons-best-act-3148001,Man Utd display 'season's best act',"Manchester United coach Erik ten Hag hailed his side's display in their 2-0 victory over Tottenham Hotspur on Wednesday and said Cristiano Ronaldo's decision to walk down the tunnel early would be dealt with.After having two shots on target in a dire 0-0 draw with Newcastle United on Sunday at Old Trafford, the hosts looked like a different side against Spurs, dominating the match from start to finish.United had 28 shots - the most by a team in a Premier League match this season.The figure was also the most that a team managed by Antonio Conte has faced in a top-flight game, in what was the 318th league match he has taken charge of in Serie A and the Premier League.""I am pleased with the team,"" Ten Hag said. ""I think it was the best team performance this season.""You have seen today we are developing. You see how we want to play, we get better on the pitch every time. Spurs are a magnificent team so far this season, I said to the lads in the dressing room it was enjoyable to watch you.""It was a squad performance. What we have seen today, we have 11 players who defend and 11 who attack. I am pleased with that. I will not say that I am totally satisfied. That has to be the standard at Manchester United.""There was one negative for Ten Hag as unused substitute Cristiano Ronaldo walked down the tunnel before the final whistle, seemingly unhappy at not being involved once again this season.The United boss, however, did not want the incident to detract from their display.""I don't pay attention today, we will deal with that tomorrow,"" he added. ""I want to focus on this team, on these 11 players.""Against this Tottenham, you need good pressing, good counter-pressing, from there you can create chances. So you need good pressing players. Offensive wise you need that dynamic. That is what Marcus (Rashford) brings."""
